;Unnamed: 0;id Post;Comentario;Link;Classe Sentimento;rotulo;prob_NEG;prob_NEU;prob_POS
0;0;l1xfjs;Deveriam abrir mão de um leito caso peguem a Covid... não querem vacina;https://oglobo.globo.com/rio/rio-registra-recusas-da-vacina-contra-covid-19-entre-profissionais-de-saude-24847182;NEG;NEG;0.7825725674629211;0.20617245137691498;0.011255023069679737
1;1;o0n5yd;"> As pessoas ficam julgando o presidente por não ter feito lockdown, porem o stf não deixou que ele comandasse

Até hoje tem gente vendendo esta narrativa?

Porque o STF **nunca proibiu** Bolsonaro de combater a Pandemia. Desafio qualquer um me mostrar um despacho dizendo tal coisa.

O que o STF fez: De acordo com a Constituição, o dever de cuidar da Saúde é igualmente para Federação, Estados e Municípios.

O que na prática o STF fez: Bolsonaro não podia revogar medidas de combate das esferas estaduais e municipais. Mas ele estava livre para cumprir a Constituição e cuidar da Saúde dos brasileiros.

Coisa que eles não fez e inventou que o STF proibiu. Os idiotas acreditaram.

> único jeito seria um golpe botando o exercito na rua

Para fazer o que? Obrigar as pessoas a saírem de casa? Eles arrombariam as portas e obrigariam as pessoas a saírem?

Sobre a Argentina: parem de usar o país como exemplo que lockdown não funciona. Durante os primeiros meses de 2020, o argumento é inverso: Tanto funcionou que a Argentina não teve uma “primeira onda” quando todos os demais países estavam tendo.

O que deu de errado é que a flexibilização deu errado e a Pandemia se espalhou para o exterior. Quando bateu a fadiga da Pandemia nos grandes centros, aconteceu a tragédia.

Enquanto isto, temos o exemplo da Nova Zelândia que aplicou apenas medidas de isolamento e foi o primeiro país do mundo a controlar a Pandemia, **sem vacinas**.";https://www.reddit.com/r/brasilivre/comments/o0n5yd/o_porquê_de_eu_não_achar_bolsonaro_genocida/;NEU;NEU;0.313669353723526;0.6040645241737366;0.08226603269577026
2;2;no0ytb;"> As pessoas ficam julgando o presidente por não ter feito lockdown, porem o stf não deixou que ele comandasse

Até hoje tem gente vendendo esta narrativa?

Porque o STF **nunca proibiu** Bolsonaro de combater a Pandemia. Desafio qualquer um me mostrar um despacho dizendo tal coisa.

O que o STF fez: De acordo com a Constituição, o dever de cuidar da Saúde é igualmente para Federação, Estados e Municípios.

O que na prática o STF fez: Bolsonaro não podia revogar medidas de combate das esferas estaduais e municipais. Mas ele estava livre para cumprir a Constituição e cuidar da Saúde dos brasileiros.

Coisa que eles não fez e inventou que o STF proibiu. Os idiotas acreditaram.

> único jeito seria um golpe botando o exercito na rua

Para fazer o que? Obrigar as pessoas a saírem de casa? Eles arrombariam as portas e obrigariam as pessoas a saírem?

Sobre a Argentina: parem de usar o país como exemplo que lockdown não funciona. Durante os primeiros meses de 2020, o argumento é inverso: Tanto funcionou que a Argentina não teve uma “primeira onda” quando todos os demais países estavam tendo.

O que deu de errado é que a flexibilização deu errado e a Pandemia se espalhou para o exterior. Quando bateu a fadiga da Pandemia nos grandes centros, aconteceu a tragédia.

Enquanto isto, temos o exemplo da Nova Zelândia que aplicou apenas medidas de isolamento e foi o primeiro país do mundo a controlar a Pandemia, **sem vacinas**.";https://www.reddit.com/r/CoronavirusPT/comments/no0ytb/19_vacinação_5_milhões_de_doses_num_bracinho/;POS;NEU;0.313669353723526;0.6040645241737366;0.08226603269577026
3;3;oqlyar;Eu marquei na terça-feira da semana passada. Confirmei na sexta-feira da semana passada e levei ontem. Demorei cerca de 15min a entrar, preencher o papel, sentar-me e levar a vacina. 30min depois estava despachado. Até agora tem sido impecável com toda a gente que conheço. Alguns demoram mais tempo a receber confirmações que outros mas no geral 5 estrelas;https://www.reddit.com/r/portugal/comments/oqlyar/para_quê_marcar_vacinação_covid19_no_site/;POS;POS;0.01653274893760681;0.06168610602617264;0.9217811226844788
4;4;gw4b3i;"Vou responder o que sei:

1- são vírus diferentes, podem atacar seu corpo ao mesmo tempo sim... O problema é que você nao vai nem mesmo saber que está gripado, os sintomas da covid vao escalar mais rapido do uma gripe e serão mais graves.

2- a vacina é feita através de um antígeno para o organismo, ou seja, pegam pedaços da capsula viral (sem o dna viral, entao os antivax ja podem dar o fora). Ao entrar no seu sangue, esses pedaços de cápsula são corretamente interpretados pelo seu corpo como invasores, mas seu corpo nao sabe que o dnv viral nao está la... Entao ele começa a agir contra o suposto vírus (aqui entra uma boa explicação, esses são os motivos dos efeitos colaterais das vacinas, a resposta imune do nosso corpo atuando contra o ""virus"" que entrou no nosso corpo... Depois que o sistema imunológico faz uma ""ficha"" do vírus, ele consegue produzir anticorpps específicos para neutralizar ele... Agora sobre a pergunta: não importa onde esses pedaços de virus estao, seu sistema imunológico vai la e faz a ficha dele pra poder combater, mas como são algumas proteínas que formam a capsula, logo elas são eliminadas... Maaaas seu corpo continua com essa ficha dentro dele por um bom tempo, e quando o vírus de verdade entrar no corpo, seu sistema imunológico já sabe o que fazer, independente do lugar 

3- Essa possibilidade sempre existe, mas não parece que é a nossa situação, a vacina já está em andamento e promete ser a mais rapida ja produzida na historia. Ainda não se sabe se o vírus pode reinfectar as pessoas, poucos casos foram registrados ao redor do mundo e ainda é algo a ser pesquisado a fundo.

Agora uma msg pessoal: tome a vacina se puder, o seu corpo pode enfrentar a gripe como se não fosse nada, mas existem pessoas que não possuem essa sorte, biologicamente falando mesmo, se vacinar é salvar a vida dessas pessoas tambem... Mesmo que todo ano, por que os vírus são mutaveis e o da gripe muta mais rapido que nossas ações. Mas cada virus sofre mutações em uma velocidade diferente, então precisa de muito estudo mesmo pra afirmar se o corna irá mutar no futuro ou não";https://www.reddit.com/r/coronabr/comments/gw4b3i/se_for_infectado_por_gripe_e_covid_ao_mesmo_tempo/;NEU;POS;0.3219234347343445;0.6321465373039246;0.04593002796173096
5;5;oz4bg3;Segundo o mesmo site, estamos em 26º no mundo em relação a pessoas com a vacinação completa (59.11%) e em 21º com apenas 1 dose (70.22%).;https://www.reddit.com/r/portugal/comments/oz4bg3/portugal_atinge_os_70_de_população_total_com_pelo/;NEU;NEU;0.02861057221889496;0.9437322020530701;0.027657238766551018
6;6;ry5d9r;Arriscando pegar câncer, fui ver os comentários de uma notícia semelhante no Facebook e tinha um animal dizendo que vacinar os filhos é sacrificar ao Moloch. Vocês têm ideia que é um deus super antigo de uma civilização humana? Eram os amonitas da Bíblia. Esta gente come merda, só pode;https://www.poder360.com.br/poderdata/poderdata-71-vacinariam-um-filho-contra-a-covid-19/;NEG;NEU;0.9538059830665588;0.02794143185019493;0.018252605572342873
7;7;sh7ua0;"Centenas de milhares de pessoas voltaram a protestar neste sábado em toda a [França](https://brasil.elpais.com/noticias/francia/) contra as medidas do Governo de [Emmanuel Macron](https://brasil.elpais.com/noticias/emmanuel-macron/) para impulsionar a vacinação contra o coronavírus, [principalmente o certificado covid-19 que já está em vigor há quase uma semana](https://brasil.elpais.com/sociedade/2021-08-08/passaporte-covid-19-se-impoe-no-dia-a-dia-de-21-paises-europeus.html) e a vacinação obrigatória dos profissionais de saúde. Segundo o Ministério do Interior, quase 215.000 pessoas foram às ruas pelo quinto sábado seguido para mostrar sua oposição ao que consideram uma “ditadura sanitária”, embora o [recrudescimento da pandemia](https://brasil.elpais.com/sociedad/2021-07-29/queda-na-taxa-de-imunizacao-em-paises-ricos-da-impulso-a-medidas-coercitivas-para-aqueles-que-nao-sao-vacinados.html) tenha levado a novos confinamentos e provocado saturação hospitalar em territórios ultramarinos, nos quais a taxa de vacinação é muito menor do que na França continental.

[***Apoie nosso jornalismo. Assine o EL PAÍS clicando aqui***](https://suscripciones.elpais.com/para-conhecer/)

A participação nos protestos foi um pouco menor do que o previsto —a imprensa tinha citado fontes oficiais que previam 250.000 pessoas— e também ficou levemente abaixo do total mobilizado na semana passada, quando foi registrado um pico de 237.000 manifestantes. Mesmo assim, os observadores destacaram a [capacidade de mobilização de um protesto social](https://brasil.elpais.com/internacional/2020-04-14/o-protesto-se-nega-a-morrer.html) sem líderes claros e em pleno período de férias.

O Governo insiste há dias que o número de pessoas que se vacinam a cada semana é muito maior do que o de manifestantes que saem às ruas para protestar. Macron reiterou nesta semana seu objetivo de chegar a 50 milhões de cidadãos que tenham recebido [pelo menos uma dose de vacina](https://brasil.elpais.com/sociedade/2021-08-08/os-estados-unidos-que-nao-se-vacinam-e-mais-se-contagiam.html?rel=listapoyo) até o fim deste mês. No entanto, segundo a imprensa francesa, o fato de as manifestações não diminuírem começa a causar inquietação em um Executivo que conhece em primeira mão o desgaste causado por protestos de longa duração, como os dos “coletes amarelos” em 2018 e 2019, e já está de olho, assim como todos os partidos, nas eleições presidenciais que serão realizadas daqui a menos de um ano, em abril.

Os novos protestos —foram convocados cerca de 200 em todo o país —ocorrem quando o certificado sanitário já vigora há quase uma semana, enquanto nos territórios ultramarinos, novamente confinados, a situação se agrava. As autoridades começaram a exigir na segunda-feira que [a pessoa apresente uma prova de vacinação completa](https://brasil.elpais.com/opiniao/2021-08-14/como-acaba-a-pandemia-e-por-que-mais-especialistas-estao-otimistas.html), um teste negativo recente ou um certificado de que se recuperou do coronavírus para que possa entrar em bares e restaurantes —inclusive em áreas abertas—, embarcar em um voo interno ou um trem de longa distância e até mesmo visitar um paciente ou acompanhar alguém ao hospital. A exigência já vigorava desde 21 de julho para museus, cinemas e teatros, e a partir da próxima segunda-feira valerá também para ter acesso shopping centers de mais de 20.000 metros quadrados nas regiões onde a taxa de incidência passe de 200 casos por 100.000 habitantes. A medida também afetará nove centros comerciais em Paris, entre eles as emblemáticas Galerias Lafayette, como anunciou neste sábado a polícia. Em todo o país, 104 lojas e shoppings terão de exigir o controle sanitário a partir de segunda-feira, segundo a agência France Press.

Em um raro pronunciamento público no início de uma reunião do conselho de defesa sanitária —geralmente realizada a portas fechadas, em mais um sinal da preocupação gerada pelos protestos—, Macron afirmou na quarta-feira que o certificado covid-19 é um mal menor. “É isto ou o fechamento do país, um novo toque de recolher ou um confinamento”, advertiu, ressaltando que [a crise sanitária ainda não foi superada](https://brasil.elpais.com/internacional/2021-08-13/a-incognita-da-terceira-dose-da-vacina-sera-necessaria-para-os-idosos.html) e que as vacinas “são a maior proteção contra as internações”. A prova disso, segundo o Governo, é a situação crítica em territórios ultramarinos como Guadalupe e Martinica, novamente confinados e com os hospitais saturados pelos novos casos de covid-19, o que exigiu o envio de pessoal médico extra para essas localidades.

  Apoie a produção de notícias como esta. Assine o EL PAÍS por 30 dias por 1 US$

 [Clique aqui](https://apiservices.krxd.net/click_tracker/track?kx_event_uid=NqJG0P8a&kx_distribuidor=redaccion&kx_origen=elpais&kx_disciplina=editorial&kx_formato=ctamedio&kx_creatividad=maradona&kx_formato_creatividad=ctamedio_maradona&kx_landing_destino=BRASIL&clk=https://brasil.elpais.com/assinaturas/#/campaign?prm=elpais_redaccion_epmas_editorial_ctamedio_maradona_BRASIL) *Inscreva-se *[*aqui*](https://plus.elpais.com/newsletters/lnp/3/375/)* para receber a newsletter diária do EL PAÍS Brasil: reportagens, análises, entrevistas exclusivas e as principais informações do dia no seu e-mail, de segunda a sexta. *[*Inscreva-se*](https://plus.elpais.com/newsletters/?cp=3)* também para receber nossa newsletter semanal aos sábados, com os destaques da cobertura na semana.*";https://brasil.elpais.com/internacional/2021-08-14/215000-franceses-protestam-pela-quinta-semana-seguida-contra-o-certificado-covid-19.html;NEU;NEU;0.03702801838517189;0.9122803807258606;0.050691645592451096
8;8;oeiasn;Fizeram algum lockdown ou  fechamento além  da vacinação?;https://g1.globo.com/sp/bauru-marilia/noticia/2021/07/05/botucatu-registra-queda-de-81percent-dos-casos-de-covid-19-apos-vacinacao-em-massa-com-a-oxfordastrazeneca.ghtml;NEU;NEU;0.09952110797166824;0.890960693359375;0.009518219158053398
9;9;rhay7l;Aguardo ansiosamente para que abram a vacinação contra o covid para animais de estimação.;https://24.sapo.pt/atualidade/artigos/covid-19-cerca-de-48-mil-criancas-agendadas-para-vacinacao-no-fim-de-semana;POS;POS;0.03279896825551987;0.45867419242858887;0.5085268020629883
10;10;lnumhk;Sobre Covid não sei, mas tenho uma amiga que uma vez foi vacinada contra a gripe e ficou tão mal, tão mal, tão mal que jurou nunca mais tomar uma vacina na vida. Disse que foi a maior gripe que apanhou na vida. Ia morrendo.;https://www.reddit.com/r/portugal/comments/lnumhk/efeitos_secundários_vacinação_covid19/;NEG;NEG;0.9237371683120728;0.05851399526000023;0.017748873680830002
11;11;krz110;"#[Clique aqui para não dar views ou ler sem paywall.](https://archive.today/?run=1&url=https://gauchazh.clicrbs.com.br/saude/noticia/2021/01/ministro-da-saude-prepara-pronunciamento-nesta-quarta-sobre-como-funcionara-o-plano-de-vacinacao-contra-covid-19-ckjlyr8za001k017whlis2x8o.html)

Apoie o jornalismo brasileiro, [assine o jornal](https://caiowzy.github.io/pulaCerca/assine?origem=https://gauchazh.clicrbs.com.br/saude/noticia/2021/01/ministro-da-saude-prepara-pronunciamento-nesta-quarta-sobre-como-funcionara-o-plano-de-vacinacao-contra-covid-19-ckjlyr8za001k017whlis2x8o.html).  
[^(Código-fonte)](https://github.com/CaioWzy/pulaCerca/)


*I am a bot, and this action was performed automatically. Please [contact the moderators of this subreddit](/message/compose/?to=/r/brasilivre) if you have any questions or concerns.*";https://gauchazh.clicrbs.com.br/saude/noticia/2021/01/ministro-da-saude-prepara-pronunciamento-nesta-quarta-sobre-como-funcionara-o-plano-de-vacinacao-contra-covid-19-ckjlyr8za001k017whlis2x8o.html;NEU;NEU;0.06216295436024666;0.8808110952377319;0.057025931775569916
12;12;jas6sq;Pelo menos se o grupo de risco for vacinado em 2021 devemos ter menos mortes;https://www.reddit.com/r/coronabr/comments/jas6sq/a_vicediretorageral_da_oms_organização_mundial_da/;NEU;NEU;0.07815953344106674;0.865874171257019;0.055966299027204514
13;13;l5gslo;"TJDFT, MP e Defensoria Pública também pressionam por prova de vida só depois da vacina

Órgãos de controle avaliam ação judicial para suspender a medida, caso o GDF não garanta condições de segurança sanitária aos idosos



https://www.metropoles.com/distrito-federal/tjdft-mp-e-defensoria-publica-tambem-pressionam-por-prova-de-vida-so-depois-da-vacina";https://www.reddit.com/r/coronabr/comments/l5gslo/sindnapi_aciona_tribunais_de_todo_o_país_para/;NEU;NEU;0.10767698287963867;0.84413743019104;0.048185646533966064
14;14;ikoqqv;"Assim como a maioria esmagadora da população, eu estou aguardando ansiosamente pela vacina. Eu discordo de quem acha melhor não se vacinar  (pra falar a verdade não conheço, pessoalmente, ninguém com essa crença). 

Porém, obrigar uma pessoa em sã consciência a tomar uma vacina contra a vontade dela me parece algo que o Estado NÃO deveria ter o poder de fazer. Eu não confio tanto assim nos políticos para dar a eles esse tipo de poder. No final do dia, eu confio no MEU JULGAMENTO do que é melhor pra mim. Tirar o poder de decisão do outro é tirar o meu próprio poder de decisão. Por mais que eu discorde, e ache um erro, nao sei vocês, mas eu prefiro continuar com o poder de decisão.

Apesar de estar postando isso, eu não acredito que a quantidade de pessoas que deixarão de tomar a vacina (por vontade/crença) seja grande o suficiente para comprometer o combate à doença. Me preocupa muito mais a quantidade enorme de pessoas dispostas a abrir mão desse tipo de poder e cede-lo aos políticos, cuja grande maioria não se pode confiar para praticamente nada.";https://i.imgur.com/HW9OWAG.png;NEG;NEG;0.5852385759353638;0.2868177890777588;0.12794362008571625
15;15;r4wwpa;Os vacinados transmitem o vírus tanto como os não vacinados, o certificado não tem lógica alguma e é só uma política altamente discriminatória.;https://multinews.sapo.pt/noticias/covid-19-comissao-europeia-analisa-exigencia-de-teste-com-o-certificado-digital-do-governo-portugues-mas-deixa-dois-avisos/;NEG;NEG;0.9731703996658325;0.023454120382666588;0.003375403117388487
16;16;o7qmw3;Que nem a taxa de mortalidade para quem tem 0\~55 anos é de 99,998%? Entendi, pelo visto a vacina não foi tão eficaz assim...;https://v.redd.it/s6yqawhypf771;NEU;NEG;0.29580461978912354;0.6863008737564087;0.0178945604711771
17;17;t9v5oo;" O Brasil registrou nesta terça 518 mortes por Covid-19, elevando para 652.936 o total de vidas perdidas no país para o coronavírus. Já a média móvel foi de 460 óbitos, 43% menor que o cálculo de duas semanas atrás, o que demonstra tendência de queda. Três estados não registraram óbitos.

**Infográfico**: [Veja como está a epidemia de Covid-19 no seu Estado](https://infograficos.oglobo.globo.com/sociedade/painel-do-coronavirus-nos-estados.html)

Os dados são do consórcio formado por O GLOBO, Extra, G1, Folha de S.Paulo, UOL e O Estado de S. Paulo e reúne informações das secretarias estaduais de Saúde divulgadas diariamente até as 20h. A iniciativa dos veículos da mídia foi criada a partir de inconsistências nos dados apresentados pelo Ministério da Saúde.

O país também registrou 78.374 casos de Covid-19 nas últimas 24 horas, totalizando 29.144.964 infectados pelo coronavírus desde o começo da pandemia. A média móvel foi de 47.928 diagnósticos positivos, 59% menor que o cálculo de 14 dias atrás, o que demonstra tendência de queda.

 Os números de casos e mortes foram atualizados em 27 estados.

A ""média móvel de 7 dias"" faz uma média entre o número do dia e dos seis anteriores. Ela é comparada com média de duas semanas atrás para indicar se há tendência de alta, estabilidade ou queda dos casos ou das mortes. O cálculo é um recurso estatístico para conseguir enxergar a tendência dos dados abafando o ruído"" causado pelos finais de semana, quando a notificação de mortes se reduz por escassez de funcionários em plantão.

Vacinação
---------

Ao todo, 24 unidades federativas do Brasil atualizaram seus dados sobre vacinação contra a Covid-19 nesta terça. Em todo o país, 173.391.638 pessoas receberam a primeira dose de um imunizante, o equivalente a 80,71% da população brasileira. A segunda dose da vacina, por sua vez, foi aplicada em 156.528.848 pessoas, ou 72,86% da população nacional. Já 67.241.040 pessoas receberam uma dose de reforço.

**Vacinômetro**: [Saiba como avança a campanha de vacinação no Brasil e em outros países](https://infograficos.oglobo.globo.com/brasil/vacinometro-covid-19.html)

Nas últimas 24h foi registrada a aplicação de um total de 1.128.582 doses de vacinas contra a Covid-19. Foram 119.559 primeiras doses, 274.654 segundas doses, 5.822 doses únicas e 728.547 doses de reforço.

 Até o momento, ao menos 10.043.713 crianças de 5 a 11 anos já receberam a primeira dose contra a Covid-19. Esse valor representa 48,99% da faixa etária. A vacinação infantil nas capitais tem avanço desigual, falhas de registro e atraso nos dados. Por isso, as estatísticas podem estar aquém da realidade. Apenas 2,6% das crianças dessa faixa etária receberam a segunda dose.";https://oglobo.globo.com/saude/brasil-registra-518-mortes-por-covid-nesta-terca-total-sobe-para-652936-desde-inicio-da-pandemia-25424353;NEU;NEU;0.10513034462928772;0.8681026697158813;0.026767093688249588
18;18;y1d82q;">A nossa política de combate ao HPV é horrível:
>
> • A comparticipação é limitada a rapazes até aos 12 anos (nascidos depois de 2009) e raparigas até aos 17 (iniciando a primeira dose aos 17, podem tomar as seguintes até aos 26);
>
> • Fora de comparticipação, cada dose de um total de 3 doses custa cerca de €130, dando um total de cerca de €390 para se ser vacinado

A saúde custa muito dinheiro ao estado e os gastos têm que ser o mais racionais possíveis. O hpv não é assim tão comum nem é um risco tão grande.

Pelas contas que tenho o custo da vacina é 390 euros (mais gastos administrativos e de pessoal), vezes 10 milhões de habitantes dá 3900 milhões de euros.

Eu sei que parece que a saúde é grátis mas não é.";https://www.reddit.com/r/portugal/comments/y1d82q/vamos_falar_de_hpv_novamente/;NEG;NEG;0.9306245446205139;0.06201471760869026;0.007360743824392557
19;19;1fnzh39;"Vale ressaltar que existem estudos, promissores inclusive, numa vacina para a dependência química (https://site.cff.org.br/noticia/Noticias-gerais/24/10/2023/do-brasil-vacina-da-ufmg-contra-a-dependencia-de-cocaina-e-crack-vence-premio-internacional#:~:text=A%20pesquisa%20da%20vacina%20Calixcoca,e%20superou%20outros%2011%20finalistas.)


A respeito do transporte, não houve aumento nos ônibus, que são de competência da prefeitura. O aumento para 5 reais foi no metrô e no trem, que são de competência do governo do estado.

Mais tarde leio com mais calma suas ponderações e resumo.";https://www.reddit.com/r/brasil/comments/1fnzh39/eu_li_os_planos_de_gov_de_todos_os_candidatos_de/;NEU;NEU;0.056719549000263214;0.8873005509376526;0.055979907512664795
20;20;1cf0to8;Existe mais gente que arrepende de ter tomado a vacina do que gente que se arrepende de não  ter tomado, conseguem  explicar  isso?;https://www.reddit.com/r/portugueses/comments/1cf0to8/quantos_médicos_conhecem_pessoalmente_contra_a/;NEG;NEG;0.5916115641593933;0.3830963373184204;0.025292174890637398
21;21;s26tlk;"""Agendamentos subiram de 1,5 mil para mais de 6 mil por dia na província canadense, que é a 2ª mais populosa do país. Governo agora planeja cobrar imposto de quem não se vacinar.   


O número de pessoas que se inscreveu para receber a primeira dose de uma vacina contra a Covid-19 aumentou mais de 400% em apenas uma semana em Quebec, segundo o Ministro da Saúde da província canadense, Christian Dubé.
  

  
O crescimento aconteceu após o anúncio de restrições na venda de álcool e maconha – que é legalizada para fins recreativos no país desde 2018 – a não vacinados. Quebec é a segunda província mais populosa do Canadá. \[...\]"" - G1";https://g1.globo.com/mundo/noticia/2022/01/12/taxa-de-vacinacao-cresce-quatro-vezes-em-quebec-apos-exigencia-de-comprovante-para-comprar-alcool-e-maconha.ghtml;NEU;NEU;0.07734629511833191;0.8545621037483215;0.06809154897928238
22;22;mr45kg;Nesse ritmo vai levar uns 2 anos e meio pra vacinar todo mundo com a 1ª dose.;https://diariodosudoeste.com.br/brasil/vacinados-contra-a-covid-19-no-brasil-chegam-a-249-milhoes-1179-da-populacao/;NEU;NEU;0.12186077237129211;0.8296120166778564;0.04852719232439995
23;23;qzihk4;Acho que sim, vacinação obrigatória da família dela, mas com chumbo. E quem é esta vaca para dizer o que devo ou não fazer? Liberdade de escolha é só para aborto e eutanásia?;https://sicnoticias.pt/especiais/vacinar-portugal/2021-11-22-Ana-Gomes-defende-vacinacao-obrigatoria-contra-a-covid-19-4606a477;NEG;NEG;0.9424840211868286;0.051999639719724655;0.005516419652849436
24;24;io7a8s;Eu já me cansei de discutir essas merdas, só jogo o link do [boatos.org](https://www.boatos.org/saude/robert-f-kennedy-jr-texto-aponta-vacina-mrna-contra-covid-19-dna.html) e leia quem ler. E tem que ser do boatos.org, porque se for Agência Lupa eles dizem que é fake news financiada pelo George Soros.;https://www.reddit.com/r/brasil/comments/io7a8s/pessoal_aqui_o_que_estão_passando_no_whatsapp/;NEG;NEU;0.9308444261550903;0.05771211162209511;0.011443446390330791
25;25;pphpi5;Deveriam no mínimo alertar sobre os riscos das vacinas experimentais, e deixar cada um decidir. O que estão fazendo de manter as pessoas na ignorância é criminoso.;https://www.cnnbrasil.com.br/saude/governo-recomenda-suspensao-de-vacinacao-contra-covid-de-jovens-sem-comorbidades/;NEG;NEG;0.9796679019927979;0.014257196336984634;0.006074907258152962
26;26;qh5msp;Minha preocupação são os países ricos acumulando vacinas que não vão usar, e os países mais pobres que mal começaram a vacinação, ou talvez sequer tenham começado. Esses lugares são terreno fértil pra novas variantes.;https://www.reddit.com/r/brasil/comments/qh5msp/vacinação_concluída_covid_será_endemico_e_agora/;NEU;NEU;0.4760287404060364;0.48695725202560425;0.03701400384306908
