;Unnamed: 0.1;Unnamed: 0;id Post;Link;Contexto;Classe Sentimento;rotulo;prob_NEG;prob_NEU;prob_POS
0;0;395;pxbwf4;https://economia.uol.com.br/noticias/reuters/2021/09/28/bolsonaro-diz-que-brasil-e-rico-e-indica-possivel-extensao-do-auxilio-emergencial.htm;Bolsonaro diz que Brasil é rico e indica possível extensão do auxílio;NEU;NEU;0.031217247247695923;0.9534417986869812;0.015340962447226048
1;1;78;1k6a7ph;https://i.redd.it/uyfdr3iienwe1.png;Vocês já pararam para pensar que os 54,3 milhões de pessoas que recebem bolsa família, não entram no calculo oficial de desempregados? oficialmente a taxa de desemprego no Brasil é de 6.2% (6,8 milhões) se beneficiários fossem considerados desempregados a taxa de desemprego ficaria em 55,5%. Ah mas quem recebe bolsa família pode ter um emprego com carteira assinada, pode desde que a renda per capta não ultrapasse 218 reais por pessoa, o que é igual a 6 membros em uma família, apenas 5% da população no Brasil é composta por mais de 6 membros familiares. ;NEU;NEU;0.14445282518863678;0.8205516934394836;0.03499554842710495
2;2;278;yg78sk;https://i.redd.it/y8fb6ft33pw91.jpg;Bolsonaro no debate se o congresso não tivesse forçado a aprovação do auxílio Brasil:;NEU;NEU;0.36044368147850037;0.6062487363815308;0.033307552337646484
3;3;305;xn0p1f;https://g1.globo.com/economia/noticia/2022/09/24/datafolha-3-em-cada-4-beneficiarios-do-auxilio-brasil-usam-o-dinheiro-para-comprar-comida.ghtml?utm_source=share-universal&utm_medium=share-bar-app&utm_campaign=materias;Datafolha: 3 em cada 4 beneficiários do Auxílio Brasil usam o dinheiro para comprar comida;NEU;NEU;0.02686566859483719;0.9389961957931519;0.03413808345794678
4;4;325;um686y;https://www.istoedinheiro.com.br/petrobras-rende-r-447-bi-ao-governo-cinco-vezes-o-orcamento-do-auxilio-brasil/;Petrobrás rende R$ 447 bi, 5 vezes orçamento do Auxílio Brasil ;NEU;NEU;0.027583925053477287;0.9277845025062561;0.044631604105234146
5;5;289;xvc1qa;https://oglobo.globo.com/economia/noticia/2022/10/um-dia-depois-de-confirmado-o-segundo-turno-governo-decide-antecipar-pagamento-do-auxilio-brasil.ghtml;Um dia depois de confirmado o segundo turno, governo decide antecipar pagamento do Auxílio Brasil ;NEU;NEU;0.055526405572891235;0.922091543674469;0.02238202840089798
6;6;218;1h1g74y;https://portalrbn.com.br/caixa-paga-bolsa-familia-a-beneficiarios-com-nis-de-final-8/?feed_id=10824&_unique_id=6747969a07986;Caixa paga Bolsa Família a beneficiários com NIS de final 8;NEU;NEU;0.04149923846125603;0.922598123550415;0.035902656614780426
7;7;82;1ic1zgn;https://v.redd.it/6dakjyx5pqfe1;Pegou o Bolsa Família, e agora? Comida ou Jogo do Tigrinho? ;NEU;NEG;0.06564231216907501;0.9208874702453613;0.013470189645886421
8;8;432;exfwms;https://brasil.elpais.com/brasil/2020-01-31/governo-bolsonaro-nao-explica-tamanho-real-da-fila-do-bolsa-familia.html;Governo Bolsonaro não explica tamanho real da fila do Bolsa-familia;NEU;NEU;0.12689906358718872;0.8560527563095093;0.017048176378011703
9;9;402;m1gh1c;https://www.reddit.com/r/coronabr/comments/m1gh1c/como_o_mercado_financeiro_apóia_o_bolsonarismo/;"Como o Mercado Financeiro apóia o Bolsonarismo nas medidas contrárias ao combate da COVID-19, e lucra com isso. O The Intercept Brasil fez uma [reportagem muito interessante sobre o papel do Mercado em reforçar o ataque a medidas de combate como o Lockdown](https://theintercept.com/2021/03/07/xp-empiricus-faria-lima-auxilio-emergencial/), por exemplo, gerando essa imensa catástrofe humanitária que estamos passando. 

Segue, abaixo, uma parte com grifos meus:

>O presidente da República não está só no boicote à saúde pública. Ele  conta com o apoio da frieza do mercado, que transforma brasileiros  mortos em um mero número de uma planilha de Excel.  
>  
>**Enquanto empresas quebram** com a pandemia, esses investidores estão lucrando com ela. **O BTG Pactual, fundado por Paulo Guedes,** [**teve um lucro líquido**](https://www.moneytimes.com.br/lucro-do-btg-pactual-cresce-245-no-quarto-trimestre-e-soma-r-1258-bilhao/)  **de mais de 4 bilhões de reais em 2020.** A expectativa para 2021 é que  essa cifra aumente para 5 bilhões de reais. A XP Investimentos teve  lucro líquido em 2020 111% maior que o ano anterior, [chegando a 2,27 bilhões](https://www.infomoney.com.br/mercados/lucro-liquido-ajustado-da-xp-inc-tem-alta-de-111-em-2020-e-vai-a-r-227-bilhoes/) de reais.  
>  
>Enquanto nadam em dinheiro como Tio Patinhas, defendem que o “melhor  cenário” é o pagamento de um auxílio emergencial o mais modesto possível  para socorrer os mais pobres. Um bom auxílio emergencial salvaria  muitas vidas e ajudaria as pessoas a ficarem mais em casa, mas isso não  sensibiliza os jogadores do cassino.  
>  
>[Para Zeina Latif](https://congressoemfoco.uol.com.br/governo/zeina-latif-reforma-administrativa-nao-pode-vilanizar/),  que foi economista-chefe da XP e já ocupou cargos importantes no  mercado financeiro, o problema da vacinação no Brasil não é fruto do  boicote bolsonarista, mas da “nossa burocracia estatal”. Para ela, “não  se trata de (falta) de dinheiro, não se trata de vontade política, mas  da máquina que não funcionou”.  
>  
>Para a economista, trata-se de uma questão de gestão, e não de  vontade política. Estamos falando do país que até a chegada da tragédia  bolsonarista era [referência mundial ](https://portal.fiocruz.br/en/node/74687)em  vacinação. A “burocracia estatal” nunca foi um empecilho nessa seara.  **Nem mesmo o fato do país estar empilhando cadáveres faz com que o  mercado largue a agenda do estado mínimo e responsabilize diretamente  Bolsonaro.** Afinal de contas, o mercado financeiro o elegeu por se sentir  muito bem representado por Paulo Guedes.

Leitura muito interessante, para ter uma compreensão maior de como nós não temos acesso a UTIs ou Vacinas, mas a mamãezinha do Bolsonaro já tomou as duas doses da Coronavac.   


Seus avós ou pais tiveram acesso a vacina? 

PS: Obrigado à moderação por apagar o link e me motivar à fazer uma edição melhor e com mais conteúdo.";NEU;NEU;0.053459059447050095;0.5887446403503418;0.3577963709831238
10;10;290;wtbxqr;https://www.reddit.com/r/brasil/comments/wtbxqr/uma_assistente_social_me_informou_que_o_tempo_de/;Uma assistente social me informou que o tempo de espera para a resposta do Auxílio Brasil é de sete meses Um mês pra documentação chegar ao governo, mais seis meses para a avaliação. Eu entendo que existe uma fila grande, mas essa demora é realmente justificável? O que acontece com as famílias que dependeriam com urgência do auxílio?;NEG;NEU;0.5613701343536377;0.3853784501552582;0.05325143411755562
11;11;75;1fqod7c;https://v.redd.it/vvo9gwkdycrd1;E o bolsa família tá como ?;NEU;NEU;0.3296932876110077;0.6536107659339905;0.01669597066938877
12;12;225;12ze833;https://www.reddit.com/r/brasil/comments/12ze833/meu_pai_é_bolsonarista_roxo_e_frauda_o_bolsa/;"MEU PAI É BOLSONARISTA ROXO E FRAUDA O BOLSA FAMILIA! pra tu receber o bolsa familia se precisa de renda per capta de 218 reais por pessoa e no cadastro do cras consta que temos uma renda de 100 reais por pessoa sendo que nós temos uns 600-700 reais por pessoa! E nesse cadastro não consta o meu irmão pq ele é registrado.

Mano, que absurdo um homem que fica puxando saco de bolsonaro que é extremamente avesso a politicas publicas ouse fraudar um programa social de distribuição de renda

&#x200B;

E como eu sei disso? to participando de um processo seletivo pra um auxilio permanencia estudantil da faculdade e eles pedem uma bagatela de documentos e eu tenho mais essa, agora eu to com um puta medo de ser indeferido pq meu pai frauda o bolsa familia

&#x200B;

**Edit:** 

Então, todo mundo dizendo que bolsonarista é corrupto ou q eu deveria denunciar ele mas eu conheço o meu pai e sei que esse dinheiro ia fazer uma puta falta em casa pq ninguém aqui tem carteira assinada.

Esses casos de corrupção dos povos mais pobres n é nada mais nada menos do que um instinto em busca de uma vida mais digna. Claro que abnegar desse dinheiro em prol de uma justiça social mais ampla é mt mais bonito mas e quando as contas chegam e a barriga ronca, tu abre a dispensa e só tem fubá pra comer e na geladeira tem agua gelada e uns ketchup velho, como que faz?

Meu pai tem uma cabeça conservadora de emprego onde da pra se aposentar em uma função mas o mercado dele esta péssimo e ele n se reinventou, profissionalizou e nem migrou. Ta envelhecendo e n existe politicas publicas que combatem o etarismo, politicas publicas COM o povo e não assistencialismos que com uma canetada vc passa fome.

As pessoas do interior são extremamente sectárias e n poderia ser de outro jeito já que o contexto de miséria no dia a dia e a ausência de lazer aproxima ele de uma religião (geralmente cristã, evangélica ou protestante) e deixa eles a mercê desse discurso de terrorismo moral das ideias que não são os dogmas da religião.

No final essas acusações que limitam todo um homem em uma caracteristica que não é de todo modo culpa dele mas é aliado a um contexto social só vai dividindo a gente e nunca debatemos como chegamos nesse ponto.

Não sei se vc vai ler mas agradeço desde ja, fica com deus OP";NEG;NEG;0.9221628308296204;0.06533853709697723;0.012498607859015465
13;13;394;pblsyt;https://www.reddit.com/r/brasil/comments/pblsyt/desabafo_de_quem_tá_com_medo_do_que_tá_virando_o/;"Desabafo de quem tá com medo do que tá virando o Brasil Venezuela foi para o buraco porque insistiram em planos de auxilio a população,  não, não foi o único motivo. Não foi nem o pricipal. Foi um dos itens apenas. Assim como apenas o Bolsonaro sendo presidente não é o unico motivo do brasil tá como está hoje, (parecidos com o nosso bolsa família), mesmo depois da queda do lucro que eles tinham na exportação do petroleo.

&#x200B;

Atualmente nosso governo quer dar calote nos precatórios, e no lugar de ajustar as contas, o objetivo disso é criar um segundo ""bolsa família"". Aumentando ainda mais os valores, e piorando ainda mais nossa economia (não me entenda errado, acho que é NECESSÁRIO existir esse auxilio, mas não precisava aumentar ele durante a crise economica que estamos). Seguindo assim, a risca as mesmas medidas da venezuela.

&#x200B;

Hoje tenho medo de verdade do nosso governo, do nosso futuro, da ignorancia de mais de 30% dos brasileiros que ainda acreditam a ponto de, ao menos tentar, fazer as coisas que prometem (como às do dia 07/09).

&#x200B;

Ao passar dos dias, da mais medo do Brasil de hoje...";NEG;NEG;0.5050069093704224;0.42327719926834106;0.07171584665775299
14;14;155;1akph83;https://www.reddit.com/r/brasil/comments/1akph83/minha_família_possui_direito_ao_bolsa_familia_mas/;Minha família possui direito ao bolsa familia, mas o cras da cidade diz que não? Família de 5, recebo bpc o qual segundo inss não conta como renda. Meu avô é aposentado, eu e ele precisamos de medicamento caro, 720 reais o meu, dele não sei. renda familiar de menos de 1/4 do salário mínimo por pessoa. Vieram a mim dizendo que possuímos direito ao bolsa familia, mas o cras local nega isso. Como prosseguir?;NEG;NEU;0.49866053462028503;0.4604078233242035;0.04093170911073685
15;15;76;105vxrv;https://oglobo.globo.com/blogs/lauro-jardim/post/2023/01/governo-quer-voltar-a-cobrar-assiduidade-escolar-e-cartao-de-vacinacao-de-beneficiarios-do-bolsa-familia.ghtml;Governo quer voltar a cobrar assiduidade escolar e cartão de vacinação de beneficiários do Bolsa Família;NEU;NEU;0.09115861356258392;0.8798274993896484;0.029013825580477715
16;16;431;s06iow;https://www.reddit.com/r/argentina/comments/s06iow/mi_novia_no_solo_me_dejo_sino_que_me_robo/;"Mi novia no solo me dejo, sino que me robo Bueno, rediturros

Basicamente lo que dice el post. Hoy cortamos con mi novia despues de 7 meses. Paso a describir la situacion

El dia jueves recibi un pago en efectivo de 85 lucas que me dieron en una bolsita de regalo para libros, de tela. Ese dia, a la noche, puse la bolsita en mi armario, a la vista. Dia viernes, sabado y hoy no vino nadie a mi casa, excepto mi novia el viernes por la noche. Ese viernes por la noche, la bolsita con plata estaba ahi. Y saque plata para ir a comer con ella. Ayer estaba ahi

Mi novia me dejo despues de una pelea que no va al caso en el desayuno. Me dijo que no queria seguir mas y se fue. Guardo todas sus cosas en 3 bolsas y se fue. En una bolsa eran solo cosmeticos del baño, en las otras eran zapatos, ninguno de los cuales se guardaban en el armario, sino abajo de la cama

Reviso a la hora no se porque y no estaba la plata. No puedo probar que la robo, y ella no lo va a admitir jamas. Paso a describir a la persona en cuestion. Tipica cheta de Belgrano con los papas y familia con guita, nariz parada y demas. Para que no digan que solo roban los pobres

Y tengo un odioooooo... porque no puedo probarlo, ella no lo va a admitir, no tengo pruebas, dijo que ""No se de que me hablas"" cuando le dije ""eso que hiciste antes de irme no se hace, esta mal"" y demas

La plata estaba el viernes cuando la vi por ultima vez, nadie vino a esta casa y la unica llave la tengo yo, o el dueño en su defecto, ni mis viejos ni nadie mas. Me siento un idiota y muy traicionado

Ni hubo insultos ni nada. Solo le dije que aceptaba que no quiera verme mas. No hubo llantos ni nada, solo caras de tristeza

Nada... a alguien le paso? Puede explicarme esto? Que me perdi? Porque hasta quiero creer que no se, me la gaste entre el sabado y el domingo sin darme cuenta, o algo, se que la plata no se volo por el viento....

Gracias";NEU;NEU;0.05773591995239258;0.8473309874534607;0.09493307024240494
17;17;192;1hwz8hq;https://www.reddit.com/r/ItsPauloLeeg/comments/1hwz8hq/nem_o_bolsa_família_tem_tanta_gente/;Nem o bolsa família tem tanta gente. https://youtu.be/5WcyFbaCyTc?si=XBRGizppqWHwvsF7;NEU;NEG;0.03605782240629196;0.9238126873970032;0.04012952744960785
18;18;73;1jwrt2n;https://gauchazh.clicrbs.com.br/politica/noticia/2025/04/prefeituras-e-entidades-empresariais-do-rs-se-mobilizam-para-reduzir-numero-de-beneficiarios-do-bolsa-familia-cm9bwvhwh00hg013dxjr3xeap.html;Prefeituras e entidades empresariais do RS se mobilizam para reduzir número de beneficiários do Bolsa Família | GZH;NEU;NEU;0.04949149489402771;0.927947461605072;0.022561050951480865
19;19;153;1ijcxea;https://www.reddit.com/r/enem/comments/1ijcxea/o_prouni_tem_poder_de_tirar_o_bolsa_família_de/;O ProUni tem poder de tirar o Bolsa Família de alguém? Gente, minha mãe e meu padastro são casados, mas minha mãe ainda está recebendo Bolsa Família (e não, ela não deveria estar recebendo de acordo com os critérios do programa, porque mesmo sendo apenas dona de casa, ela casou e consequentemente a renda da família aumentou porque ele trabalha. Mas ela não incluiu meu pai no cadastro do Bolsa Família). E como vou confirmar com a faculdade minhas informações no ProUni, claramente vão saber que ela é casada e pelo CPF dá pra verem que ela recebe o Bolsa Família. Corremos risco de ficar sem o Bolsa Família?;NEU;NEU;0.16155891120433807;0.7513018250465393;0.08713927865028381
20;20;9;140oxix;https://g1.globo.com/politica/noticia/2023/06/04/auditorias-da-cgu-apontam-bilhoes-em-pagamentos-indevidos-de-programas-como-auxilio-brasil-e-auxilio-gas-em-2022.ghtml;Auditorias da CGU apontam bilhões em pagamentos indevidos de programas como Auxílio Brasil e Auxílio Gás em 2022;NEU;NEU;0.07612040638923645;0.895896315574646;0.02798318676650524
21;21;175;1ijxy0w;https://portalrbn.com.br/caixa-paga-bolsa-familia-a-beneficiarios-com-nis-de-final-9-3/?feed_id=16269&_unique_id=67a62a76512d8;Caixa paga Bolsa Família a beneficiários com NIS de final 9;NEU;NEU;0.03904767334461212;0.923451840877533;0.03750046342611313
22;22;30;106gxmb;https://youtube.com/watch?v=VrHlD0QtHnA&feature=share;ADIADO o AUMENTO no SALÁRIO MÍNIMO e R$ 150 por FILHO no AUXÍLIO BRASIL ...;NEU;NEU;0.38412922620773315;0.5994471311569214;0.016423620283603668
23;23;411;k5xhmj;https://www.reddit.com/r/coronabr/comments/k5xhmj/mesmo_priorizando_a_economia_o_governo_ainda/;"Mesmo priorizando a economia o governo ainda falha em sua gestão da pandemia. Fico pensando, o governo quer a retomada a economia e a normalidade,  mas ao mesmo tempo luta contra tudo que possa nos fazer voltarmos a vida de antes. É contra testagem em massa, deixa testes de covid vencerem, é contra uma vacina só  porque é patrocinada por seu rival político. O governo federal se diz nacionalista e patriota mas isso é engodo, se fosse investiria em vacinas nacionais para o Brasil ter suas próprias e não depender do exterior. Colocou no maior cargo que cuida da saúde,  alguém que não entende nada de saúde,  diz entender logistica mas não é capaz de elaborar um plano estratégico para lidar com a pandemia e agora apresentou um plano de vacinação que claro é fraco. O que esperar mais desse governo? Gastou bilhões em auxilio emergencial, mas poderia ter poupado gasto se tivesse seguido a ciência e lidado melhor com a pandemia. Agora sofremos a conta gotas, era preferível termos sofridos restrições mais severas no inicio e desfrutarmos de mais segurança e liberdade como a China agiu que impôs lockdown, rastreio de contatos e testagem em massa. Agora ke diz qual ganho o governo tem? O que ele ganha sendo incompetente? Se ele fosse competente teríamos retomado a economia, que o governo se diz importar tanto mas ignora que mortos não compram, nem vendem e nem trabalham. 
Estudos comprovam que países que lidaram com a pandemia de forma correta tiveram menos prejuízos economicos.";NEG;NEG;0.7351400256156921;0.18699553608894348;0.07786445319652557
24;24;104;1k9w2h4;https://www.reddit.com/r/opiniaoimpopular/comments/1k9w2h4/não_deveria_existir_qualquer_forma_de_assistência/;"Não deveria existir qualquer forma de assistência social. O BPC Loas e o Bolsa Família deveriam ser extintos. Só no Brasil uma pessoa que nunca contribuiu nada a vida inteira consegue se aposentar. Isso  é um tapa na cara de quem  contribuiu a vida inteira e vai se aposentar igual. Não tem lógica nenhuma. Você receber um valor sem fazer nada enquanto quem trabalha chega a ganhar menos que você. Por isso que o Brasil é considerado um dos países menos produtivos do mundo. 

Se não existia assistência seria cada um responsável pelo próprio sustento. Aí eu queria ver. A pessoa iria dar um jeito e correr atrás de um emprego ou atividade lucrativa. ";NEG;NEG;0.6821452975273132;0.17313174903392792;0.14472293853759766
25;25;132;1fq9y07;https://www.reddit.com/r/opiniaoimpopular/comments/1fq9y07/pessoa_que_recebe_auxílio_do_governo_como_bolsa/;Pessoa que recebe auxílio do governo como bolsa família, INSS e etc, se for provado que usa o dinheiro com Bet, deveria perder o benefício  ;NEG;NEG;0.7155860066413879;0.25816041231155396;0.026253608986735344
26;26;70;1k31yyw;https://i.redd.it/9zg87givwtve1.png;Bolsa família deveria ter uma duração de no máximo 6 meses! E a pessoa poderia receber somente 6 meses por ano...;NEG;NEG;0.48724931478500366;0.4407253563404083;0.07202527672052383
27;27;369;ucf6wg;https://ge.globo.com/pi/futebol/copa-do-brasil/noticia/2022/04/26/torcida-faz-fila-mesmo-com-ingresso-ate-r-300-para-ver-flamengo-no-piaui.ghtml;Torcedores fazem longas filas mesmo com ingresso até R$ 300 para ver Flamengo no Piauí;NEU;NEU;0.08283163607120514;0.8928074240684509;0.02436092682182789
28;28;422;cmvwbt;https://blogs.oglobo.globo.com/ancelmo/post/sistema-do-mec-esta-fora-do-ar-e-nao-ha-quem-o-conserte-weintraub-demitiu-os-tecnicos-de-ti.html;Bolsa Família: sistema do MEC está fora do ar e não há quem o conserte: Weintraub demitiu os técnicos de TI;NEU;NEU;0.3689567744731903;0.6186167597770691;0.012426463887095451
29;29;55;1faj54g;https://noticias.uol.com.br/eleicoes/2024/09/06/pablo-marcal-bolsa-familia-desempregados-profissionais.htm;Marçal sugere que Bolsa Família produz 'desempregados profissionais' O que você acha a respeito dessa afirmação do Marçal?;NEU;NEU;0.040150001645088196;0.9493826031684875;0.010467362590134144
30;30;423;v3mxrn;https://www1.folha.uol.com.br/mercado/2022/06/pt-discute-plano-economico-de-lula-com-novo-bolsa-familia-e-taxacao-de-fortunas.shtml?utm_source=twitter&utm_medium=social&utm_campaign=twfolha;PT discute plano econômico de Lula com novo Bolsa Família e taxação de fortunas;NEU;NEU;0.05148094519972801;0.9192331433296204;0.02928593009710312
31;31;360;yijnx0;https://www.reddit.com/r/brasil/comments/yijnx0/nao_seja_um_babaca_deixa_a_galera_comemorar_em/;"Nao seja um babaca! Deixa a galera comemorar em paz hoje Cheio de post aqui ""ain pq vcs tem que entender que o Lula vai herdar um rombo no orcamento"", ""pq o Lula vai governar com um congresso de direita"", ""pq o Lula nao eh perfeito"" ou coisas do tipo. 

Irmao, **NAO SEJA BABACA**

 Vc nao eh o inteligentao que ta sozinho percebendo essas coisas, ninguem aqui precisa da sua aula. Acho que a imensa maioria sabe de tudo isso. 

Mas a gente acabou de vencer uma eleicao contra um fascista que usou todos meios (democraticos e nao democraticos) pra se reeleger. Despejou dinheiro em orcamento secreto, auxilio, comprou apoio no Brasil todo, meteu a policia pra cima de pobre, impediu transporte gratuito, esbanjou fake news. 

**E MESMO ASSIM PERDEU**

Deixa a gente comemorar hoje, porra! A partir de amanha a gente pensa nos problemas de novo, mas hoje, **SO HOJE** a gente so quer comemorar e rir da cara de bolsonarista.";NEG;NEG;0.8935140371322632;0.07781071215867996;0.028675302863121033
32;32;181;1icuy7k;https://portalrbn.com.br/caixa-paga-bolsa-familia-a-beneficiarios-com-nis-de-final-4-3/?feed_id=15232&_unique_id=679a3ab30222f;Caixa paga Bolsa Família a beneficiários com NIS de final 4;NEU;NEU;0.04379395395517349;0.9188637137413025;0.03734242543578148
33;33;307;pxbwq0;https://economia.uol.com.br/noticias/reuters/2021/09/28/bolsonaro-diz-que-brasil-e-rico-e-indica-possivel-extensao-do-auxilio-emergencial.htm;Bolsonaro diz que Brasil é rico e indica possível extensão do auxílio;NEU;NEU;0.031217247247695923;0.9534417986869812;0.015340962447226048
34;34;375;y6k751;https://www.reddit.com/r/farialimabets/comments/y6k751/tive_uma_ideia_genial_pra_ficar_rico_preciso_de/;Tive uma ideia genial pra ficar rico, preciso de conselhos. Tem muito mosquito da dengue aqui no meu bairro, e se eu criasse mosquito da dengue no balde e vendesse para pessoas que querem atestado médico? Seria o mosquito da dengue de balde, quantos R$ vocês pagariam por um atestado médico?;NEU;NEU;0.08754100650548935;0.8422514796257019;0.07020755857229233
35;35;72;10vhmau;https://noticias.uol.com.br/politica/ultimas-noticias/2023/02/06/lula-ministerio-da-saude-nisia-trindade-cirurgias-sus.htm?utm_source=twitter&utm_medium=social-media&utm_content=geral&utm_campaign=noticias;Bolsa Família exigirá atestado de vacinação de crianças, diz Lula ;NEU;NEU;0.031026724725961685;0.949266791343689;0.01970655284821987
36;36;203;1dkpio3;https://i.redd.it/a2zpa0cb8t7d1.png;"Bolsa Família: como uma ideia da direita se tornou a principal bandeira da esquerda brasileira 

https://leiaisso.net/11km/ ";NEU;NEU;0.02697230689227581;0.9346286654472351;0.03839902579784393
37;37;101;1311l1n;https://i.redd.it/gfzf9pn61hwa1.png;Corte do Bolsa Família provoca filas em Salvador https://www.poder360.com.br/brasil/corte-do-bolsa-familia-provoca-filas-em-salvador/;NEU;NEU;0.06982892006635666;0.9140927195549011;0.016078397631645203
38;38;39;1jotp5k;https://www.maisgoias.com.br/brasil/meu-sonho-um-projeto-onde-quem-recebe-bolsa-familia-nao-pode-votar-diz-senador-marcos-do-val/;“Meu sonho um projeto onde quem recebe Bolsa Família não pode votar”, diz senador Marcos do Val ;NEU;NEG;0.05697469040751457;0.6422215104103088;0.3008037805557251
39;39;291;yyx1pn;https://i.redd.it/pos99xl0zt0a1.jpg;"A presidenta do PT, Gleisi Hoffmann, deixou claro que o governo Lula não será controlado pelo ""mercado"", ou seja, pelos bancos. Ela ataca o teto de gastos e deixa claro que haverá o retorno do Bolsa Família, subsitituindo o Auxílio Brasil. https://t.co/MRu3kOsWnr ";NEU;NEU;0.13734714686870575;0.8129684925079346;0.04968443885445595
40;40;347;yyn86k;https://i.redd.it/gwv609oadq0a1.png;Tenho 448 anos e nunca precisei de auxilio nenhum da burguesia, da população, juízes, exército, nem de ninguém desse Brasil. Já passei guerras, conflitos e revoltas. Já cheguei a funcionar precariamente! Mas fui lá e cedi as margens do Ipiranga pra o Brasil ficar independente de Portugal. ;NEU;NEU;0.38313186168670654;0.5420691967010498;0.07479897886514664
41;41;131;1kayna4;https://www.camara.leg.br/proposicoesWeb/fichadetramitacao?idProposicao=2502239;[Waldemar Oliveira] PL 1948/2025 (1): Altera a Lei nº 14.790, de 29 de dezembro de 2023, para vedar a participação de beneficiários do Programa Bolsa Família e de integrantes de sua família na condição de apostador. ;NEU;NEU;0.055062711238861084;0.9011372327804565;0.04380009323358536
42;42;234;1f2ny4y;https://www.reddit.com/r/Ajuda/comments/1f2ny4y/poso_perder_meu_fies_e_bolsa_familia/;"Poso perder meu FIES e Bolsa Familia? Algum advogado ou pessoa que conhece das leis sobre o bolsa familia e fies poderia me ajudar?



Sou estudante, minha família é beneficiária do bolsa família e tenho FIES social, há uma possibilidade de eu me mudar para outro estado sem minha família. Eles perderiam o benefício e eu perderia o fies social só de sair da casa dos meus pais mesmo não tendo um trabalho com carteira assinada? ";NEU;NEU;0.21248437464237213;0.7277985215187073;0.0597170926630497
