;Unnamed: 0.1;Unnamed: 0;id Post;Link;Contexto;Classe Sentimento;rotulo;prob_NEG;prob_NEU;prob_POS
160;160;193;1b3qu0f;https://noticias.uol.com.br/colunas/leticia-casado/2024/03/01/governo-credito-bolsa-familia.htm;Letícia Casado: Governo quer R$ 1,5 bi em crédito para quem tem Bolsa Família abrir negócio ;NEU;NEU;0.019063927233219147;0.9317049980163574;0.04923110082745552
161;161;247;ylg458;https://www.estadao.com.br/economia/auxilio-brasil-voltara-a-ser-chamado-de-bolsa-familia-em-governo-lula/;Auxílio Brasil voltará a ser chamado de Bolsa Família em governo Lula - Estadão;NEU;NEU;0.029303455725312233;0.9519113898277283;0.01878516748547554
162;162;281;y9e7pv;https://www.metropoles.com/colunas/guilherme-amado/ministro-do-tcu-devera-suspender-consignado-do-auxilio-brasil;Ministro do TCU deverá suspender consignado do Auxílio Brasil;NEU;NEU;0.13686880469322205;0.8404044508934021;0.022726722061634064
163;163;195;1htk6v1;https://portalrbn.com.br/estudo-mostra-que-bolsa-familia-reduziu-mortes-por-tuberculose/?feed_id=13231&_unique_id=677977aca5405;Estudo mostra que Bolsa Família reduziu mortes por tuberculose;NEU;POS;0.03572394326329231;0.9485793709754944;0.015696709975600243
164;164;338;zso8ww;https://www.reddit.com/r/PortalRbn/comments/zso8ww/caixa_paga_auxílio_brasil_a_beneficiários_com_nis/;"Caixa paga Auxílio Brasil a beneficiários com NIS de final 9 A Caixa Econômica Federal paga hoje (22) a parcela de dezembro do Auxílio Brasil aos beneficiários com Número de Inscrição Social (NIS) com final 9. Essa é a quinta parcela com o valor mínimo de R$ 600, estabelecido por emenda constitucional promulgada em julho pelo Congresso Nacional.

Ontem (21),

https://portalrbn.com.br/caixa-paga-auxilio-brasil-a-beneficiarios-com-nis-de-final-9/";NEU;NEU;0.05877356603741646;0.8766775131225586;0.06454890966415405
165;165;335;yybvga;https://www.camara.leg.br/proposicoesWeb/fichadetramitacao?idProposicao=2338697;[Raimundo Costa - PODE] PL 2805/2022: Dispõe sobre o recebimento cumulativo do Auxílio Brasil e o Seguro Defeso da Pesca Artesanal.;NEU;NEU;0.031030137091875076;0.921043872833252;0.04792588949203491
166;166;222;1gxnz8k;https://portalrbn.com.br/caixa-paga-bolsa-familia-a-beneficiarios-com-nis-de-final-5/?feed_id=10344&_unique_id=67412e73baac4;Caixa paga Bolsa Família a beneficiários com NIS de final 5;NEU;NEU;0.04417482763528824;0.9173896312713623;0.03843555226922035
167;167;36;1ki94bi;https://v.redd.it/uvh7n2eqfoze1;25 anos recebendo Bolsa Família;NEU;NEU;0.04802665859460831;0.891680121421814;0.06029319763183594
168;168;139;1jvgud5;https://www.camara.leg.br/proposicoesWeb/fichadetramitacao?idProposicao=2496168;"[Felipe Carreras] PL 1599/2025 (1): Dispõe sobre a criação do Programa de Desenvolvimento Econômico e Social ""Emprega Turismo"", institui incentivos especiais para contratação de empregados nos setores vinculados ao turismo, garante a manutenção do benefício do Bolsa Família e altera a Lei nº 8.0... ";NEU;NEU;0.04153618589043617;0.8304476737976074;0.12801606953144073
169;169;392;h7bgp1;https://www.reddit.com/r/brasil/comments/h7bgp1/não_a_culpa_não_é_do_brasileiro/;"Não, a culpa NÃO é do brasileiro. Bom dia/tarde/noite, recentemente eu estava visitando meus pais depois de um longo tempo sem vê-los. Até então está tudo bem, até que entra no papo de política. Não, meus pais não são bolsominions ou algo do tipo, eu classificaria eles como ""eu não gosto do que o governo está fazendo, mas não quero fazer nada e só implorar para que algo aconteça"".

Ok, mas o que isso tem a ver com política? O que aconteceu é que apareceu uma notícia na TV mostrando o furdúncio de pessoas no centro de uma cidade, logo depois começou os comentários dos meus pais:

>Olha essa gente na rua, só o brasileiro mesmo!  
>  
>O brasileiro não tem jeito mesmo...

E coisas do tipo.

Resolvi colocar minha posição a fora, basicamente falando que as pessoas ali só estão fazendo isso por 3 motivos (que eu imagino): 

\- A grande maioria não possui um grau de educação muito elevado e se tem provavelmente é de má qualidade;

\- Muitas pessoas ali não recebe nenhum tipo de suporte financeiro (exemplos: não recebeu auxilio do governo, não tem nenhum tipo de dinheiro guardado) ou alimentício (pessoas faltando comida ou algo assim);

\- O nosso presidente literalmente implora para as pessoas saírem de casa, pode parecer bobo para alguns, mas o presidente pedindo para as pessoas saírem para alguns é o mesmo que mandar sair (só lembrar do [caso Trump com desinfetante](https://www.uol.com.br/vivabem/noticias/redacao/2020/04/25/ny-tem-30-chamados-por-ingestao-de-desinfetante-melhor-prevencao-e-higiene.htm).

Com isso eu sintetizei que **a culpa não é do brasileiro**, ser brasileiro não quer dizer absolutamente nada, ser brasileiro não faz ninguém diferente ou inferior a qualquer outro ser humano, nosso país se encontra aonde está pois a **elite quer assim**. Com isso eu inicio uma discussão gigante comigo defendendo a educação e dizendo que é essencial lutar por ela.

Nunca parei para pensar o quão danoso é a ideia de que a ""culpa é do brasileiro"" ou que o ""Brasil é um caso separado"", vejo que em todo lugar isso se fala verbal ou não verbalmente, as pessoas falam isso (de várias formas, como o próprio brasileiro não presta, ou o Brasil não consegue fazer isso, ou o ""jeitinho brasileiro""), programas de TV dão a entender isso (novelas muitas vezes ridicularizam o povo, como exemplo), o governo tenta mostrar que somos dependentes dele e assim vai.

Até se olharmos para a história, grande parte dos eventos históricos no Brasil tratam o povo como incapaz, esses momentos históricos eu divido assim:

\- Os que ""venceram"" (entenda vencer como o grupo que consegue algo que quer): vide Getúlio Vargas e a CLT, vide a primeira república com os militares, vide a ditadura militar, assim vai, quase nada de participação popular;

\- Os que perderam: os farroupilhos (teve bastante participação da elite, mas teve grande participação do povo também), conjuração baiana, guerra de canudos, balaiada, revolta da chibata e muitos outros (muitos MESMO).

Dá para ver que o brasileiro perde sua autoestima, não só como nação, mas como humanos.

Disso é fácil ver o porquê desse papo de ""salvador"" ou ""messias"" no governo, a repressão na história é tão grande que o brasileiro começa a se sentir inferior diante o governo (necessitando dessa ""ajuda sagrada"") e diante o mundo (desqualifica a própria cultura, gerando esse complexo de vira-lata).

Vou colocar aqui minha opinião final sobre o Brasil e o brasileiro: o Brasil NUNCA vai melhorar (para o povo) enquanto o próprio povo não se erguer sobre isso\*, povo eu quero dizer TODO ele (ou pelo menos uma parte gigante), o Brasil é um país lindo com uma cultura linda, a cultura DO POVO é linda, a elite NÃO representa o Brasil, nem NUNCA vai, eles querem colocar a ideia de que o brasileiro é ruim, mas isso é só uma forma de expressar os próprios defeitos nojentos.

Não me confunda com um nacionalismo cego, o brasileiro não é superior a outros seres humanos, **ele é igual a todos eles**, eu acredito que o potencial humano é infinito, por isso **o potencial brasileiro também é infinito**.

Obrigado pela leitura.

\* Como vai ser erguer? Não sei.";NEG;NEU;0.629766583442688;0.3352277874946594;0.03500565513968468
170;170;184;1ibiv1c;https://portalrbn.com.br/caixa-paga-bolsa-familia-a-beneficiarios-com-nis-de-final-3-4/?feed_id=15032&_unique_id=6797e987c3a5b;Caixa paga Bolsa Família a beneficiários com NIS de final 3;NEU;NEU;0.04029727354645729;0.9223302006721497;0.03737258166074753
171;171;239;12zsn81;/r/brasil/comments/12ze833/meu_pai_é_bolsonarista_roxo_e_frauda_o_bolsa/;MEU PAI É BOLSONARISTA ROXO E FRAUDA O BOLSA FAMILIA!;NEG;NEU;0.9233944416046143;0.07246827334165573;0.004137395415455103
172;172;253;xuogoi;https://valorinveste.globo.com/mercados/brasil-e-politica/programas-sociais/noticia/2022/10/03/governo-antecipa-calendario-do-auxilio-brasil-de-outubro-para-antes-da-data-do-segundo-turno.ghtml;Governo antecipa calendário do Auxílio Brasil de outubro e todos vão receber antes do segundo turno das eleições;NEU;NEU;0.02500550076365471;0.9117987751960754;0.06319571286439896
173;173;59;1ccroqb;https://www.reddit.com/r/brasil/comments/1ccroqb/como_as_pessoas_mentem_sobre_o_bolsa_família/;"Como as pessoas mentem sobre o bolsa família Vi um post no X (twitter) que já está rodando de uma deputada de SC falando que Santa Catarina seria melhor porque tem mais pessoas trabalhando do que recebendo bolsa família diferente do Maranhão (o outro extremo). 

Eu não vou entrar no mérito do que ela falou mas falar de um assunto correlato, porque as pessoas estão ficando cada vez mais burras a respeito do bolsa família? 

Pessoas que recebem bolsa família também trabalham seja informalmente ou formalmente mas também recebem o auxílio porque sua renda mensal não é suficiente para ter o mínimo de dignidade, a tese de que a pessoa ou trabalha ou recebe o bolsa família NÃO EXISTE. É impossível você viver com 600 reais ou até mesmo criar filhos com 600 reais, em que planeta essas pessoas estão vivendo? As taxas de fecundidade estão caindo em todo o país.  

Esses gráficos do poder360 estão sendo muito divulgados para espalhar desinformação ou meias verdades e as pessoas simplesmente não são capazes de pesquisar por conta própria por pelo menos 10 minutinhos e ver as mentiras que estão sendo ditas. 

Não vou me alongar mais do que isso mas está na hora das pessoas se unirem mais para combater essas mentiras, está ficando insuportável a quantidade de preconceito e xenofobia ainda mais se tratando de uma mentira descarada. ";NEG;POS;0.8456569314002991;0.09944622218608856;0.05489683523774147
174;174;111;1jfjun8;https://youtu.be/HaUgSWTnAtM?si=c7T6GJT-lVhWZEnZ;Empresários reclamam de falta de mão de obra e culpam bolsa família (canal Galãs Feios);NEU;NEG;0.1276266723871231;0.8587979078292847;0.013575500808656216
175;175;196;1ga7enq;https://www1.folha.uol.com.br/poder/2024/10/zema-associa-bolsa-familia-a-dificuldade-de-empresarios-contratarem-no-pais.shtml;Zema associa Bolsa Família a dificuldade de empresários contratarem no país;NEU;NEG;0.09563060104846954;0.8891445994377136;0.015224836766719818
176;176;208;1hb48an;https://portalrbn.com.br/caixa-comeca-a-pagar-bolsa-familia-de-dezembro/?feed_id=12158&_unique_id=67585d694ee15;Caixa começa a pagar Bolsa Família de dezembro;NEU;NEU;0.029960215091705322;0.9348083138465881;0.035231515765190125
177;177;6;106782p;https://veja.abril.com.br/coluna/radar/tcu-descobre-mar-de-irregularidades-no-auxilio-brasil-de-bolsonaro/amp/;TCU descobre mar de irregularidades no Auxílio Brasil de Bolsonaro;NEU;NEU;0.249746173620224;0.7257389426231384;0.024514954537153244
178;178;383;jpbcte;https://www.reddit.com/r/brasilivre/comments/jpbcte/na_minha_opnião_as_chances_do_bolsonaro_se/;"Na Minha Opnião as Chances do Bolsonaro se re-eleger em 2022 é alta, leia antes de criticar Todo mundo sabe que o Trump Perdeu, e a Lacração LGBTexto, Army KPOP BTS, foi a loucura falando que o Bonoro vai perder 2022, na minha opnião não, por alguns motivos

1-Eu chamo isso de Efeito Boulos ou Efeito Napoleão:

É bem Simples de Explicar, basicamente o canditado mais provavel é de esquerda provavelmente o PT, O negocio é que diferente dos EUA, o Brasil tem um Odio gigante do PT ou da esquerda em geral, Por Isso Efeito Napoleão, pq basicamente varias pessoas se votariam no bolso só pro pt n ganhar, meu pai votou no NOVO em 2018 no Primeiro Turno mas ele votou no Bonoro no segundo, eu tmb chamo de efeito boulos, pq se ele chegar ao segundo turno grande parte das pessoas que votam em outros partidos votariam pro oponente dele no segundo turno

2-PT

o PT é provavelmente o partido mais odiado desse país, se eles chegarem no segundo turno ele vão perder, se tentaram botar o lula na presidencia, vão perder mais feio, Diferente dos Democratas nos eua o PT é cheio de acusações e provas de corrução, isso causaria o Efeito Napoleão e o efeito do mal menor no segundo turno, o mal menor sendo o Bonoro, até eu que não vou votar em 2022, votaria no Bolso se o PT chegar no segundo turno só pro PT n chegar pq o Bonoro é ""Menos Corrupto"", isso prova como esse país é fudido

3-O Distanciamento da Esquerda e do Trabalhador:

Desde o Inicio a Esquerda defendia o trabalhador, hoje é o contrario, em vez de querer ajudar o trabalhador ou os pobres a esquerda se importa mais com problemas de ""Primeiro Mundo"" ( Racismo e Homofobia), Eu **NÃO** estou falando que racismo não é um problema, mas o trabalhador ve a esquerda falando de Racismo e Transfobia e a Caralha quatro e olha pro bonoro falando em Lei e Ordem e Pobreza e as outras caralha quatro que é mais importante é pensa

""Esse Cara parece q se importa mais com os problemas atuais, e vou votar nele""

E vamos falar a verdade, no final do dia acabar com a pobreza pq a pobreza leva a falta de educação que leva a, a Ignorancia, que leva a discriminação

O unico partido de esquerda que realmente defende o Trabalhador é o PCO, a Base de apoio da esquerda é o nordesta, q é ironico pq o Povo Nordestino tende a ser conservador,Religioso e Patriarcal, (alguns até Homofobicos) bem contrario ao Feminismo e LGBTismo PSOLista de hoje em dia, e foi só o Governo da Auxilio  que a aprovação do governo subiu

Ironicamente a Esquerda que falava pra pegar em armas e trazer a revolução do trabalhador, hoje fala em Des-armamento e seria massacrada se tentassem fazer sua ""Revolução""";NEG;NEG;0.5524922609329224;0.40195232629776;0.0455554760992527
179;179;301;yjvwxc;https://www.reddit.com/r/brasil/comments/yjvwxc/dúvida_sobre_diminuição_do_auxílio_brasil_de_600/;"Dúvida sobre diminuição do auxílio brasil de 600 para 405 reais e salário mínimo de 1400 para 1302 reais. Salve galera, tudo bom? Tenho uma dúvida aqui sobre o auxílio brasil e salário mínimo. Eu recebi um vídeo de uma noticia de um jornal de 31 de agosto desse ano. No video é falado que será reduzido o auxílio brasil de 600 para 405 reais em 2023. 

Eu pesquisei sobre o assunto e as informações que eu encontrei foram falando que inicialmente o auxílio brasil começou com 400 reais, mas devido a emergência da pandemia ele subiu para 600 reais. O problema é que esses 200 a mais ficam acima do teto de gastos, então ele seria até dezembro de 2022 e que em 2023 voltaria para 405 reais. Tudo isso com aprovação do atual governo.

Essas notícias são de agosto/setembro. Até aqui tudo certo? É verídico? Qualquer coisa que tiver errado, corrija por favor.

Outra informação no vídeo foi falando que vão colocar o salário mínimo em 1.302 reais. 

Até aqui tudo certo?

Se isso for verdade eu to muito chocado, porque pegaram esse video e destorceram tudo, dando a entender que a notícia é de hoje, como se o PT tivesse falado que vai reduzir o auxílio pra 405 reais, que o bozo prometeu 1.400 de salario mínimo e o pt quer reduzir pra 1.302, sendo que a notícia do salario minimo de 1.400 é de 4 dias atrás, e o jornal é de mais de 1 mês atrás, sem contar que tem todo aquele papo vangloriando o atual presidente, que ele pegou o país quebrado, enfrentou uma pandemia e uma guerra e como ele não rouba, conseguiu dar o auxílio de 600, mas como o PT é ladrão, ele vai abaixar pra 405 pra poder roubar o resto.

O pior é o tanto de gente nos comentários acreditando e zombando do PT. O video está no momento com quase 3 milhões de views e 13.000 comentários. Eu tive que vim aqui perguntar pra ver se realmente o que falei ali acima é isso mesmo, porque ainda não consigo acreditar que tem tanta gente que não pesquisa as coisas. Eu ainda to achando que eu to errado, que realmente foi o pt que disse que vai abaixar pra 405 e que o bozo prometeu um salario de 1400 mas o pt vai abaixar pra 1302, mesmo que o bozo falou isso a 4 dias e a notícia do jornal é de 2 meses. Não consigo acreditar que tem tanta gente que não pesquisa as coisas e toma como verdade a primeira informação que aparece pra elas e que seja confortável.

Voces estão entendendo o nível do negócio? 31 de agosto a matéria no jornal disse que o salário será aumentado para 1.302. A 4 dias atrás o bozo disse que vai aumentar pra 1.400. Ai pegaram a noticia e colocaram como se fosse de hoje, dando a entender também nas legendas que o pt vai abaixar de 1.400 pra 1.302. Na época ninguem nem tinha falado de salário em 1.400. É muito bizarro ver tanta gente acreditando nisso.

Eu quero realmente saber se eu sou o errado da história.";NEU;NEU;0.1564096063375473;0.7685876488685608;0.07500272244215012
180;180;158;1httvh2;https://i.redd.it/hg88c7sht2be1.png;Irmãs de senadora suplente de Wellington Dias recebem Bolsa Família;NEU;NEU;0.020206300541758537;0.9434134364128113;0.03638014942407608
181;181;150;1foocn0;https://i.redd.it/3jrotkz8vtqd1.jpeg;Bolsa Família é gain? [Valores representam 20% do total pago no mês passado.](https://www1.folha.uol.com.br/mercado/2024/09/beneficiarios-do-bolsa-familia-gastam-r-3-bilhoes-em-bets-so-em-agosto.shtml);NEU;NEU;0.05371411517262459;0.9068530797958374;0.039432767778635025
182;182;177;1ijxk82;https://portalrbn.com.br/caixa-paga-bolsa-familia-a-beneficiarios-com-nis-de-final-7-2/?feed_id=15973&_unique_id=67a6269d45864;Caixa paga Bolsa Família a beneficiários com NIS de final 7;NEU;NEU;0.040282607078552246;0.9229987859725952;0.03671853616833687
183;183;10;17cd8z8;https://www.infomoney.com.br/minhas-financas/instituto-sigilo-veja-se-voce-tem-direito-a-indenizacao-de-r-15-mil-por-dados-vazados-no-auxilio-brasil/;Instituto Sigilo: veja se você tem direito a indenização de R$ 15 mil por dados vazados no Auxílio Brasil;NEU;NEU;0.051902640610933304;0.928602397441864;0.019494881853461266
184;184;231;1ixvckf;https://www.reddit.com/r/Desenvolvimentismo/comments/1ixvckf/seria_melhor_se_o_lula_usasse_boa_parte_do/;Seria melhor se o lula usasse boa parte do dinheiro do bolsa familia no PAC 3 ou na infraestrutura O programa tem sua importancia social, mas o investimento insuficiente do PAC 3, somado aos juros impagaveis da divida e o aumento do consumo vindo do bolsa familia estão causando um forte aumento da inflação, então se usar parte do dinheiro do bolsa familia no PAC ou na infraestrutura, a inflação vai cair a inflação no curto prazo pela queda do consume e no longo prazo pelo aumento da produtividade.;NEU;NEU;0.44248583912849426;0.4548528492450714;0.1026613786816597
185;185;103;1k5bqyl;https://v.redd.it/vp9nwv8r5fwe1;Ironia mesmo é ver o tio Lule, o tal pai dos pobre, ser justamente quem vai meter a tesoura no Bolsa Família. Vai vendo. ;NEG;NEU;0.7877466678619385;0.19265998899936676;0.01959339529275894
186;186;81;16gqei2;https://www.bbc.com/portuguese/articles/cv2kd3vrvp8o.amp?at_format=image&at_link_type=web_link&at_link_origin=bbcbrasil&at_medium=social&at_ptr_name=twitter&at_campaign_type=owned&at_link_id=B9B23804-50B2-11EE-8B2E-B6153AE5AB7B&at_campaign=Social_Flow&at_bbc_team=editorial;Bolsa Família, 20 anos: 'Meus pais foram beneficiários, hoje sou engenheiro de software' ;NEU;NEU;0.019713766872882843;0.9477803707122803;0.03250594064593315
187;187;249;vj3jhb;https://www.poder360.com.br/economia/governo-estuda-aumentar-auxilio-e-recuar-de-icms-zerado/;Bolsonaro eleva Auxílio Brasil de R$ 400 para R$ 600;NEU;NEU;0.04592305049300194;0.894477128982544;0.05959976837038994
188;188;274;zbn8h0;https://youtu.be/1VRRHjib4-8;Mercadante denuncia crimes relacionados ao Auxílio Brasil na coletiva do GT do Combate à fome;NEU;NEU;0.10302357375621796;0.8751260042190552;0.021850407123565674
189;189;167;1hzkhwi;https://www1.folha.uol.com.br/mercado/2025/01/trabalho-ainda-que-formal-nao-garante-porta-de-saida-a-beneficiario-do-bolsa-familia.shtml;Trabalho, ainda que formal, não garante porta de saída a beneficiário do Bolsa Família ;NEU;NEU;0.11376988887786865;0.8645247220993042;0.021705323830246925
190;190;409;rifbm3;https://www.reddit.com/r/Filosofia/comments/rifbm3/existem_preceitos_éticos_atrelados_com_conceitos/;"Existem preceitos éticos atrelados com conceitos de perpetuação da especie no seio familiar? Estava pensando sobre a ética familiar e como nós humanos somos K estrategistas...No atual contexto neoliberal de produção nós, criamos 1 ou 2 filhos o melhor que pudermos para q eles deem continuidade na família.

 Esses 2 filhos estão em um dado contexto cultural q sua menor unidade seja a familia, dentro da família temos alguns valores q beneficiam a continuidade do genes. Por exemplo: O fato dos filhos se esforçarem durante os anos iniciais de sua vida aprimorando suas capacidades cognitivas e posteriormente é comum os país retribuírem o favor o auxiliando financeiramente e emocionalmente para ingressar em um ensino superior (a casos que esse auxilio ja começa em fases iniciais)

 E dado o nosso contexto econômico isso é totalmente valido para definir o nosso lugar hierárquico na estratificação social (se desigualdade n distorcesse este fato no brasil). 

 Analogamente poderíamos olhar para décadas passadas onde a estrategia predominante em nossas sociedade pré-industriais eram a de R-estrategistas onde a criação de mts filhos era beneficiada para o trabalho do campo e se empregava pouco investimento da parte auxiliadora, tornando assim os filhos um investimento de curto prazo uma vez q eles entrariam em vida laboral mt precocemente e n desenvolveriam sua capacidade cognitiva.

 Deste modo, a ética no que concerne a responsabilidade de criação dos filhos parece estar se modificando ao longo do tempo, porem essa adaptação biologica-sociologica parece estar cobrando o seu preço uma vez q nunca antes tivesse visto tanta pressão externa (e interna) para desempenho satisfatório em fases tão juvenis. O que acarreta em altos niveis de cortisol nos primeiros anos da fase adulta, o que significa pessoas mais ansiosas e manifestando cada vez mais sintomas depressivos.

 Voces concordam com essa afirmação?";NEU;NEU;0.07144947350025177;0.7186475992202759;0.20990294218063354
191;191;415;zgavxa;https://i.redd.it/0unrzuhf1s4a1.jpg;Senadores que votaram contra o bolsa-família de R$600 pra janeiro/23;NEU;NEU;0.19732972979545593;0.7800644636154175;0.02260577119886875
192;192;321;qbqjxa;https://g1.globo.com/economia/noticia/2021/10/19/auxilio-brasil-derruba-a-bolsa-e-faz-dolar-subir-entenda-por-que-mercados-reagem-mal-ao-plano-do-governo.ghtml;"Auxílio Brasil derruba a bolsa e faz dólar subir; entenda por que mercados reagem mal ao plano do governo";NEU;NEU;0.13114209473133087;0.8448262214660645;0.024031687527894974
193;193;356;k7c7rp;https://www.reddit.com/r/brasil/comments/k7c7rp/tjsp_aprova_criação_de_auxíliosaúde_de_r_400000/;TJ-SP aprova criação de auxílio-saúde de R$ 4.000,00 aos magistrados do estado Como um mero serventuário desta corte essa notícia me inoja de uma maneira que vocês não tem ideia. No começo de 2020 (antes da pandemia) os servidores sequer tiveram a reposição inflacionária de seus salários, e já falaram que em 2021 também não terá. Sempre a mesma desculpa: falta dinheiro. Eu aceitei de boa, entendo a crise que estamos passando, mas agora ver esse auxilio que eles se deram no meio de uma FUCKING pandemia é um tapa na cara da sociedade. Enfim, so queria falar aqui que eu to puto pra cacete com isso.;NEG;NEU;0.8852218389511108;0.08591241389513016;0.028865737840533257
194;194;210;1h0p1uf;https://www.camara.leg.br/proposicoesWeb/fichadetramitacao?idProposicao=2471981;[Cabo Gilberto Silva] PL 4529/2024 (1): Altera a Lei nº 14.601, de 19 de junho de 2023, para criar mecanismos de monitoramento da frequência escolar e implementar incentivos pedagógicos e medidas de suporte educacional para beneficiários do Programa Bolsa Família. ;NEU;NEU;0.03274771571159363;0.8538517951965332;0.11340048909187317
195;195;194;1htn0gk;https://portalrbn.com.br/pagamento-do-bolsa-familia-comeca-no-proximo-dia-20/?feed_id=13271&_unique_id=6779945330092;Pagamento do Bolsa Família começa no próximo dia 20;NEU;NEU;0.018057456240057945;0.9396839141845703;0.042258646339178085
196;196;89;1faj31j;https://noticias.uol.com.br/eleicoes/2024/09/06/pablo-marcal-bolsa-familia-desempregados-profissionais.htm;Marçal sugere que Bolsa Família produz 'desempregados profissionais'. O que você acha dessa ideia?;NEU;NEU;0.04057309776544571;0.9496996998786926;0.009727261029183865
