;Unnamed: 0.1;Unnamed: 0;id Post;Link;Contexto;Classe Sentimento;rotulo;prob_NEG;prob_NEU;prob_POS
72;72;384;i0bdbi;https://www.reddit.com/r/brasil/comments/i0bdbi/ok_eu_não_sou_um_economista_mas_eu_tenho_algumas/;"Ok eu não sou um economista, mas eu tenho algumas coisas que me fazem contra a nova cédula, se alguém tiver algo para comentar por favor escrevam. Ok, eu sou contra a nova cédula por vários motivos, eles são:

\*A intenção dela deve ser para circular mais dinheiro na economia estagnada do Brasil, tipo, digamos que eu saquei o auxilio emergencial em três notas de 200 e fui ao mercado e paguei com uma nota de 200 eu vou receber 58 reais de troco (por exemplo) eu vou tá carregando mais dinheiro e se eu for pegar um taxi o cara provavelmente não vai ter troco pra mim portanto ele vai ficar com uma nota alta  e assim vai. Iria circular mais notas de cunho alto mas isso literalmente não resolve nada, só porque pessoas estão carregando cedulas de alto cunho não significa que elas estão ""mais ricas"" ou com maior facilidade quando for comprar algo, oque quero dizer aqui resumindo é que notas de menor valor iriam ser menos circular menos.

\*Ela não desvalorizaria o real? Tipo, já que ninguem tem dinheiro nas contas agora quase ninguem conseguiria sacar ela portanto teria dinheiro parado que teria um impacto desvalorizando o real portanto aumentando a inflação que não poderia ser corrigida já que ninguem tem dinheiro para acertar os salários.

\*Não tem o cão caramelo nela, bah isso é só vacilo mesmo hahahaha.

Avisando novamente eu não sou um economista e meus conhecimentos de economia não passam de uma aula de educação financeira na sexta série. Se alguém souber o motivo do por qual ela deveria ou não ser criadas por favôr contribua deixando um comentário :)";NEU;NEU;0.23843388259410858;0.6849483847618103;0.07661768794059753
73;73;410;lxlqda;https://www.reddit.com/r/desabafos/comments/lxlqda/a_vida_é_uma_vadia/;"A vida é uma vadia. Fala galera,

TL;DR - 6k para passar férias as custas do gov(ou n)s/

Vamo lá, como talvez alguns aqui saibam, trampo a algum tempo como contador (mesmo n tendo ideia de como acabei nisso). Como sempre chega essa época do ano e começam a aparecer as declarações de IR, que são algo até que simples de se fazer, tirando galera que tem um milhão de coisa para justificar. Normalmente não faço essas declarações para evitar trocar ideia com cliente, como durante o ano passado rolou aquele ""auxilio"" para uma galera, era certo que ia rolar de algum cliente ter pego indevidamente, o embaçado seria como lidar com essa situação e convencer o mesmo a pagar o que deve.

 Até então tudo normal, hoje Chego no trampo um desses clientes resolve ""aparecer"", o responsável por essa área vai prestar o serviço e vê que a esposa do então cliente havia recebido indevidamente o auxilio se passando como mãe solteira ou qualquer justificativa que a enquadrasse na época, ao finalizar a declaração aparecem cerca de 6k para o cara devolver para o governo, pois incluindo a ""renda"" da esposa a receita constata que ela requisitou o auxilio indevidamente.

Teoricamente ele deveria devolver esse dinheiro, na pratica, vão retirar a esposa do cara e fingir que não existiu essa renda, isso tudo rolando enquanto o mesmo cliente ta viajando de férias.

PQP, mano se eu trombo policial na rua da minha casa sem conseguir explicar de onde vem uma grana que é minha, os cara me dessem a porrada. Agr esse fdp catou 6k, ta la aproveitando férias e os krl, como se não tivesse fudendo ngm, enquanto eu mal consigo pagar as contas em dia e nem me enquadro na porra do auxilio, é de fuder msm.";NEG;NEG;0.7639943957328796;0.1985073685646057;0.03749818354845047
74;74;311;wfxnb7;https://politica.estadao.com.br/blogs/coluna-do-estadao/guedes-associa-auxilio-brasil-de-600-a-reforma/;Guedes associa Auxílio Brasil de R$ 600 em caráter permanente à reforma tributária;NEU;NEU;0.02930586412549019;0.9241956472396851;0.04649847373366356
75;75;124;1kpzuzm;https://assistencialismonoticias.com.br/2025/05/18/quando-o-bolsa-familia-de-junho-sera-pago-veja-o-calendario-completo/;Quando o Bolsa Família de JUNHO será pago? Veja o calendário completo;NEU;NEU;0.029001956805586815;0.9346932172775269;0.036304861307144165
76;76;304;x35uwg;https://www.estadao.com.br/economia/orcamento-2023-auxilio-brasil-405-reais;Orçamento de 2023 prevê Auxílio Brasil de R$ 405 - Estadão;NEU;NEU;0.028801072388887405;0.9361810088157654;0.03501790016889572
77;77;22;10gc8x8;https://www.reddit.com/r/ConselhosLegais/comments/10gc8x8/auxílio_brasil/;"Auxílio Brasil Boa tarde, pessoal

Alguém solicitou o auxílio, e apareceu essa mensagem?

“não foi encontrado beneficio auxilio brasil para seu cpf”

Solicitei dia 11 de dezembro, e vi que o prazo é até 45 dias, no CRAS me disseram que era até 90 dias.

Essa mensagem aparece pelo app auxílio Brasil.

Tem algum meio de agilizar/consultar o processo?

Liguei no 121 porém só gravação.
No áudio pediram para  retornar após dia 18.";NEU;NEU;0.11346869170665741;0.8456273674964905;0.0409039743244648
78;78;46;1kdky2m;https://www.reddit.com/r/opiniaoimpopular/comments/1kdky2m/todo_mundo_deveria_ter_direito_ao_bolsa_família/;"Todo mundo deveria ter direito ao bolsa família como forma de melhorar os salários É isso.

Dessa forma exigiria que os empregadores melhorassem os salários e as condições dos empregos de modo a atrair os trabalhadores.

Se o empresário não o faz, o trabalhador irá preferir o bolsa família + bicos para se sustentar ao contrário de trabalhar em vagas horríveis.

Isso melhoraria muito a situação dos empregos e a economia do país.";NEG;POS;0.6728602647781372;0.2529733180999756;0.07416638731956482
79;79;90;13k5izf;https://twitter.com/govbr/status/1658857999799140353;Governo no Twitter: O Governo segue trabalhando para melhorar a vida da população, com programas como o Brasil Sorridente, Mais Médicos, Bolsa Família, entre outras conquistas. Temos convicção de que ainda temos muito trabalho pela frente, é só o começo da união e reconstrução de um Brasil melhor. ;POS;POS;0.01596720889210701;0.19220581650733948;0.7918269634246826
80;80;245;qcy61a;https://www.google.com.br/amp/s/br.finance.yahoo.com/amphtml/noticias/auxilio-brasil-deve-extrapolar-teto-de-gastos-em-r-511-bilhoes-173110656.html;Auxílio Brasil deve extrapolar teto de gastos em R$ 51,1 bilhões ;NEU;NEU;0.03127944841980934;0.9342208504676819;0.034499797970056534
81;81;116;1izjyt4;https://i.redd.it/qchhlljtlple1.jpeg;Vocês acham que se como opção ao bolsa família o estado desse cursos profissionalizantes as pessoas iriam querem o Bolsa Família ou os Cursos profissionalizantes? [Origem da notícia](https://revistaoeste.com/economia/rubens-menin-e-mais-um-a-criticar-o-bolsa-familia-precisa-diminuir/#google_vignette);NEU;NEU;0.43427327275276184;0.5378090143203735;0.027917658910155296
82;82;424;qbq8xp;https://v.redd.it/f0sp9e1bgiu71;Bolsa Familia segundo Bolsonaro;NEU;NEU;0.04847874492406845;0.9161186218261719;0.035402681678533554
83;83;57;1kp3r4v;https://www.reddit.com/r/opiniaoimpopular/comments/1kp3r4v/enquanto_existir_bolsa_família_e_outras_formas_de/;"Enquanto existir bolsa família e outras formas de assistencialismo o Brasil jamais sairá da pobreza em que se encontra. Tenho uma vizinha que não trabalha. Vive da pensão alimentícia dos pais dos filhos dela e do bolsa família. Ela não produz nada para a sociedade, e recebe dinheiro dos pagadores de impostos. 


Enquanto o estado repassar o dinheiro de quem produz tomando através de impostos para quem nada produz através do bolsa família.  Nosso país jamais irá para frente. 


Muitas pessoas que recebem o bolsa família tem plenas condições de trabalhar mas preferem ser um peso para o estado. E o próprio estado incentiva isso. Políticos se beneficiam desse sistema de gente que não trabalha. 


É só acompanhar as estatísticas, vejam quem não trabalha está votando e quem trabalha está votando. ";NEU;NEG;0.34386810660362244;0.49286705255508423;0.1632649153470993
84;84;137;1ddmzvp;https://www.uol.com.br/esporte/futebol/ultimas-noticias/2024/06/11/corinthians-delegado-cre-em-fraude-via-bolsa-familia-no-caso-da-vai-de-bet.htm;Corinthians: delegado crê em fraude via Bolsa Família no caso da Vai de Bet;NEU;NEU;0.09170453995466232;0.8950864672660828;0.013209023512899876
85;85;24;13j57jr;https://www.infomoney.com.br/politica/cgu-identifica-r-38-bilhoes-de-pagamento-indevido-do-auxilio-brasil/;CGU identifica R$ 3,8 bilhões de pagamento indevido do Auxílio Brasil ;NEU;NEU;0.09591693431138992;0.8779968023300171;0.02608628012239933
86;86;17;16lstq1;https://www.infomoney.com.br/minhas-financas/proposta-de-consignado-do-auxilio-brasil-na-caixa-estimou-concessao-6-vezes-menor-que-demanda-real/;Proposta de consignado do Auxílio Brasil na Caixa estimou concessão 6 vezes menor que demanda real;NEU;NEU;0.04591292142868042;0.9296361207962036;0.02445095404982567
87;87;66;1hdd3ka;https://www1.folha.uol.com.br/mercado/2024/12/governo-deve-regular-bets-nao-tutelar-os-mais-pobres-diz-um-dos-pais-do-bolsa-familia.shtml;Governo deve regular bets, não tutelar os mais pobres, diz um dos pais do Bolsa Família ;NEU;NEU;0.0760638415813446;0.9006423354148865;0.023293841630220413
88;88;265;wg3mse;https://oglobo.globo.com/blogs/miriam-leitao/post/2022/08/com-consignado-dinheiro-do-auxilio-brasil-sera-desviado-dos-pobres-para-instituicoes-financeiras.ghtml;Com consignado, dinheiro do Auxílio Brasil será desviado dos pobres para instituições financeiras | A aprovação do consignado do Auxílio Brasil é uma forma de explorar mais ainda os pobres, política e financeiramente ;NEU;NEU;0.08368512988090515;0.8270121812820435;0.08930271118879318
89;89;405;vheipr;https://www.reddit.com/r/PortalRbn/comments/vheipr/beneficiários_com_nis_final_3_recebem_hoje/;"Beneficiários com NIS final 3 recebem hoje Auxílio Brasil Beneficiários com Número de Inscrição Social (NIS) com final 3 recebem hoje (21) a parcela de junho do Auxílio Brasil. O valor mínimo do benefício é de R$ 400. As datas seguem o modelo do Bolsa Família, que pagava os beneficiários nos dez últimos dias úteis do mês.

https://portalrbn.com.br/beneficiarios-com-nis-final-3-recebem-hoje-auxilio-brasil/";NEU;NEU;0.05967404320836067;0.8713209629058838;0.06900487095117569
90;90;31;104x51t;https://www.infomoney.com.br/minhas-financas/idec-pede-ao-ministerio-da-justica-suspensao-de-credito-consignado-atrelado-ao-auxilio-brasil/;Idec pede ao Ministério da Justiça suspensão de crédito consignado atrelado ao Auxílio Brasil;NEU;NEU;0.10425158590078354;0.8738430142402649;0.02190544828772545
91;91;84;1ga7ext;https://www1.folha.uol.com.br/poder/2024/10/zema-associa-bolsa-familia-a-dificuldade-de-empresarios-contratarem-no-pais.shtml;Zema associa Bolsa Família a dificuldade de empresários contratarem no país;NEU;NEU;0.09563060104846954;0.8891445994377136;0.015224836766719818
92;92;299;wjk3mo;https://i.redd.it/p7uiqe6h0kg91.png;Para cada 100 novas famílias no Auxílio Brasil até julho houve 37 vagas a mais de emprego no país.;NEU;NEG;0.014853212051093578;0.9544044137001038;0.03074236586689949
93;93;173;1iiec5j;https://www.camara.leg.br/proposicoesWeb/fichadetramitacao?idProposicao=2482950;[Max Lemos] PL 273/2025 (1): Dispõe sobre a inclusão de um microsseguro no Programa Bolsa Família para beneficiários, abrangendo as modalidades de seguro de vida, saúde, propriedade, agrícola e funeral.”. ;NEU;NEU;0.03386448696255684;0.9168028831481934;0.04933266341686249
94;94;94;13qx0qk;https://i.redd.it/e7w62p4kbu1b1.png;Bolsa Família supera trabalho com carteira em 13 estados;NEU;NEU;0.02380540780723095;0.901929497718811;0.07426511496305466
95;95;227;12l3yud;https://i.redd.it/xdx51auetpta1.jpg;13 estados tem mais pessoas com bolsa familia do que empregados;NEU;NEU;0.039067890495061874;0.93733811378479;0.023594021797180176
96;96;428;wui8z8;https://www.reddit.com/r/portugal/comments/wui8z8/sério_a_falta_de_noção_neste_sub/;"[Sério] A falta de noção neste sub Obrigatório ""aqui vai vasta"" porque não sou nem a primeira nem a segunda pessoa a escrever uma publicação assim mas....acho que o pessoal de IT neste sub não tem noção.

Sempre cresci numa familia ""pobre"", daquelas que chegavam a dia 15 do mês e tinham 20 euros na conta, e que nunca tinham dinheiro ao final do mês. Mcdonalds, jantar fora era coisa de aniversário, duas ou três vezes ao ano, brinquedos e consolas eram dados de primos mais velhos. Havia alturas em que se tinha que esticar a comida e vivia-se com os empréstimos da avó/amiga que se pagavam assim que se recebia.

Era uma situação de merda onde qualquer merdinha ou emergência nos metia no vermelho- Pneu furado, cano rebentado medicação porque ficamos doentes? Não havia muito espaço de manobra.

Mais tarde fui expulsa de casa e tive que sobreviver com a bolsa de estudo. Eram 311 euros, e ficava com cerca de 60 euros para comida depois de pagar renda na residência universitária e propina. 60 euros para comer e divertir-me. Mais uns 20-30 em biscates, aqui e ali. Não comia bem, até porque era tudo arroz/esparguete/sopa/pouquissima carne mas com os 80-110 euros lá ia conseuindo não pasasr fome.

Trabalho em Lisboa com uma bolsa de investigação de 486 euros. A renda são 200 euros (porque a casa é de um amigo), o Navegante são 40 e partilhamos as contas. Pouco ou nada sobra ao final do mês e tenho noção de ter uma sorte do caraças com o preço de renda.

Agora, digam-me de direito, como é que posso achar 1300  ""pouco""?  Vamos falar honestamente. Os salários em Portugal são uma miséria, é verdade. Mas ao longo dos últimos meses já tenho ouvido coisas como ""não consigo viver em Lisboa com 1500 liquidos"" ou ""sou pobre"".

Toda a minha vida conheci mulheres que com um salário mínimo tinham que cuidar dos filhos, pagar renda, coisas da escola e ainda arranjavam um pouco para visitas de estudo  ou levar os filhos a museus e mais que seja.

Tenho amigos liberais e de it a darem-me conselhos tipo ""a renda nunca deveria ser mais de uma semana de salário"" e fico espantada com a falta de noção aqui. Quando recebes 660,ou pouco mais liquidos ao fim do mês e mesmo t1 no meio do nada começam nos 400 como é que se pode gastar só uma semana de salário?

Em resumo acho que há muita falta de noção...  


  
EDIT: Pessoal eu NÃO VIVO EM LISBOA. O que disse foi que trabalho em Lisboa  depois um ponto final e que pago 200 euros de renda. Estou a viver a 45 minutos de carro e uma hora de comboio.";NEG;NEG;0.8527414798736572;0.1253165900707245;0.021942000836133957
97;97;152;1jal3vc;https://youtube.com/watch?v=ZD1q0tUCw_4&si=7DagN-UW3e_cAV8K;LULA corta BILHÕES do BOLSA FAMÍLIA e COLOCA em PROPAGANDA: FAZER não DE...;NEG;NEU;0.7162283658981323;0.2767869234085083;0.0069846888072788715
98;98;354;yrtmap;https://www.reddit.com/r/brasil/comments/yrtmap/nesses_ultimos_2_dias_estou_tendo_total_certeza/;"Nesses ultimos 2 dias estou tendo total certeza de que liberal odeia pobre. Eu vi liberal reclamar do auxilio brasil na era bolsonaro e agora estou vendo reclamarem do Bolsa familia do Lula, que é quase o mesmo fucking valor.

Eu sinceramente não entendo, não é possível que a fome das pessoas seja tão irrelevante assim para essa galera, e eu ressalto que eles reclamaram no governo bolsonaro também para destacar o fato de que eles odeiam auxilio não importa o governo, mas mais do que isso, eles odeiam pobre de um jeito radical. Eu não vejo eles falando pra diminuir o salario dos militares, do funcionalismo público, das verbas para empresas, ele só querem diminuir o gasto com quem passa fome, INCRÍVEL.

&#x200B;

https://preview.redd.it/plmc1kyg87z91.png?width=597&format=png&auto=webp&s=daf95f4b503a993529a6bc46a40a40cc906d554f";NEG;POS;0.8545651435852051;0.08734937757253647;0.05808546021580696
99;99;272;yl9ay1;https://i.redd.it/vs3vqpf4xrx91.png;No Globo, o Auxílio-Brasil já é chamado de Bolsa Família ;NEU;NEU;0.05426891893148422;0.9243210554122925;0.021410025656223297
100;100;418;g4mcft;https://www.reddit.com/r/brasil/comments/g4mcft/mano_a_dilma_caiu_porque_pegou_dinheiro/;Mano, a Dilma caiu porque pegou dinheiro emprestado na caixa pra pagar o bolsa família. Kkkkk pensa nisso com o que tá acontecendo agora como parâmetro. Sim, eu sei que esse foi o motivo técnico e que o verdadeiro motivo foi outro, mas falaremos do motivo que está na narrativa oficial.;NEU;NEU;0.27122199535369873;0.6303154230117798;0.09846258163452148
101;101;5;1deqymb;https://www.reddit.com/r/mistermoney/comments/1deqymb/app_play_store_empréstimo_auxílio_brasil/;"APP PLAY STORE Empréstimo Auxílio Brasil APP PLAY STORE Empréstimo Auxílio Brasil

[https://play.google.com/store/apps/details?id=br.com.emprestimodoauxiliobrasil.twa](https://play.google.com/store/apps/details?id=br.com.emprestimodoauxiliobrasil.twa)";NEU;NEU;0.03074386902153492;0.9121469855308533;0.05710906907916069
102;102;45;11e4jsp;https://www.reddit.com/gallery/11e4jsp;Para surpresa de 0 pessoas, o Centro da Indústria e Comércio de Bento Gonçalves, RS diz que trabalhadores em condição de escravidão é um problema causado pela Bolsa Família ;NEU;NEG;0.10624096542596817;0.8731672763824463;0.020591698586940765
103;103;148;10vhmmo;https://noticias.uol.com.br/politica/ultimas-noticias/2023/02/06/lula-ministerio-da-saude-nisia-trindade-cirurgias-sus.htm;Bolsa Família exigirá atestado de vacinação de crianças, diz Lula ;NEU;NEU;0.031026724725961685;0.949266791343689;0.01970655284821987
104;104;427;b98kyf;https://www.reddit.com/r/brasilivre/comments/b98kyf/guedes_elogiando_lula_e_bolsa_familia_dizendo_que/;"Guedes elogiando Lula e Bolsa Familia dizendo que ele mereceu ganhar duas eleicoes. Vcs concordam com o Guedes nesse ponto? 

""Vários governos que passaram gastaram R$ 300 bilhões, R$ 400 bilhões por ano pagando juros da dívida sem tomar nenhuma medida para corrigir. E o Lula chegou e pegou R$ 10 bilhões só, e atingiu 40 milhões de família favoravelmente com o Bolsa Família. Isso é um impacto extraordinário. Mereceu ganhar uma eleição, duas eleições. Soube trabalhar. Com pouco dinheiro melhorou a vida de muitos de brasileiros.""

https://m.oglobo.globo.com/economia/guedes-elogia-bolsa-familia-diz-que-lula-mereceu-ganhar-duas-eleicoes-23571341?utm_source=Twitter&utm_medium=Social&utm_campaign=O Globo";NEU;NEU;0.08720342069864273;0.739600419998169;0.17319615185260773
105;105;376;fytnu0;https://www.reddit.com/r/coronabr/comments/fytnu0/pesquisa_na_holanda_da_radboud_universty_medical/;"Pesquisa na Holanda da Radboud Universty Medical Center acredita ter encontrado um mecanismo crítico do COVID-19: o Coronavírus leva a uma diminuição das enzimas ACE2 e a um aumento na bradicinina, causando vazamentos para os pulmões. Link para o estudo:

[https://www.radboudumc.nl/en/nieuws/2020/radboudumc-researchers-publish-new-insights-into-covid-19](https://www.radboudumc.nl/en/nieuws/2020/radboudumc-researchers-publish-new-insights-into-covid-19) 

Retirei daqui:  [https://www.reddit.com/r/Coronavirus/comments/fyqflj/dutch\_researchers\_at\_radboud\_universty\_medical/?sort=new](https://www.reddit.com/r/Coronavirus/comments/fyqflj/dutch_researchers_at_radboud_universty_medical/?sort=new) 

Adendo 1: Há um estudo em andamento com as mesmas hipóteses no Brasil:  [https://bv.fapesp.br/pt/auxilios/106152/ensaio-clinico-de-inibicao-de-bradicinina-em-adultos-hospitalizados-com-covid-19-grave/](https://bv.fapesp.br/pt/auxilios/106152/ensaio-clinico-de-inibicao-de-bradicinina-em-adultos-hospitalizados-com-covid-19-grave/) 

Adendo 2:  A bradicinina foi descoberta por três fisiologistas brasileiros liderados por [Maurício Rocha e Silva](https://pt.wikipedia.org/wiki/Maur%C3%ADcio_Rocha_e_Silva) durante estudos sobre a histamina.";NEU;NEU;0.052723102271556854;0.9087955355644226;0.03848131000995636
106;106;275;qbhf5s;https://www.metropoles.com/colunas/igor-gadelha/ameaca-de-demissao-e-reuniao-tensa-no-alvorada-os-bastidores-do-auxilio-brasil;Ameaça de demissão e reunião tensa no Alvorada: os bastidores do Auxílio Brasil | Presidente Jair Bolsonaro deu ultimato para equipe econômica viabilizar arranjo para prorrogar auxílio emergencial ou lançar Auxílio Brasil;NEU;NEU;0.16265802085399628;0.7870648503303528;0.050277095288038254
107;107;16;16p00el;https://womaisceara.blogspot.com/2023/09/auxilio-brasil-recebedores-com-dados.html;Auxílio Brasil: recebedores com dados vazados têm direito a R$ 15 mil;NEU;NEU;0.05121275410056114;0.9056805372238159;0.04310663044452667
108;108;403;gm5r2j;https://www.reddit.com/r/brasil/comments/gm5r2j/recursos_para_sem_teto_santossp/;Recursos para sem teto ? (Santos,Sp) Ola eu sou ian 19 anos e preciso da sua ajuda. Eu moro com minha mae e irma (22), e eu nao aguento mais todo dia essas duas me odeiam, e me humilham. Por 2 anos eu sofri de depressão e ansiedade severa(coisa da qual minha mae tira sarro) porem eu me superei atraves de dieta e exercicio, estou a 8 meses sem precisar de remedios e ate participei de uma corrida, tambem arrumei emprego no uber eats antes dessa pandemia mais agora mesmo se eu trabalhar quase nunca vem pedido. Hoje foi o ultimo pingo eu não consigo aguentar mais, elas nao me respeitam hoje  a minha mae falou na minha cara que eu tinha que comer menos  se nao elas iam passar fome mesmo quando ontem aquelas mejeras compraram PIZZA, que eu nem posso comer por ser alergico à trigo. Eu decidi que vou me colocar pra fora entao oque eu preciso saber é: oque que existe para apoiar os sem tetos em Santos,Sp ou no Brasil? Ou talvez se voces conhecem algum jeito de arranjar um aluguel de ~400 porque vou receber do auxilio emergencial. Qualquer informação que voces teriam  eu ficaria grato em saber, obrigado.;NEG;NEU;0.4967615604400635;0.43528276681900024;0.06795559823513031
109;109;117;1jzpwrn;https://www.reddit.com/r/brasilivre/comments/1jzpwrn/depois_do_bolsa_família_vale_gás_pé_de_meia_luz/;"Depois do Bolsa Família, Vale Gás, Pé de Meia, Luz grátis, entre outros, vem aí... [https://www.cnnbrasil.com.br/politica/elite-deveria-ter-vergonha-diz-lula-sobre-investimento-em-educacao/](https://www.cnnbrasil.com.br/politica/elite-deveria-ter-vergonha-diz-lula-sobre-investimento-em-educacao/)

https://preview.redd.it/6vpi8hs5mzue1.png?width=1211&format=png&auto=webp&s=649d7b724a5020d0734abf658a2a757eef7b5b69

";NEU;NEU;0.1446595937013626;0.8138495087623596;0.04149085655808449
110;110;312;ouu5du;https://www.cnnbrasil.com.br/amp/business/2021/07/30/bolsonaro-avalia-mudar-nome-do-bolsa-familia-para-auxilio-brasil?utm_source=social&utm_medium=twitter-&utm_campaign=--cnn-business&utm_content=&__twitter_impression=true;Bolsonaro avalia mudar nome do Bolsa Família para 'Auxílio Brasil';NEU;NEU;0.09619011729955673;0.8705676794052124;0.033242207020521164
111;111;3;10396q5;https://www.estadao.com.br/economia/governo-perdoar-divida-auxilio-brasil-emprestimo-consignado/;Governo estuda perdoar dívida de quem pegou empréstimo consignado do Auxílio Brasil - Estadão;NEU;NEU;0.02869936265051365;0.9450082778930664;0.026292426511645317
112;112;18;16lsmam;https://www.infomoney.com.br/minhas-financas/proposta-de-consignado-do-auxilio-brasil-na-caixa-estimou-concessao-6-vezes-menor-que-demanda-real/;Proposta de consignado do Auxílio Brasil na Caixa estimou concessão 6 vezes menor que demanda real;NEU;NEU;0.04591292142868042;0.9296361207962036;0.02445095404982567
113;113;168;1itvips;https://portalrbn.com.br/caixa-paga-bolsa-familia-a-beneficiarios-com-nis-de-final-4-4/?feed_id=19814&_unique_id=67b70444883ca;Caixa paga Bolsa Família a beneficiários com NIS de final 4;NEU;NEU;0.04379395395517349;0.9188637137413025;0.03734242543578148
114;114;60;1htg3c7;https://www1.folha.uol.com.br/equilibrioesaude/2025/01/bolsa-familia-reduziu-casos-de-tuberculose-em-60-e-mortalidade-em-70-em-11-anos.shtml;Bolsa Família reduziu casos de tuberculose em 41% e mortalidade em 31% em 11 anos;NEU;POS;0.08181349188089371;0.8999610543251038;0.01822543703019619
