;Unnamed: 0;id Post;Comentario;Link;Classe Sentimento;rotulo;prob_NEG;prob_NEU;prob_POS
222;222;kbxlqn;"SÃO PAULO (Reuters) - A Advocacia-Geral da União (AGU) apresentou neste sábado ao Supremo Tribunal Federal (STF) o plano nacional de imunização contra o coronavírus, assinado pelo Ministério da Saúde.

Sob o título de “Plano Nacional de Operacionalização da Vacinação contra a Covid-19”, o documento entra no âmbito de processo que tramita no STF sobre a aplicação de vacinas no país.

O programa é divido em dez eixos, passando pela definição de população-alvo, vacinas que serão aplicadas, operacionalização das campanhas, orçamento e comunicação que será adotada.

“O êxito dessa ação será possível mediante o envolvimento das três esferas de gestão em esforços coordenados no Sistema Único de Saúde (SUS), mobilização e adesão da população à vacinação”, disse o documento.

O plano ressaltou que, atualmente, as vacinas contra a Covid-19 encontram-se em estudos de fase 3 e ainda não há um medicamento registrado e licenciado pelo país.

O governo federal disse que o Brasil já garantiu 300 milhões de doses de vacinas por meio dos acordos: Fiocruz/AstraZeneca (100,4 milhões de doses até julho/2020, mais 30 milhões de doses por mês no segundo semestre de 2021); Covax Facility (42,5 milhões de doses); e Pfizer (70 milhões de doses em negociação).

Os Estados Unidos anunciaram que o uso da vacina contra a Covid-19 da Pfizer foi autorizado na sexta-feira e que se espera que as primeiras inoculações aconteçam nos próximos dias.

No Brasil, o Ministério da Saúde disse, segundo o plano, que está fazendo prospecção de todas as vacinas e sediou encontros com representantes de diversos laboratórios que possuem vacinas em fase 3 de pesquisa clínica, para aproximação técnica e logística, destacando que é necessária a aprovação da agência reguladora Anvisa.

Quanto ao orçamento, o governo federal afirmou que já disponibilizou 1,9 bilhão de reais de encomenda tecnológica associada à aquisição de doses de vacina pela AstraZeneca/Fiocruz. Outros 2,5 bilhões de reais foram para adesão ao Consórcio Covax Facitity.

“Além disso, 177,6 milhões de reais para custeio e investimento na Rede de Frio, na modernização do Centro de Referência para Imunobiológicos Especiais (CRIE) e fortalecimento e ampliação da vigilância de síndromes respiratórias. E um destaque orçamentário de 62 milhões reais para aquisição de mais 300 milhões de seringas e agulhas.”

Entre as fases de vacinação, foram definidas quatro etapas prioritárias, começando por trabalhadores da saúde e idosos, pessoas com comorbidades na terceira fase e professores junto a funcionários do sistema prisional e forças se segurança/salvamento na última etapa.

Reportagem de Ricardo Brito; texto de Nayara Figueiredo";https://br.reuters.com/article/domesticNews/idBRKBN28M0WU-OBRDN;NEU;NEU;0.059762220829725266;0.8701557517051697;0.07008203119039536
223;223;1d75kgd;">Miguel Guimarães, vice-presidente da bancada parlamentar do PSD e antigo bastonário da Ordem dos Médicos, escondeu intencionalmente em 2021 dois pareceres do presidente do Colégio de Pediatria que, a não serem ‘barrados’, teriam permitido que muitos pais evitassem ir a correr vacinar filhos saudáveis contra a covid-19. O conteúdo dos pareceres, assinados pelo pediatra Jorge Amil Dias – que viria a ser ‘perseguido’ durante meses por Miguel Guimarães –, é agora finalmente revelado pelo PÁGINA UM, após ter sido necessário o recurso ao Tribunal Administrativo de Lisboa, uma vez que Carlos Cortes, o sucessor de Miguel Guimarães, também não quis revelar estes documentos fundamentais para um “consentimento informado”. Mais de dois anos depois, o PÁGINA UM quis saber se Miguel Guimarães se arrependeu do que fez. Não obteve resposta.

- O caso Público: a vergonhosa patifaria de um jornal colaboracionista https://paginaum.pt/2024/06/02/o-caso-publico-a-vergonhosa-patifaria-de-um-jornal-colaboracionista/
- Miguel Guimarães, um infame hipócrita anti-Hipócrates https://paginaum.pt/2024/06/01/miguel-guimaraes-um-infame-hipocrita-anti-hipocrates/
- 'Guru' da gestão da pandemia à beira do precipício por suspeitas de ocultação de dados https://paginaum.pt/2024/06/03/guru-da-gestao-da-pandemia-a-beira-do-precipicio-por-suspeitas-de-ocultacao-de-dados/
- Fauci Confesses He “Made Up” Covid Rules, Including Six Feet Social Distancing and Masking Kids – The Daily Sceptic https://dailysceptic.org/2024/06/03/fauci-confesses-he-made-up-covid-rules-including-six-feet-social-distancing-and-masking-kids/";https://paginaum.pt/2024/05/31/covid-19-ordem-dos-medicos-impediu-pais-de-conhecerem-parecer-que-nao-recomendava-vacinacao-a-menores-saudaveis/;NEU;NEU;0.1219697967171669;0.7935559153556824;0.08447423577308655
224;224;ox8tb9;">Porto Alegre: 29 anos  
>  
>São Paulo: 28 anos

&#x200B;

São Paulo (estado) no fim pelo visto teve que comprar aquelas doses extras só para compensar essa discrepância.

Aqui em Porto Alegre há tempos se fala que não é um bom lugar para trabalhar e existe um êxodo forte de jovens profissionais capacitados para fora. Muitos colegas e amigos de trabalho e faculdade foram para SP e SC nos últimos anos. Com certeza um censo atualizado refletiria isso.

Em tempo, hoje já estão vacinando mulheres de 28 anos em Porto Alegre, sendo homens amanhã e quinta, todos com 27+, faltando menos de 10 anos de faixa etária para completar a população adulta.";https://www.reddit.com/r/coronabr/comments/ox8tb9/distribuição_das_vacinas_35_dos_municípios_ainda/;NEU;NEU;0.4301918148994446;0.5259460210800171;0.04386220499873161
225;225;ne655u;Bem, tinha falado aqui no outro dia acerca da vacinação para quem tem diabetes, fui ao centro de saúde e estou registado lá como diabético, mas segundo percebi, tenho de esperar que abram a vacinação para a minha faixa etária? O limite de idade que falam agora de 55 anos, é para toda a gente ou ainda é para este grupo mais vulnerável?;https://www.reddit.com/r/portugal/comments/ne655u/megathread_covid19_semanário_de_sobrevivência/;NEU;NEU;0.09902618825435638;0.8751242160797119;0.02584967575967312
226;226;n3yzqy;Teste de anticorpo para avaliar resposta da vacina não significa nada.;https://www.reddit.com/r/coronabr/comments/n3yzqy/dúvida_sobre_igg_e_igm/;NEU;NEU;0.27919092774391174;0.6983132362365723;0.022495824843645096
227;227;qziig3;Alguém lhe diga que 98% dos elegíveis estão vacinados. Vai um histeria em Portugal completamente injustificada e que só desvia as atenções do que realmente importa. Vamos lá lixar a economia e o comércio local para não se falar do Cabrita, dos combustíveis ou das hipocrisias e incoerências do Costinha.;https://sicnoticias.pt/especiais/vacinar-portugal/2021-11-22-Ana-Gomes-defende-vacinacao-obrigatoria-contra-a-covid-19-4606a477;NEG;NEU;0.9606473445892334;0.02706911787390709;0.012283561751246452
228;228;kkmfis;"Pode ser que esta notícia esteja protegida por um paywall.

O r/coronabr entende a importância do acesso à informação e sugere aos nossos usuários a utilização do
[Outline](https://outline.com/https://www1.folha.uol.com.br/equilibrioesaude/2020/12/nao-dou-bola-pra-isso-diz-bolsonaro-sobre-brasil-estar-atras-na-vacinacao-contra-covid-19.shtml) ou instale o [burlesco](https://burles.co/)

Lembre-se que jornalismo também é trabalho, e, se possível, considere assinar o jornal. 

*I am a bot, and this action was performed automatically. Please [contact the moderators of this subreddit](/message/compose/?to=/r/coronabr) if you have any questions or concerns.*";https://www1.folha.uol.com.br/equilibrioesaude/2020/12/nao-dou-bola-pra-isso-diz-bolsonaro-sobre-brasil-estar-atras-na-vacinacao-contra-covid-19.shtml;NEU;NEU;0.06810423731803894;0.898991048336029;0.03290463984012604
229;229;p2yewl;Perdão pelo atraso de hoje, eu estava ocupado ME VACINANDO, CARALHO! PRIMEIRA DOSE!!!;https://www.reddit.com/r/coronabr/comments/p2yewl/brasil_administrou_no_total_158422879_doses/;NEU;POS;0.15547527372837067;0.7908113598823547;0.05371340364217758
230;230;p8xko9;A minha mae tomou a primeira dose da vacina mas nao a segunda e ela acabou ficando com uma dor no braço.;https://www.reddit.com/r/curitiba/comments/p8xko9/você_já_tomou_a_vacina_contra_covid19/;NEG;NEU;0.8828058838844299;0.10910295695066452;0.008091190829873085
231;231;nlgxmu;"Isso não faz sentido pra mim...pq é uma projeção com base no ritmo da vacinação no momento. E todos sabem que a vacinação tá longe de ser a ideal pq não tem doses suficientes.

A pfizer hoje confirmou que entregará as 200 milhões de doses em 2021 ainda. Ou seja....só vai demorar até o final de 2022, se ocorrer algo...

E a pfizer tá respeitando direitinho o calendário. Então não tem pq essa projeção ocorrer. A partir do mês que vem, as doses começam a ser entregues em maior volume.";https://www.reddit.com/r/coronabr/comments/nlgxmu/25_de_dezembro_de_2022_modelo_matemático_projeta/;NEG;NEG;0.557278037071228;0.4078402817249298;0.03488168120384216
232;232;1d75kgd;"PSDois a ser comparsa no crime da gestão da pandemia com o PS.

Esse parecer até foi noticiado na altura mas tiveste o gang guna todo da máquina do estado a perseguir o Chefe de pediatria por ter quebrado fileiras e ser contra a vacinação (nos jovens). 

Ainda não ouvi pessoalmente um médico português mostrar arrependimento, dúvidas ou mudar a sua postura sobre a gestão da pandemia, máscaras e injeções Covid. Todos defendem cegamente a atuação do governo e das instituições médicas. Os poucos que há a falar em público não são noticiados.

A não ser é claro por meios de comunicação alternativos ao nosso MSM.

Obrigado pela partilha OP.";https://paginaum.pt/2024/05/31/covid-19-ordem-dos-medicos-impediu-pais-de-conhecerem-parecer-que-nao-recomendava-vacinacao-a-menores-saudaveis/;NEG;NEU;0.5873890519142151;0.351648211479187;0.060962654650211334
233;233;mq1esy;"Advinha qual a estratégia que usaram?
Não ficaram nesta putaria de guardar vacina.";https://www.cnnbrasil.com.br/internacional/2021/04/13/reino-unido-bate-meta-e-vacina-todos-os-adultos-acima-de-50-anos;NEU;NEG;0.4191330671310425;0.5638436675071716;0.017023274675011635
234;234;oxv674;"Perfeito. Você escreveu bem demais. Eu não sei como se declara o fim de uma pandemia oficialmente - dado que é um fenômeno global por conceito - mas acho que uma vez que atingirmos um certo nível de cobertura vacinal, papo de mais de 80%, daria para declarar o fim da epidemia no Brasil. Os resultados dessa abrangência seriam óbvios. Não chegamos nem a 25% de toda a população e gradualmente vemos efeito (apesar dos números ainda estarem inaceitáveis - a gente se acostumou mal demais com meses de +2k mortos/dia).

Mas é isso, concordo em todos os graus com você. Precisa-se começar a comunicação onde zerar casos é virtualmente impossível e o Sars-COV-2 é mais um dos vírus endêmicos, com vacina, com os quais a gente convive.  


Assim como Sarampo, os surtos que acontecerem, serão surtos dos não vacinados. E a vida vai seguir assim, do mesmo jeito que o Sarampo. Não há motivo para não acreditar que as vacinas da Covid evoluam para serem tão eficazes contra infecção (porque mortes já são muito) quanto a de Sarampo.";https://www.reddit.com/r/coronabr/comments/oxv674/precisamos_conversar_qual_vai_ser_o_endpoint_da/;POS;POS;0.0521622858941555;0.15526805818080902;0.792569637298584
235;235;16eyj48;E as farmacêuticas pedem ao governo para vacinar há que fazer guita para o fecho do trimestre;https://pt.euronews.com/2023/09/09/covid-19-esta-de-volta-e-governo-portugues-apela-a-vacinacao;NEU;NEU;0.0800928920507431;0.8876886367797852;0.032218486070632935
236;236;ti8ngq;"O texto dá todos os detalhes mas o título ainda me desagrada já que o mais correto seria ***""não impediu a eventual adesão*** *à vacinação após meses de relutância causarem ainda mais mortes evitáveis"".*";https://www1.folha.uol.com.br/equilibrioesaude/2022/03/efeito-bolsonaro-nao-afetou-vacinacao-contra-covid-diz-estudo.shtml;NEG;NEU;0.9810638427734375;0.014080497436225414;0.004855587612837553
237;237;qc6xsd;"Vai ao centro de saúde ou à junta de freguesia. 

Se estás vacinado, é na hora.

Achei graça a teres dito pica; inusitado!";https://www.reddit.com/r/portugal/comments/qc6xsd/alguém_está_a_ter_problemas_a_fazer_o_certificado/;POS;NEU;0.08937112987041473;0.4024771749973297;0.508151650428772
238;238;l3bgol;"Não existe isolamento perfeito. Eles não deixam de ter contato, mesmo que restrito, com ""gente da cidade"". Quando se falam de índios, não estamos falando daquelas *""tribos perdidas sem contato com o mundo por 50 anos"".*

--

E o Índio tem muito menos resistencia e imunidade cruzada contra ""doenças de cidade"" por viver isolado, do que a população em geral, o que torna ele mais propício a ter os casos graves e muito graves (um dos motivos do COVID não ser tão letal é a resistencia cruzada que nós temos, por ter contato com o resfriado comum que é causado em muitas das suas variantes, por tipos de coronavírus).

--

Adicione isso ao fato que por viverem longe dos grandes centros, o acesso deles à saúde é bem restrito (as vezes tem que meter no helicoptero porque nem rua tem ligando eles à civilização).

--

E são relativamente poucos (800mil no total, sendo destes, cerca de 500mil vivendo isolados, e 300mil vivendo em cidades)

--

Mais fácil vacinar eles, do que aturar o Macron chorando.";https://www.reddit.com/r/brasilivre/comments/l3bgol/por_que_índio_é_grupo_prioritário_na_vacinação/;NEU;NEU;0.2550085783004761;0.6586332321166992;0.08635812997817993
239;239;mhl7y9;" No calendário do governo federal, o Brasil teria 48,287 milhões de doses de vacina contra a Covid-19 em abril. Pelo menos 20 milhões dessas doses não vão chegar. O ministro da Saúde, [Marcelo Queiroga](https://www1.folha.uol.com.br/equilibrioesaude/2021/03/saiba-quem-e-marcelo-queiroga-o-novo-ministro-da-saude-de-bolsonaro.shtml), disse nesta quarta-feira na Câmara que a coisa vai ser ainda pior: cerca de 22,8 milhões de doses vão desaparecer do cronograma do mês que vem. Seria o bastante para [vacinar](https://arte.folha.uol.com.br/ciencia/2021/veja-como-esta-a-vacinacao/brasil/) pelo menos 10,8 milhões de pessoas, quase dois de cada três idosos de 60 a 69 anos, o grupo de idade em que morrem 23% das vítimas da Covid-19 no Brasil.

 Parte dessas vacinas agendadas para abril era fantasia do [general Pesadello](https://www1.folha.uol.com.br/equilibrioesaude/2021/03/em-8-dias-pazuello-reduz-previsao-de-vacinas-pela-quinta-vez.shtml), o ex-nunca-ministro da Saúde. Eram as 8 milhões de doses da Covaxin da Índia e as 400 mil da Sputnik russa, que ainda não foram aprovadas pela Anvisa.

 Tem mais problema.

 O governo chinês decidiu acelerar a [vacinação no país](https://www1.folha.uol.com.br/mundo/2021/03/velocidade-de-vacinacao-na-china-e-grande-preocupacao-dizem-especialistas.shtml). Foi ao mercado local e comprou o que havia de vacina. Assim, as empresas chinesas ficaram sem sobras para adiantar entregas de insumos para outros países, segundo explicações que este jornalista ouviu no governo de São Paulo e no governo federal.

  

  

 O Butantan não recebeu na segunda quinzena deste mês a matéria prima para fazer as vacinas que previa entregar em abril. A Sinovac, que produz o insumo da [Coronavac](https://www1.folha.uol.com.br/equilibrioesaude/2021/01/coronavac-tem-eficacia-geral-de-504-no-estudo-feito-pelo-butantan.shtml), cumpre os prazos de entrega contratados, mas pelo menos por ora parou de fazer os adiantamentos solicitados pelo Brasil. A situação vai ficar apertada até pelo menos na primeira quinzena de maio. Em tese, a próxima remessa de insumos chega no dia 9 de abril.

 No calendário do governo, haveria cerca de 15,8 milhões de doses da Coronavac disponíveis em abril. Agora, o instituto do governo paulista prevê entregar 9,8 milhões de doses, cumprindo o contratado com o governo federal até o final do mês que vem (46 milhões de doses).

  Até a semana passada, o calendário do governo federal previa 21,1 milhões de doses da AstraZeneca/Oxford para abril. Também na semana passada, a presidente da Fiocruz, Nísia Trindade Lima, disse ao Senado que espera entregar por volta de 18 milhões de doses (18,8 milhões, no cronograma divulgado pela Fiocruz). Apenas em junho a instituição espera chegar a sua capacidade de produção plena. Para maio, também estão previstas menos doses que as registradas no calendário do governo federal (21,5 milhões, não 25 milhões).

 Mesmo descontados esses desastres, a conta pessimista do ministro Queiroga ainda não fecha, nem tirando de abril as doses do [consórcio internacional Covax](https://www1.folha.uol.com.br/equilibrioesaude/2021/03/nova-entrega-de-vacinas-contra-a-covid-ao-brasil-pelo-consorcio-covax-vai-atrasar.shtml) (quase 1 milhão) e aquelas que seriam importadas da Índia, prontas, pela AstraZeneca (2 milhões). Tem mais desastre?

 Pelo calendário federal da semana passada, em parte fictício, até o final de abril o país teria doses suficientes para vacinar mais de 31% da população vacinável (de 18 anos ou mais) e mais de 63% dos grupos prioritários. Pelas novas contas do ministro Queiroga, não deve imunizar mais do que 24% dos vacináveis e algo menos que a metade dos grupos prioritários.

 Com atraso maior na vacinação, a situação continuará desesperadora. Não resta alternativa a não ser [distanciamento social e máscaras](https://www1.folha.uol.com.br/equilibrioesaude/2021/03/priorizem-mascara-distanciamento-e-ventilacao-e-nao-limpeza-de-superficies-pedem-cientistas.shtml).

 Enquanto isso, Jair Bolsonaro continua a fazer [campanha contra o distanciamento social](https://www1.folha.uol.com.br/equilibrioesaude/2021/03/sem-mascara-bolsonaro-volta-a-dizer-que-nao-adianta-ficar-em-casa.shtml). O “pacto nacional”, o “comitê nacional” é em parte a farsa prevista. Algo vai se fazer no Congresso e no ministério. Bolsonaro quem sabe se aproveite de alguma despiora devido à ação do restante do país, de parte dos governadores, dos prefeitos, do Congresso, enquanto faz propaganda criminosa para suas falanges. É um parasita. ​

    **LINK PRESENTE:** Gostou desta coluna? Assinante pode liberar cinco acessos gratuitos de qualquer link por dia. Basta clicar no F azul abaixo.";https://www1.folha.uol.com.br/colunas/viniciustorres/2021/03/entenda-o-motivo-do-atraso-ainda-maior-da-vacinacao-contra-a-covid-19.shtml;NEU;NEG;0.09066279232501984;0.8792670965194702;0.03007015585899353
240;240;kbxpuk;Não tem data pra nada, e nem plano pra vacinar o restante da população que não faz parte dos grupos prioritários.;https://imgur.com/a/v5oQj3v;NEU;NEG;0.17864589393138885;0.7970935106277466;0.024260634556412697
241;241;o7qmw3;"Fonte: rede globo americana

Se fosse o trump:
""Mortes avancam, vacina nao eh capaz de parar o covid""";https://v.redd.it/s6yqawhypf771;NEU;NEU;0.4068467319011688;0.5656640529632568;0.027489319443702698
242;242;oneva7;"Já deu pra perceber que toda vez que o vírus circula muito, surgem novas variantes e as vacinas só vão ser eficazes contra elas até certo ponto.  
A ideia da vacina da gripe anual é a mesma: o lote anual protege contra o vírus que tem variação dominante. 

Se for pra evitar lockdown, isolamento, barreira sanitária entre países, melhor que tenha dose de reforço mesmo, ainda mais com o tanto de débil mental que insiste em não vacinar com medo de virar magneto.";https://gazetabrasil.com.br/brasil/sao-paulo/2021/07/19/estado-de-sao-paulo-anuncia-ciclo-anual-de-vacinacao-contra-a-covid-19/;NEG;POS;0.8214684128761292;0.13459911942481995;0.04393244534730911
243;243;oq3c3y;"Sei lá, essas vacinas aí n dão ruim não? Se ficar o bicho come e se correr o bicho pega

Pesquisei no Google acadêmico artigos q falassem sobre possíveis efeitos a longo prazo e n achei nada. Medo";https://imgur.com/FLsPKsw;NEG;NEU;0.6627577543258667;0.3107439875602722;0.026498181745409966
244;244;q2sart;"Já peguei a gripe

Então

Basicamente

Eu não vou tomar

(A vacina)

Eu sei...

Ah, eu sei...

Te entendo...

É que

Eu não vou tomar

É só isso

HAHAHAHAHAHAHAHAHAHAHAHAHAHA";https://www.medrxiv.org/content/10.1101/2021.08.19.21262139v1.full;NEU;NEU;0.16971974074840546;0.6731505990028381;0.1571296900510788
245;245;ne655u;"
Task force anuncia vacinação privilegiada para hotelaria no hellgarve.";https://www.reddit.com/r/portugal/comments/ne655u/megathread_covid19_semanário_de_sobrevivência/;NEU;NEU;0.017540816217660904;0.937188982963562;0.0452701561152935
246;246;ryr2cc;Quem se vacinou só quer argumentar a favor da vacina , óbvio! Uma espécie de eutanásia arrependida fazer o que? Falem a favor da vacina talvez dê certo no seu organismo, se ele for inteligente para evoluir, mas duvido.;https://www.gazetadopovo.com.br/vida-e-cidadania/mae-que-perdeu-filho-apos-vacinacao-contra-covid-19-tem-conta-suspensa-pelo-twitter/;NEG;NEU;0.8803274035453796;0.10447463393211365;0.015197991393506527
247;247;kecj68;"O TSE deveria mudar as regras das eleições de 2022: vira presidente quem conseguir vacinar mais gente. 

Vale tudo. Vale usar fundo eleitoral, vaquinha, dinheiro de empreiteira, qualquer merda. Só tem que vacinar, comprovar que vacinou e que a pessoa está imunizada. Quando atingirmos a imunidade de rebanho o vencedor é declarado e ele é obrigado a ficar o mandato todo controlando os pequenos focos da doença, gente vinda do exterior, etc. Se não controlar sofre impeachment.

Vc vai ver como a gente erradicava o covid no país rapidinho.";https://v.redd.it/d4qwc539uk561;NEU;NEU;0.3159390091896057;0.6046937704086304;0.07936733216047287
248;248;og4kmj;">Pelo menos 1.602.911 receberam uma vacina de dose única.

Essa é a única que dá pra ""contar"" de forma fácil, né? Parece que jé podiam ter metido as 4,5mi em diversos braços por aí.

Eu tenho uma opinião meio polêmica sobre essas Janssen, que a maioria que não concorda acho que no fundo é porque quer ela, mas enfim. Acho que elas deviam ser distribuídas para municípios pequenos e periféricos, aqueles que são o último elo da distribuição. Meter 100% na maioria desses pequenos, otimizar a logística, menos viagens de carro, avião e helicóptero com 50 doses. Eu moro em capital e nem tenho parentes no interior, então a opinião é imparcial, apenas do ponto de vista logístico mesmo.";https://www.reddit.com/r/coronabr/comments/og4kmj/brasil_administrou_no_total_109976127_doses/;NEU;NEU;0.4219396710395813;0.5298936367034912;0.048166655004024506
249;249;oqlyar;Louletano começa uma thread enquanto espera pela vacina no Pavilhão Desportivo Municipal de Loulé.;https://www.reddit.com/r/portugal/comments/oqlyar/para_quê_marcar_vacinação_covid19_no_site/;NEU;NEU;0.015617603436112404;0.9324368238449097;0.05194561928510666
