;Unnamed: 0.1;Unnamed: 0;id Post;Link;Contexto;Classe Sentimento;rotulo;prob_NEG;prob_NEU;prob_POS
43;43;79;1kpttau;https://www.reddit.com/r/OpiniaoBurra/comments/1kpttau/bolsa_família_e_outros_programas_sociais_não_são/;"Bolsa família e outros programas sociais não são nem de longe a melhor forma de acabar com a pobreza no Brasil Antes de tudo: me considero uma pessoa de esquerda e (por mais que tenha minhas críticas no geral) acho o Bolsa Família e outros programas sociais foram um grande avanço na situação do nosso país.

O resultado do Bolsa Família e de outros programas sociais no país é inegável, tirou uma parcela considerável da população da extrema pobreza e (entre outros feitos) tirou o Brasil do Mapa da fome. Mesmo assim, me peguei pensando hoje e cheguei na conclusão de que essa medida não é nem de longe a melhor maneira de acabar com a pobreza no país.

Ao invés de sustentarmos diretamente eles e arriscarmos termos uma população onde 40% das pessoas depende diretamente de um auxílio do governo(o que já adianto, é melhor que passarem fome) pelo fato de não termos dado à elas estrutura boa para melhorarem de vida, devíamos focar em fazer programas que realmente mudassem a fonte do problema (seja investindo nas escolas públicas, programas sociais, etc) geraria MUITO mais resultado à longo prazo (por mais que ainda tivesse obviamente a possibilidade dos políticos usarem isso como desculpa para roubar, por ser bem mais fácil de fazê-lo. Então um programa de combate à corrupção junto de operações para impedir isso também seriam ótimos).

Dito isso, seria possível de fazer no Brasil? A resposta, pelo menos pra mim, é que sim. Ao mesmo tempo tenho que reconhecer que isso dependeria perigosamente da boa vontade dos políticos, e é difícil que eles tenham já que você recebe bem mais votos com a abordagem direta do que com a indireta.

Eu ainda poderia citar pelo menos mais duas maneiras melhores que o atual Bolsa Família, só que aí o post ficaria muito grande .

É uma opinião burra?🫠";NEU;NEG;0.30298230051994324;0.44159209728240967;0.2554256021976471
44;44;154;1ikz9tb;https://oglobo.globo.com/politica/noticia/2025/02/08/lula-ligou-para-wellington-dias-e-cobrou-explicacoes-apos-anuncio-de-discussao-interna-sobre-aumento-no-bolsa-familia.ghtml?utm_source=aplicativoOGlobo&utm_medium=aplicativo&utm_campaign=compartilhar;Lula ligou para Wellington Dias e cobrou explicações após anúncio de discussão interna sobre aumento no Bolsa Família;NEU;NEU;0.04061924293637276;0.9449811577796936;0.014399714767932892
45;45;33;16fxl7s;https://www.reddit.com/r/antitrampo/comments/16fxl7s/bolsa_familia_auxilio_brasil_é_melhor_que_clt/;"Bolsa Familia / Auxilio Brasil é melhor que CLT    Algumas semanas atrás, ouvi relatos de pessoas que viajaram para RECIFE, me disseram que foram em lugares que tinham placas dizendo que precisavam de funcionários, essas mesmas pessoas questionaram os donos dos estabelecimentos e os próprios falaram que estava muito dificil achar pessoas para trabalhar de carteira assinada.  


   Eu fiquei bem pensativo sobre isso, porém cheguei a conclusões que realmente não vale a pena ter uma CLT se você recebe o bolsa familia e vou te explicar o porque, se você ganha 600 reais do auxilio, e consegue fazer algumas diárias que pagem \~80 reais, trabalhando por 15 dias (\~R$1200), no final do mês você teria simplesmente 1800 reais, o que muitos não chegam nem aos pés de receber.  


Se sua diária for maior é melhor ainda, ou seja, você estaria ganhando mais, trabalhando menos, talvez seja por isso o maior impacto no número de pessoas que não trabalham com carteira assinada.  


Discutam sobre isso e me falem o que acham  
";NEU;NEG;0.20161809027194977;0.5330116748809814;0.2653701901435852
46;46;157;1iua5fx;https://www.camara.leg.br/proposicoesWeb/fichadetramitacao?idProposicao=2485055;[Silas Câmara] PL 591/2025 (1): Altera a Lei nº 14.601, de 19 de junho de 2023 (Lei do Bolsa Família), e dá outras providências. ;NEU;NEU;0.04470144212245941;0.9253281950950623;0.029970388859510422
47;47;302;y9tqzx;https://g1.globo.com/politica/blog/andreia-sadi/post/2022/10/21/tcu-parecer-suspensao-emprestimo-consignado-auxilio-brasil.ghtml?utm_source=share-universal&utm_medium=share-bar-app&utm_campaign=materias;Parecer do TCU recomenda suspensão do empréstimo consignado do Auxílio Brasil;NEU;NEU;0.11110929399728775;0.8623605370521545;0.026530180126428604
48;48;77;1fw6npf;https://www1.folha.uol.com.br/mercado/2024/10/bets-dizem-que-beneficiarios-do-bolsa-familia-gastaram-r-210-mi-e-nao-r-3-bi-com-apostas.shtml?utm_source=app&utm_medium=push&utm_campaign=pushmultiplo&utm_content=pushfolha+pusheconomia&id=1728050037;Bets dizem que beneficiários do Bolsa Família gastaram R$ 210 mi e não R$ 3 bi com apostas;NEU;NEU;0.06610492616891861;0.9182277321815491;0.015667274594306946
49;49;250;yw9blt;https://g1.globo.com/politica/noticia/2022/11/15/aras-diz-ao-stf-que-emprestimo-consignado-do-auxilio-brasil-e-inconstitucional.ghtml?utm_source=share-universal&utm_medium=share-bar-app&utm_campaign=materias;Aras diz ao STF que empréstimo consignado do Auxílio Brasil é inconstitucional;NEU;NEU;0.35952287912368774;0.6124885678291321;0.027988599613308907
50;50;382;zw1wo6;https://www.reddit.com/r/EuSouOBabaca/comments/zw1wo6/confusão_na_véspera_de_natal_estou_errada/;"Confusão na Véspera de Natal. Estou errada? Olá, tenho 19 anos, estou preste a começar a faculdade ano que vem, trabalhei por um ano em um escritório de contabilidade, quando finalmente sai do trabalho fiquei um tempo procurando por outro afinal no Brasil, infelizmente sustentar uma vida universitária é algo difícil de se fazer sem apoio então tenho tentado manter todas as minhas economias para o avançar da minha vida acadêmica.
  
Acabei pegando um ""trabalho temporário"" para um final de ano, graças a uma indicação de familiar, em um supermercado e vou ficar nesse supermercado trabalhando 8h nos dias de semana e 6h nos finais de semana com uma hora de almoço.  

Resolveram oferecer esse trabalho pois sabiam que o final de ano era muito pesado para as operadoras de caixa fazerem tudo sozinhas, a começo de tudo, eu tinha sido contratada apenas para embalar os produtos no caixa. Porém ao chegar lá percebi que a situação era completamente diferente, não ajudavamos só na embalagem como também na devolução de produtos e auxilio com as operadoras, sem contar que de vez em quando o gerente pedia para que nós buscassemos alguns carrinhos e cestas pelo supermercado e estacionamento quando estavam em falta.  

Quando cheguei no primeiro dia, descobri que trabalharia com outras seis pessoas, a princípio acabei me dando bem com três garotas (Vamos chamar as mesmas de Eduarda, Júlia e Maria), Eduarda desistiu no primeiro dia porque o movimento era muito pesado, então tínhamos uma pessoa a menos. Tentei fazer amizade com os outros três, duas garotas e uma menino (E esses vão ser Manuel, Rebeca e Ana), mas toda vez que eu se quer falava com eles, simplesmente não me respondiam. Deixei pra lá e mais tarde na hora do almoço, descobri que Manuel, Rebeca e Ana, eram família de uma das conferentes do mercado, sendo Manuel o filho e Ana a namorada, tentei de novo falar com eles mas os três me ignoraram novamente.   
Um dia depois do ocorrido, Júlia começou a se queixar comigo sobre o comportamento de Ana e não busquei a reparar nisso pois sinceramente não estava muito interessada.  

Até que um dia antes da véspera de natal, com o movimento muito alto, acabei passando mal por uma queda de pressão, não estava me aguentando em pé direito e não importa para onde eu olhasse tudo estava branco, não tinha percebido meu estado até realmente parar para tomar água e notar a fraqueza ao me levantar quando peguei a garrafa no chão. Maria notou meu estado e me disse para ir no banheiro, ficar por lá alguns minutos, nesse momento eu aproveitei pra dizer que estava passando mal e ela falou com o gerente por mim. Quando fui ao banheiro, Rebeca foi também e viu como eu estava então perguntou e depois de eu dar uma curta explicação, ela puxou o celular e sentou-se. Maria apareceu para me trazer alguma bebida, viu a Rebeca e depois saiu.  

Fiquei exatamente meia hora no refeitório pois era o tempo que faltava para a gente sair do trabalho, quando me senti melhor para descer, fui até Júlia para ir junto com ela até a parada por precaução de algo e ela me informou que o gerente tinha dado mais meia hora pra elas por conta do movimento, sem escolha do que fazer quis voltar ao trabalho, mas uma das operadoras não permitiu e nesse momento Maria reclamou sobre o fato de os outros (o filho e uma das sobrinhas da conferente, ela não especificou qual, apenas deu uma característica) já terem ido embora mesmo com o movimento alto e o gerente não ter pedido para eles ficarem e do fato que ambas meninas muitas vezes ""escapuliam"" do trabalho, eles chegavam duas horas mais cedo que nós e saiam duas horas mais cedo, disse a ela que não tinha muito o que fazer e a moça do caixa nesse momento também concordou com Maria e falou que tudo bem ela ficar indignada pois elas (as sobrinhas) falaram horrores da gente. Nesse momento meu sangue subiu, já estava mal e ter que lidar com isso me fez ainda mais mal por conta da ansiedade (sou diagnosticada com TAG).  
 Na parada, acabei vendo Rebeca e incrivelmente ela acabou conversando comigo para saber se eu estava bem e eu comentei com ela que a garota tinha dito.   

Na véspera de Natal, tinha saído de casa mal pois ainda estava cansada do dia anterior e acabei não recebendo os melhores comentários da minha mãe pela manhã. Por coincidência, encontrei com Manuel, Ana e Rebeca na parada de ônibus moramos no mesmo bairro e eles estavam com mais um garoto (Esse vai ser chamado de Guilherme), dei bom dia a todos, novamente nenhum deles me respondeu, embora tive a impressão que conhecia o rapaz junto a eles, depois descobri que Guilherme veio substituir Eduarda. Me sentei junto de Rebeca com quem conversei no dia anterior e ela manteve uma conversa comigo por mínimos minutos até se afastar e começar conversar com o grupo. Eles começaram a falar de pegar um Uber e quando chamaram Rebeca até me ofereceu uma carona mas recusei pois senti e percebi que estava nítido que não me queriam por perto.  

Acabei iniciando o trabalho mais cedo para compensar o dia anterior já que fiquei sem fazer o serviço afinal não estava em condições e fiz meu trabalho normalmente. Contudo na hora do almoço as coisas começaram a dar errado, não tinha comido nada, Maria ao meu lado também não havia comido e ironicamente o Manuel, Rebeca e Ana atrasaram para voltar e não tinhamos como fazer a rotação então tivemos que seguir trabalhando, até que nos dez minutos de atraso Júlia falou com uma das conferentes e ela disse que podíamos subir para o refeitório e pediu-me para chamar os outros.  

No meio do caminho acabei encontrando eles e dando a informação, Ana me olhou com uma cara não tão amigável, já os outros nem me responderam. Guilherme também iria subir com a gente e ele acabou me pedindo para mostrar onde ficava o refeitório, pra não deixar o garoto sem saber de nada, mostrei a ele onde ficava tudo (desde o refeitório até a gerência) antes de ir realmente comer algo. Quando fomos pro refeitório encontrei Maria lá e ela me perguntou porque demoramos e eu contei a ela o ocorrido e nesse momento ela também deu uma revirada de olhos como se já imaginasse, acabamos descobrindo também que tinham comido o almoço dela e ela só estava sobrevivendo com algumas coxinhas que a padaria deu, então comprei alguns bolinhos para ela.  

Como ela estava em um canto separado presumi que ela nem tivesse conversado com os outros. Guilherme perguntou se já me conhecia e nesse momento nós dois nos demos conta que estudávamos na mesma escola, ao contrário do que imaginei ele foi simpático em todos os momentos e mesmo Maria falando sobre Ana e Rebeca de todas as formas, ele se manteu compreensível.  

Depois disso o dia correu normal, até a hora da saída, como eu era a única que tinha o costume de levar pouca coisa fui a primeira a chegar na parada de ônibus e logo após o grupo chegou, eram 7h da noite, já estava tudo escuro e a parada ficava em um local sem iluminação. Como fiquei encostada em uma parte do muro, o grupinho ficou ao lado, sentados na calçada de uma loja fechada. Até que Ana se levantou, tocou meu ombro pedindo licença, antes mesmo de eu tirar meu fone ela já tinha começado a falar sobre ""Que não sabia o que tinha feito mas que eu devia fazer meu trabalho e não olhar para o dos outros"", nesse momento eu dei um suspiro e expliquei a ela que se fosse pelo que aconteceu no almoço só tinham me pedido para chamar e ela falou que não era por isso e sim pelo que comentei com a Rebeca e respondi a ela que o que eu havia comentado era o que tinha acontecido no trabalho e que se quisesse podiamos resolver no trabalho. Ela retrucou dizendo que havia acontecido na rua e que queria resolver na rua e nesse momento foi onde eu já sabia que ela não queria conversa, pedi desculpas dizendo que podia tentar fazer não voltar acontecar e  nesse momento ela falou que ""eu não deveria fazer fofoca"" e aí eu perdi a cabeça, disse a ela que para início da conversa o que eu tinha comentado com a irmã dela era algo que me falaram e que só tinha dito uma característica (que a irmã dela também tem) e que se realmente fosse o problema isso eu sentia muito e podíamos resolver no trabalho, ela voltou a dizer que tinha ouvido as coisas na rua e eu lhe respondi que então atinhamos um problema pois as coisas que eu ouvi foi no trabalho e que nem o nome dela eu se quer sabia pois todas as vezes que eu falava com ela, ela me ignorava. Nesse momento, ela colocou a mão no peito dizendo que nunca havia escutado uma vez se quer me ouvir falar com ela, apenas respondi ""Sério? Poxa, é uma pena, eu sinto muito que você se sentiu ofendida mas infelizmente essas coisas acontecem no trabalho do mesmo jeito que me disseram que vocês também falavam horrores da gente, que nem havia sido uma das meninas mas a própria caixa do mercado e que se quisesse podiamos resolver no trabalho"" e nessa hora ela ficou irritada, começou a mexer as mãos e falar coisas que eu sinceramente não quis ouvir pois minha ansiedade estava atacando.

No final apenas me levantei dei uma boa noite, falei que não iria ficar ali discutindo no natal. Saí andando, mas antes dei meia volta e gritei ""Um bom Natal!"" e obviamente resmunguei o mais alto possível que ""Nunca vi alguém querer discutir com desconhecidos no Natal"", não sei se escutaram mas sei que não foi a melhor situação, que não agi no bom-senso e que quando sai de lá estava com o peito doendo e com uma tremenda falta de ar.  

Vou voltar a trabalhar novamente nessa quinta e sinceramente estou me perguntando se deveria tentar apaziguar as coisas, mas ao mesmo tempo ainda sinto aquela dor no peito quando lembro e isso me deixa ainda mais chateada.";NEG;NEG;0.5387296080589294;0.3125517666339874;0.1487186998128891
51;51;15;16pefi3;https://www.infomoney.com.br/minhas-financas/justica-manda-caixa-e-uniao-indenizar-4-milhoes-de-beneficiarios-do-auxilio-brasil/;Justiça manda Caixa e União indenizar 4 milhões de beneficiários do Auxílio Brasil;NEU;NEU;0.10120026767253876;0.8530886173248291;0.045711200684309006
52;52;404;jb13fi;https://i.redd.it/r0sqdm28f2t51.jpg;Evolução do déficit - Resultado das contas dos Governos do PT, Temer e Bolsonaro ;NEU;NEU;0.04825073480606079;0.9280770421028137;0.023672224953770638
53;53;126;1ki34ll;https://www.camara.leg.br/proposicoesWeb/fichadetramitacao?idProposicao=2506901;[Vermelho] PL 2208/2025 (1): Altera a Lei nº 14.601, de 19 de junho de 2023, que “institui o Programa Bolsa Família”, a fim de facultar aos Municípios e ao Distrito Federal a conveniência e oportunidade de conceder os benefícios do Programa Bolsa Família a estrangeiros. ;NEU;NEU;0.06558690965175629;0.8454829454421997;0.0889301672577858
54;54;0;13uyoy1;https://i.redd.it/u8lv6i1h3u2b1.jpg;A caixa despejou quase 500 Milhões de reais POR DIA em consignado do Auxílio Brasil ente 10 e 30 de outubro. Reduzindo a ZERO no dia 1 de novembro logo após o 2 turno. https://www.em.com.br/app/noticia/politica/2023/05/29/interna_politica,1499967/bolsonaro-causou-rombo-na-caixa-ao-tentar-vencer-lula-nas-eleicoes-de-2022.shtml;NEU;NEU;0.10935863107442856;0.8608164191246033;0.029824860394001007
55;55;19;13fkx1b;https://www.reddit.com/r/ConselhosLegais/comments/13fkx1b/estudante_que_não_mora_com_os_pais_pode_receber/;Estudante que não mora com os pais pode receber auxílio Brasil/Bolsa família Sei que tem o auxílio permanência mas não dá nem pro cheiro, principalmente pra quem morar em cidade diferente dos pais;NEU;NEU;0.24978312849998474;0.6849457025527954;0.06527120620012283
56;56;280;y8d4db;https://www.poder360.com.br/eleicoes/tse-proibe-bolsonaro-de-dizer-que-pt-votou-contra-auxilio-brasil/;TSE proíbe Bolsonaro de dizer que PT votou contra Auxílio Brasil;NEU;NEU;0.25925737619400024;0.7120946049690247;0.02864806167781353
57;57;387;r55tql;https://www.reddit.com/r/brasil/comments/r55tql/recomendação_de_notebook_entre_2_e_3_mil_reais/;"Recomendação de notebook entre 2 e 3 mil reais para trabalho/lazer leve Boa tarde, r/brasil. Minha querida mamãezinha me pediu auxilio para comprar um notebook, já que ela está há um bom tempo sem e está querendo adquirir um novo.

Ela não precisa de nada muito potente, vai ser para utilização da internet e pacote office.

Minha duvida é que eu realmente não entendo bulhufas de notebook, não faz muito tempo até estava vendo um para mim, para tudo em comparação com desktop high end, que acaba fugindo muito do propósito atual.

Eu pensei nesse valor porque seria provável conseguir com um processador um pouco mais recente, o que certamente daria mais vida útil ao aparelho, entretanto, pesquisando aqui existem mais opções do que eu consigo julgar adequadamente.

Alguém aqui do sub possui alguma sugestão? Não tenho nenhuma preferência por marca nem nada, só gostaria que fosse um hardware que dure sem começar a travar daqui seis meses.

&#x200B;

Edit: Quem tá dando Downvote aqui não deve ter mãe não, né?";NEU;NEU;0.3715236783027649;0.576076865196228;0.05239948630332947
58;58;56;1iyxi04;https://www.reddit.com/r/investimentos/comments/1iyxi04/bolsa_família_está_grande_e_precisa_diminuir_diz/;"Bolsa Família está grande e precisa diminuir, diz Rubens Menin https://preview.redd.it/95ww5vx4njle1.png?width=1024&format=png&auto=webp&s=858860f34094e784fb6824d6835cb65f07485dcb

[https://www1.folha.uol.com.br/mercado/2025/02/bolsa-familia-esta-grande-e-precisa-diminuir-diz-rubens-menin.shtml](https://www1.folha.uol.com.br/mercado/2025/02/bolsa-familia-esta-grande-e-precisa-diminuir-diz-rubens-menin.shtml)";NEU;NEG;0.06827826052904129;0.8884229063987732;0.04329892247915268
59;59;220;1h09l68;https://portalrbn.com.br/caixa-paga-bolsa-familia-a-beneficiarios-com-nis-de-final-7/?feed_id=10666&_unique_id=6745af6132db4;Caixa paga Bolsa Família a beneficiários com NIS de final 7;NEU;NEU;0.040282607078552246;0.9229987859725952;0.03671853616833687
60;60;340;zqrgib;https://www.reddit.com/r/PortalRbn/comments/zqrgib/caixa_paga_auxílio_brasil_a_beneficiários_de_nis/;"Caixa paga Auxílio Brasil a beneficiários de NIS de final 7 A Caixa Econômica Federal paga hoje (20) a parcela de dezembro do Auxílio Brasil aos beneficiários com Número de Inscrição Social (NIS) com final 7. Essa é a quinta parcela com o valor mínimo de R$ 600, que vigorará até dezembro, conforme emenda constitucional promulgada em julho pelo Congresso

https://portalrbn.com.br/caixa-paga-auxilio-brasil-a-beneficiarios-de-nis-de-final-7/";NEU;NEU;0.06542500853538513;0.853320300579071;0.08125462383031845
61;61;93;1ftseov;https://www1.folha.uol.com.br/mercado/2024/10/e-injusto-punir-beneficiario-do-bolsa-familia-que-aposta-em-bets-diz-pesquisadora.shtml;É injusto punir beneficiário do Bolsa Família que aposta em bets, diz pesquisadora ;NEU;NEU;0.20307573676109314;0.7750694155693054;0.02185489423573017
62;62;287;z9tdjq;https://www.reddit.com/r/brasilivre/comments/z9tdjq/benefício_de_auxílio_brasilbolsa_família_deveria/;"Benefício de Auxílio Brasil/Bolsa Família deveria sofrer desconto de INSS? 

[View Poll](https://www.reddit.com/poll/z9tdjq)";NEU;NEU;0.08352776616811752;0.8720428943634033;0.04442939534783363
63;63;284;wymp18;https://www.reddit.com/r/brasilivre/comments/wymp18/auxílio_brasil_é_do_bolsonaro/;Auxílio Brasil é do Bolsonaro 🎶 Durmam com essa;NEU;NEU;0.08300700038671494;0.8031366467475891;0.11385633051395416
64;64;283;y8b035;https://tab.uol.com.br/noticias/redacao/2022/10/19/eu-vivo-o-hoje-emprestimo-do-auxilio-brasil-e-usado-para-pagar-contas.htm;Eu vivo o hoje: empréstimo do Auxílio Brasil é usado para pagar contas - 19/10/2022;NEU;NEU;0.024765362963080406;0.9440465569496155;0.0311881136149168
65;65;370;ttbulj;https://www.reddit.com/r/investimentos/comments/ttbulj/alguem_ja_passou_por_uma_desdobramento_de_ações/;"Alguem ja passou por uma desdobramento de ações? (stock split) Boa noite pessoal,

Estou postando este tópico mais pelo fato de querer relatos de pessoas que passaram por desdobramento de ações (stock split), tenho X ações de empresa X em uma corretora, queria saber se preciso fazer algo durante esse processo ou simplesmente a corretora vai convenientemente aumentar a minha quantidade de ações vezes a quantidade multiplicadora que a ação foi dividida, visto que nunca passei por esse fenômeno.

Se serve de auxilio, é uma ação de uma empresa dos EUA e não do Brasil, então as regras podem ser um pouco diferentes talvez.

Desde já estou agradecido pelas respostas.";NEU;NEU;0.10917703062295914;0.8278329968452454;0.06298995763063431
66;66;25;10ek2te;https://i.redd.it/96q8c3vzgnca1.png;Usou auxílio Brasil para investir em Loteria;NEU;NEG;0.046521998941898346;0.9179033637046814;0.03557455167174339
67;67;417;lkb9xq;https://www.bbc.com/portuguese/brasil-56049425;Bolsa Família: taxar ricos para financiar política social elevaria PIB em 2,4%, diz estudo da USP ;NEU;NEU;0.03094792552292347;0.9451220035552979;0.023930082097649574
68;68;342;zqoclk;https://www.reddit.com/r/PortalRbn/comments/zqoclk/caixa_paga_auxílio_brasil_a_beneficiários_de_nis/;"Caixa paga Auxílio Brasil a beneficiários de NIS de final 7 A Caixa Econômica Federal paga hoje (20) a parcela de dezembro do Auxílio Brasil aos beneficiários com Número de Inscrição Social (NIS) com final 7. Essa é a quinta parcela com o valor mínimo de R$ 600, que vigorará até dezembro, conforme emenda constitucional promulgada em julho pelo Congresso

https://portalrbn.com.br/caixa-paga-auxilio-brasil-a-beneficiarios-de-nis-de-final-7/";NEU;NEU;0.06542500853538513;0.853320300579071;0.08125462383031845
69;69;113;18p8mf4;https://www.reddit.com/r/brasilivre/comments/18p8mf4/haddad_estávamos_com_um_problema_fiscal_herdado/;"Haddad: 'Estávamos com um problema fiscal herdado do governo anterior'. Na matéria falam de 60 BI, depois falam de 130 BI... É daí que falam que herdaram o país 'quebrado'. Reclamam de ter que pagar Bolsa Família, Precatórios, etc... E a solução que dão é gastar mais ainda. &#x200B;

https://preview.redd.it/umswp7oug28c1.png?width=814&format=png&auto=webp&s=158512da73dde215c511766225c19e9c7f249352

[https://www.noticiasaominuto.com.br/economia/2097738/estavamos-com-um-problema-fiscal-herdado-do-governo-anterior-diz-haddad](https://www.noticiasaominuto.com.br/economia/2097738/estavamos-com-um-problema-fiscal-herdado-do-governo-anterior-diz-haddad)";NEU;NEU;0.2502236068248749;0.7233499884605408;0.02642638422548771
70;70;42;1fqkjx3;https://eassim.com.br/lula-cobra-proibicao-do-uso-do-cartao-do-bolsa-familia-para-bets/;Lula cobra proibição do uso do cartão do Bolsa Família para bets;NEU;NEU;0.13452716171741486;0.8388608694076538;0.026611924171447754
71;71;165;1iunqo7;https://portalrbn.com.br/caixa-paga-bolsa-familia-a-beneficiarios-com-nis-de-final-5-4/?feed_id=20049&_unique_id=67b8537519da9;Caixa paga Bolsa Família a beneficiários com NIS de final 5;NEU;NEU;0.04417482763528824;0.9173896312713623;0.03843555226922035
