;Unnamed: 0;id Post;Comentario;Link;Classe Sentimento;rotulo;prob_NEG;prob_NEU;prob_POS
69;69;pwt2pi;"Tradução:

>Correspondência para: M Cevik mc349@standrews.ac.uk
O caso dos reforços universais é fraco e os benefícios não são claros

>O ressurgimento do covid-19 em países de alta renda com programas de vacinas avançadas levantou preocupações sobre a durabilidade da eficácia da vacina, especialmente contra a variante delta mais transmissível. Isso levou alguns a argumentar a favor de doses de reforço para a população em geral antes de evidências claras de benefício, o que acreditamos ser equivocado.

>Uma vez que os ensaios clínicos randomizados iniciais mostraram alta eficácia das vacinas contra um desfecho primário de covid-19 sintomático, 1 2 3 4 estudos observacionais continuam a avaliar e relatar o desempenho das vacinas no mundo real em diferentes contextos e ao longo do tempo. 5 6 Além de fornecer proteção direta contra a doença covid-19, as vacinas disponíveis também reduzem substancialmente a transmissão, em parte protegendo contra infecções sintomáticas e assintomáticas. 7 Apesar das preocupações sobre o potencial de escape imunológico da variante delta, estudos indicam consistentemente que as vacinas fornecem altos níveis de proteção contra doenças graves e sintomáticas, bem como morte causada por essa variante. 5 6

>Com esse contexto em mente, estudos com amostragem sistemática parecem sugerir uma modesta diminuição na proteção contra infecções ao longo do tempo. 5 6 No entanto, o objetivo principal das vacinas covid-19 é proteger contra doenças graves, em vez de infecções, e vários estudos bem planejados encontraram eficácia sustentada da vacina contra covid-19 grave para a maioria dos adultos. Um grande estudo no Reino Unido, publicado como um pré-impressão, usando um desenho de caso-controle baseado em resultados de PCR, mostrou que níveis muito altos de proteção contra doenças graves continuaram além de cinco meses após a vacinação, especialmente entre pessoas que não têm doenças subjacentes graves. 8

>Por outro lado, as reduções estimadas na proteção da vacina contra a infecção variam amplamente e são mais difíceis de interpretar. Essas estimativas dinâmicas entre estudos e países são fortemente influenciadas pela prevalência, comportamento e variantes circulantes, e compará-las não é confiável para determinar mudanças na proteção imunológica ao longo do tempo. Por exemplo, enquanto um estudo de Israel descobriu que a taxa relativa de infecção aumentou ao longo do tempo após a vacinação, vários vieses potenciais surgem porque o momento da vacinação não foi aleatório e fatores como risco de exposição a covid-19 e tendência de procurar testes confundem qualquer associação entre o tempo desde a vacinação e a infecção. 9Da mesma forma, embora as infecções entre os profissionais de saúde imunizados em San Diego, Califórnia, tenham aumentado de junho a julho, essas mudanças podem ser explicadas pelo aumento da prevalência na comunidade, em vez de uma diminuição abrupta da imunidade. 10 O efeito da mudança de comportamento na eficácia medida da vacina também é sugerido em outro estudo dos EUA que encontrou uma queda na eficácia ao longo do tempo apenas entre pessoas com menos de 65 anos. 11 Esses exemplos mostram os desafios fundamentais de avaliar a eficácia contra a infecção usando dados de vigilância de rotina e destacam o necessidade de amostragem sistemática, consideração de uma gama abrangente de fatores de confusão medidos e não medidos e interpretação cuidadosa. 5

>Resposta imunológica de longo prazo
Do ponto de vista imunológico, espera-se que os títulos de anticorpos neutralizantes do plasma diminuam eventualmente após a vacinação, mas respostas de plasmablast e células B germinativas robustas e de longa duração foram mostradas após a vacinação de mRNA, e as células B de memória mostraram aumentar ao longo de pelo menos seis meses, melhorar funcionalmente e fornecer proteção contra variantes. 12 13 Os títulos de anticorpos neutralizantes do plasma podem prever algum nível de proteção contra a infecção sintomática. No entanto, a compreensão da força dessa relação em períodos mais longos permanece limitada. 14 15Dadas as diferenças relatadas na eficácia sustentada contra doença grave versus infecção, é improvável que os anticorpos neutralizantes sejam o único mecanismo de proteção; a imunidade celular é mais importante na proteção de longo prazo contra doenças graves. 6

>Mais importante ainda, o efeito de longo prazo dos reforços na redução de infecções, transmissão e internações hospitalares permanece desconhecido. Embora os reforços aumentem os níveis de anticorpos no plasma e possam estender temporariamente a proteção mediada por anticorpos, não foi demonstrado que aumentem as respostas das células B e T de memória esperadas para fornecer proteção de longo prazo contra doenças graves para a maioria das pessoas imunocompetentes. 16 Em um estudo observacional de Israel relatando benefício associado a uma terceira dose da vacina Pfizer-BioNTech (BNT162b2), 17 o período de acompanhamento no grupo com reforço foi de apenas sete dias-pessoa para doença grave e 12 dias-pessoa para infecção - também curto para avaliar a eficácia a longo prazo. As descobertas também foram altamente vulneráveis ​​a confusão. 17Qualquer benefício potencial de doses adicionais, particularmente contra doença sintomática e grave, deve ser avaliado em dados de longo prazo, idealmente de ensaios clínicos randomizados. 18

>Doses adicionais de vacina são razoáveis ​​para pessoas que podem não atingir uma resposta adequada à vacinação primária por causa da imunossupressão ou idade avançada, 19 mas evidências exageradas de diminuição da imunidade para a população em geral já tiveram ramificações importantes, inclusive afetando a confiança na vacina. Além disso, o enfoque na redução da imunidade em países de alta renda desvia a atenção e o estoque limitado de vacinas da necessidade urgente de vacinação primária de pessoas sem imunidade, particularmente em países de baixa e média renda. Isso vai piorar as injustiças inaceitáveis ​​da vacina, prolongar a pandemia e seus devastadores impactos socioeconômicos e de saúde pública, e aumentar o risco de novas variantes. 20

>As grandes ondas epidêmicas que agora ocorrem pela primeira vez durante a era da vacina mostram a capacidade de mais variantes transmissíveis de desafiar o controle do covid-19, mesmo em países com alta cobertura. Atualmente, isso representa uma ameaça maior do que a diminuição da imunidade. A demonstração de que os níveis de anticorpos podem ser aumentados na população em geral não deve ser considerada evidência de eficácia a longo prazo, e dados clínicos robustos são necessários para avaliar a necessidade de doses adicionais. Os riscos de permanecer não vacinado são claros e superam em muito os benefícios desconhecidos de revacinar a população em geral. O rápido aumento da cobertura de vacinação em todo o mundo continua a ser a prioridade de saúde pública mais urgente.";https://www.bmj.com/content/374/bmj.n2320;NEU;NEU;0.2088376134634018;0.7476971745491028;0.043465230613946915
70;70;r1ia0b;"Pode ser que esta notícia esteja protegida por um paywall.

O r/coronabr entende a importância do acesso à informação e sugere aos nossos usuários a utilização do
[Outline](https://outline.com/https://www1.folha.uol.com.br/equilibrioesaude/2021/11/anvisa-quer-cobrar-vacinacao-contra-covid-para-entrada-no-brasil-mas-bolsonaro-resiste.shtml) ou instale o [burlesco](https://burles.co/)

Lembre-se que jornalismo também é trabalho, e, se possível, considere assinar o jornal. 

*I am a bot, and this action was performed automatically. Please [contact the moderators of this subreddit](/message/compose/?to=/r/coronabr) if you have any questions or concerns.*";https://www1.folha.uol.com.br/equilibrioesaude/2021/11/anvisa-quer-cobrar-vacinacao-contra-covid-para-entrada-no-brasil-mas-bolsonaro-resiste.shtml;NEU;NEU;0.0665801614522934;0.8966548442840576;0.03676503524184227
71;71;lbq7oe;"Primeiro, este sub está insuportável neste tipo de notícias. Sempre o mesmo tipo de comentários de tachos e corrupção e primos e amigos. Já não se aguenta, sinceramente. 

Segundo, não sei se esta demissão é boa ou má. Li algures que foi ele próprio que fez a denuncia das irregularidades. Rola uma cabeça mas, sinceramente, parece-me que foi mais por iniciativa do próprio. Acompanhei algumas entrevistas e sempre me pareceu uma pessoa muito sóbria e séria, com um discurso aborrecido mas tão bem-vindo nos dias que correm. Recentemente teve aquela tirada sobre o Ventura e os 11%, que foi completamente desnecessária, mas ainda deve estar lixado por causa da Marisa (visto que foi apoiante público dela). Esperemos que as coisas não piorem muito porque continuamos num bom ritmo de vacinação.

Por fim, é surreal a quantidade de falta de noção que existe por aí. Esta história das vacinas põe a nu a mentalidade das pessoas, tenho vergonha disto tudo.";https://sicnoticias.pt/especiais/coronavirus/2021-02-03-Demitiu-se-Francisco-Ramos-coordenador-da-task-force-da-vacinacao-contra-a-covid-19;NEG;NEU;0.9622459411621094;0.023914966732263565;0.013839132152497768
72;72;1akrjej;"Isso é um debate ético... É eticamente aceitável obrigar uma pessoa a injetar algo em seu corpo?

Eu diria que não, não é aceitável obrigar a vacinação. Deve-se incentivar, fazer campanhas, facilitar o acesso a vacina e educar os pais sobre a importância, mas obrigar não.";/r/residenciamedica/comments/1akri3b/você_é_a_favor_ou_contra_a_obrigatoriedade_da/;NEU;NEU;0.22285839915275574;0.7229064106941223;0.054235149174928665
73;73;oggu3l;Mas quem tem vacina pode ser portador do vírus, porque é que não tem de apresentar teste para comer no interior do restaurante?;https://www.reddit.com/r/portugal/comments/oggu3l/certificado_digital_da_primeira_dose_é_suficiente/;NEU;NEU;0.3753483295440674;0.6038720011711121;0.020779648795723915
74;74;zh97pe;Nao contrataria vacinados com as de mRNA. Sistema imunologico dos cara saturado, ficam doente por qlq coisa l.;https://www.reddit.com/r/brasilivre/comments/zh97pe/contratação_de_pessoas_que_não_se_vacinaram/;NEG;NEU;0.9743281602859497;0.019602684304118156;0.006069183349609375
75;75;kf49ev;"#[Não consegue abrir a notícia? Leia aqui.](https://outline.com/https://www1.folha.uol.com.br/equilibrioesaude/2020/12/bolsonaro-nao-vai-incentivar-vacinacao-para-covid-por-ser-contra-obrigatoriedade-diz-pazuello.shtml?utm_source=whatsapp&utm_medium=social&utm_campaign=compwa)

Apoie o jornalismo brasileiro, [assine o jornal](https://caiowzy.github.io/pulaCerca/assine?origem=https://www1.folha.uol.com.br/equilibrioesaude/2020/12/bolsonaro-nao-vai-incentivar-vacinacao-para-covid-por-ser-contra-obrigatoriedade-diz-pazuello.shtml?utm_source=whatsapp&utm_medium=social&utm_campaign=compwa).  
[^(Código-fonte)](https://github.com/CaioWzy/pulaCerca/)


*I am a bot, and this action was performed automatically. Please [contact the moderators of this subreddit](/message/compose/?to=/r/brasil) if you have any questions or concerns.*";https://www1.folha.uol.com.br/equilibrioesaude/2020/12/bolsonaro-nao-vai-incentivar-vacinacao-para-covid-por-ser-contra-obrigatoriedade-diz-pazuello.shtml?utm_source=whatsapp&utm_medium=social&utm_campaign=compwa;NEU;NEU;0.06700034439563751;0.8871398568153381;0.04585987329483032
76;76;lhv0ke;"#[Não consegue abrir a notícia? Leia aqui.](https://outline.com/https://www.band.uol.com.br/noticias/exclusivo-funcionarios-de-ubss-de-sao-paulo-revelam-que-doses-de-vacinas-contra-o-coronavirus-sao-jogadas-no-lixo-16324006)

Apoie o jornalismo brasileiro, [assine o jornal](https://caiowzy.github.io/pulaCerca/assine?origem=https://www.band.uol.com.br/noticias/exclusivo-funcionarios-de-ubss-de-sao-paulo-revelam-que-doses-de-vacinas-contra-o-coronavirus-sao-jogadas-no-lixo-16324006).  
[^(Código-fonte)](https://github.com/CaioWzy/pulaCerca/)


*I am a bot, and this action was performed automatically. Please [contact the moderators of this subreddit](/message/compose/?to=/r/brasil) if you have any questions or concerns.*";https://www.band.uol.com.br/noticias/exclusivo-funcionarios-de-ubss-de-sao-paulo-revelam-que-doses-de-vacinas-contra-o-coronavirus-sao-jogadas-no-lixo-16324006;NEU;NEU;0.057774584740400314;0.8919450044631958;0.05028044804930687
77;77;kf49ev;Ao anunciar vai sabotar a campanha de vacinação contra o COVID, Bolsonaro admite cometer um crime que vai matar centenas em nome do seu culto á burrice e á morte.;https://www1.folha.uol.com.br/equilibrioesaude/2020/12/bolsonaro-nao-vai-incentivar-vacinacao-para-covid-por-ser-contra-obrigatoriedade-diz-pazuello.shtml?utm_source=whatsapp&utm_medium=social&utm_campaign=compwa;NEG;NEG;0.899946928024292;0.09123407304286957;0.008818970993161201
78;78;ogx72y;Fico feliz de mais pela data ter se aproximado, mas oque essa vacina NÃO tá é antecipada.;https://bhaz.com.br/confira-o-novo-calendario-de-vacinacao-contra-a-covid-19-em-minas-gerais/;NEG;NEU;0.6626036167144775;0.20544201135635376;0.13195441663265228
79;79;1akrjej;Óbvio que tem que vacinar, basta um pequeno grupo não vacinado que doenças como sarampo voltam, galera esqueceu (apesar da pandemia) o que é morrer de doença infecciosa, e como morria gente disso. Não vacinar é expor a criança e a sociedade como um todo a um risco desnecessário. É anti-ético.;/r/residenciamedica/comments/1akri3b/você_é_a_favor_ou_contra_a_obrigatoriedade_da/;NEG;POS;0.9632673859596252;0.025873465463519096;0.010859212838113308
80;80;pnyq0n;"Lembrando que quem sai na porrada com o virus nao eh a vacina, eh o seu sistema imunológico.  A vacina serve para ""ensinar"" o seu sistema imunológico a identificar e atacar o vírus.

Se o seu sistema imunológico estiver comprometido, nao ha vacina no universo que resolva. A maioria dos vacinados que morreram se enquadram nessa categoria.";https://www.reddit.com/r/brasilivre/comments/pnyq0n/mais_de_7_mil_pessoas_vacinadas_contra_a_covid/;NEG;NEU;0.6424015760421753;0.3160950243473053;0.04150334745645523
81;81;ok1kz3;"Minha esposa tem uma loja no mercado livre e vende bodies e camisetas personalizadas por lá (tema delas é o geek standard, de naruto e dbz a John Wick) e mês atrás subimos um anúncio de camiseta de um jacaré vacinado, e, em pouco tempo, já virou o item mais vendido nosso no mercado livre, mesmo nesses meses de baixa atividade (em outubro deve esquentar de novo). 


Pessoal tá puto com essa situação e o deboche é um jeito de aliviar. 



Aliás, meu sogro quando descobriu que esse é o produto que mais vendemos, teve um treco e mandou uns 10 ""e o Lula?"", entrou em negação.";https://www1.folha.uol.com.br/equilibrioesaude/2021/07/de-ze-gotinha-a-jacare-mensagens-politicas-estampam-camisetas-na-vacinacao-contra-covid.shtml;NEG;NEU;0.7682549953460693;0.18988780677318573;0.041857194155454636
82;82;1eqq33b;Ataques são as vacinas;https://i.redd.it/jew6o2i2yaid1.jpeg;NEU;NEU;0.0850907415151596;0.8723757266998291;0.0425335131585598
83;83;oqlyar;A marcação é só uma forma de separar toda a gente..senão aparecem todos as 18.30 depois do trabalho. Depois a organização depende do centro de vacinação, fui em s.domingos de rana e demorei 25 min a ser vacinado (depois mais 30min), tinham uma fila para pessoas sem marcação, outra fila para a 1ª dose e outra fila para a 2ª dose;https://www.reddit.com/r/portugal/comments/oqlyar/para_quê_marcar_vacinação_covid19_no_site/;NEU;NEU;0.3762497305870056;0.5788126587867737;0.04493757337331772
84;84;rb2gf7;As crianças se tornaram a faixa que mais transmite e desenvolve a doença, ou seja se tornaram transmissores ideias, pois nesse idade há a não obrigatoriedade do uso da máscara, e sempre que eles estão com a doença ficam de quarentena o que óbvio causa um grande impacto no desenvolvimento escolar, tenho filhos nessa idade e eles vão tomar a vacina, sem falar que a ainda desenvolvimento de novas cepas do vírus e pode haver uma cepa que se desenvolva precisamente nessa faixa etária.;https://expresso.pt/coronavirus/2021-12-07-Covid-19-DGS-aprova-vacinacao-das-criancas-dos-5-aos-11-anos-6a5b6e5a;NEU;NEU;0.13020595908164978;0.7247916460037231;0.14500245451927185
85;85;pnyq0n;Se pegar as estatísticas da vacinação pelo mundo, inclusive no Brasil, fica bem claro que só a vacina tá reduzindo a taxa de mortalidade. Isso tá irritando a fã base do Bolsonaro porque eles sonhavam em ver esses resultados com o tratamento precoce. É só mais uma das 1000 cagadas desse governo. Criaram um bando de ignorantes pseudocientistas e agora não existe argumento nem dado estatístico que prove o contrário pra essa gente.;https://www.reddit.com/r/brasilivre/comments/pnyq0n/mais_de_7_mil_pessoas_vacinadas_contra_a_covid/;NEG;POS;0.9373096227645874;0.035903457552194595;0.02678696997463703
86;86;o9thp3;"Acho ainda muito cedo para andar com estas questões. 

Não pelo argumento toto de serem experimentais ou wtv. Mas porque ainda não temos histórico relevante da evolução da doença com a maioria da população vacinada.";https://expresso.pt/coronavirus/2021-06-28-Covid-19.-Ministra-da-Saude-admite-que-vacina-pode-fazer-parte-do-programa-de-vacinacao-7d1cf34c?fbclid=IwAR1oWAqYJnLrBc48OiDP88AjnzK-NMCDos7y3Xrm5P3c4K2T7TOX90aeOOQ;NEU;NEU;0.2852252423763275;0.6580952405929565;0.05667949467897415
87;87;138447v;"#[Não consegue abrir a notícia? Leia aqui.](https://12ft.io/https://noticias.uol.com.br/politica/ultimas-noticias/2023/05/04/prefeitura-de-sp-vacina-jair-bolsonaro.htm)

Apoie o jornalismo brasileiro, [assine o jornal](https://caiowzy.github.io/pulaCerca/assine?origem=https://noticias.uol.com.br/politica/ultimas-noticias/2023/05/04/prefeitura-de-sp-vacina-jair-bolsonaro.htm).  
[^(Código-fonte)](https://github.com/CaioWzy/pulaCerca/)


*I am a bot, and this action was performed automatically. Please [contact the moderators of this subreddit](/message/compose/?to=/r/brasil) if you have any questions or concerns.*";https://noticias.uol.com.br/politica/ultimas-noticias/2023/05/04/prefeitura-de-sp-vacina-jair-bolsonaro.htm;NEU;NEU;0.045661840587854385;0.9095476865768433;0.04479043930768967
88;88;oq70cy;"Só de não ficar internada e não ter um tubo na minha garganta, essa vacina já é ótima por isso. 

Agora é vacinar todo mundo de verdade pra não espalhar mais esse vírus.";https://oglobo.globo.com/sociedade/saude/vacina-da-pfizer-fornece-protecao-de-88-contra-internacoes-formas-graves-da-covid-provocada-pela-delta-diz-israel-25123260;POS;POS;0.32037922739982605;0.22669172286987305;0.45292913913726807
89;89;qllj7f;"Está começando a esfriar. Inverno... Nao posso afirmar. Mas inverno é fogo  pessoas fechadas em casa, sistema imunológico mais baixo. Se saírem as pessoas tendem a ficar mais perto e aglomerado. 

Holanda tem muita gente mais idosa. E estagnaram na vacinação em 76% mais ou menos na primeira dose.

País pão duro e lento de aprovar coisa que gaste dinheiro.

Espero que aprendam a lição e corram de vacinar/aprovar os que faltam. Incentivar";https://g1.globo.com/mundo/noticia/2021/11/02/holanda-anuncia-retomada-de-medidas-de-prevencao-contra-a-covid.ghtml;NEG;NEU;0.7384494543075562;0.2209487408399582;0.04060180485248566
90;90;lbq7oe;"O coordenador da task force da vacinação contra a covid-19, Francisco Ramos, renunciou esta terça-feira ao cargo.

Numa nota enviada às redações, o Ministério da Saúde refere que Francisco Ramos ""(...) renunciou ontem ao cargo, por irregularidades detetadas pelo próprio no processo de seleção de profissionais de saúde no Hospital da Cruz Vermelha Portuguesa, do qual é presidente do Conselho de Administração.""

""O funcionamento da Task Force mantém-se assegurado pelos restantes membros do núcleo de coordenação"", lê-se na nota.";https://sicnoticias.pt/especiais/coronavirus/2021-02-03-Demitiu-se-Francisco-Ramos-coordenador-da-task-force-da-vacinacao-contra-a-covid-19;NEU;NEU;0.10926662385463715;0.8624323010444641;0.02830108441412449
91;91;k8kxz9;" Eu sou voluntária na coronavac, como o estudo é duplo-cego, nem os pesquisadores nem os voluntários sabem se foi aplicada a vacina e o placebo. Mas me entristece MUITO toda essa desconfiança sobre a qualidade da vacina. Como profissional de saúde, eu confio nos pesquisadores do instituto Butantã e não tenho nenhuma ressalva da respeito da vacina, a aplicação foi tranquila e não senti nenhum efeito colateral.
Equipar a ANVISA, que é uma agência regulatória, com pessoas não qualificadas para ""sabotar"" uma vacina é um crime terrível contra a vida dos brasileiros. Muito me entristece tanta ignorância e polarização.";https://mobile.reuters.com/article/amp/idBRKBN28H1HZ-OBRDN?__twitter_impression=true;NEG;NEG;0.7741473913192749;0.1784462332725525;0.04740634560585022
92;92;sluuc1;Se não queres ser vacinado vens aqui perguntar o quê? Estás com medo que a GNR te apareça à porta?;https://www.reddit.com/r/portugal/comments/sluuc1/sms_vacinação_covid/;NEU;NEU;0.3080023527145386;0.6689388155937195;0.023058829829096794
93;93;mcarnt;Quanto mais cedo vacinar os policiais, mais cedo eles podem voltar a matar na periferia em segurança.;https://g1.globo.com/sp/sao-paulo/noticia/2021/03/24/sp-anuncia-vacinacao-contra-covid-19-de-professores-e-policiais.ghtml;NEU;NEU;0.06027114763855934;0.924362063407898;0.015366802923381329
94;94;nz05c4;"Finalmente a coisa começa a melhorar no quesito vacinação, junho e julho devem ser os melhores meses, com as vacinas da pfizer, jansen, astrazeneca e coronavac sendo distribuídas ao mesmo tempo, com a coronavac se tornando a menos distribuída em números.

Vamo q vamo, ninguém aguenta mais pandemia.

Saiii catiça do atila.";https://correiopaulista.com/governo-antecipa-em-30-dias-e-promete-todo-o-estado-de-sao-paulo-vacinado-no-dia-15-de-setembro/amp/;POS;POS;0.2684723138809204;0.31160956621170044;0.41991809010505676
95;95;k5oas3;Na segunda fase estava a ser discutida a implementação de sítios dedicados e formas alternativas, talvez farmácias na terceira fase. Vamos ver na conferência de imprensa, existem problemas com o transporte dos acamados e dos que têm de ficar em casa, e sinceramente se não começarem a vacinar a população ativa, que é quem propaga o vírus, logo na segunda fase, nem em 2002 nos livramos disto.;https://www.reddit.com/r/CoronavirusPT/comments/k5oas3/quanto_tempo_vai_o_país_a_demorar_a_vacinar_toda/;NEU;NEU;0.18555352091789246;0.7541852593421936;0.060261182487010956
