;Unnamed: 0;id Post;Comentario;Link;Classe Sentimento;rotulo;prob_NEG;prob_NEU;prob_POS
113;113;lg54o3;" Um dos grandes legados da Constituição de 1988, motivo de orgulho nacional para muitos, o SUS (Sistema Único de Saúde) nunca esteve sob escrutínio tão intenso como durante a pandemia.

 Tem sido festejado por sua capacidade de responder à crise na mesma medida em que criticado por suas limitações. Como pano de fundo, corre uma discussão que tem animado os adeptos de uma visão mais liberal sobre a saúde: como inserir o setor privado em sua operação.

 Especialista em gestão da saúde, o curitibano Silvio Guidi é um dos que apontam a existência de um certo preconceito contra a presença do setor privado na área. Isso tem ficado mais claro, diz ele, no debate sobre a vacinação contra a Covid-19, em que empresas e clínicas privadas buscam ter um papel.

 “Na área da saúde, um real gasto no setor privado é um real a menos que onera o setor público. Esse raciocínio vale também para a vacinação na pandemia”, afirma Guidi.

 Mestre e doutor em Direito Administrativo pela PUC-SP, ele tem 15 anos de experiência com administração hospitalar e dois livros publicados sobre gestão da saúde.

 Não deveria haver problema, diz ele, com a compra de vacinas pelo setor privado, desde que não seja um processo predatório com relação ao cronograma de prioridades de imunização de grupos emergenciais definido pelo setor público.

 Em outras palavras, vacinados os trabalhadores na linha de frente na área da saúde e categorias vulneráveis como idosos e indígenas, o setor privado deveria entrar com tudo na estratégia de imunização.

 “Precisamos de esforços para proteger os mais vulneráveis. Depois que você resolve esses problemas, você volta para uma situação típica da área da saúde, em que há demanda para serviços públicos e privados”, afirma.

 Nas últimas semanas, têm proliferado iniciativas de envolvimento do setor privado na aquisição de vacinas. Primeiro foi a Associação Brasileira das Clínicas de Vacina (ABCV), que anunciou a intenção de comprar doses da indiana Bharat Biontech.

 Depois, veio a tentativa de empresas brasileiras de grande porte de comprar cerca de 35 milhões de doses da vacina da AstrZeneca para imunizar seus funcionários, com a contrapartida de doação de metade para o SUS.

 Ambas as tentativas receberam uma saraivada de críticas, acusadas de estarem furando a fila do calendário oficial de vacinação e privilegiando uma elite que teria acesso à proteção de maneira antecipada. No momento, estão em suspenso, esperando o melhor momento para voltarem à carga.

 Para Guidi, esse tipo de raciocínio de público contra privado é simplista. É interesse de toda a sociedade, afirma, que o ritmo de imunização seja o mais rápido possível, para acelerar a imunização coletiva, que é o que derrota o vírus.

 “Colocar todo mundo na fila única não resolve o problema da justiça social. Você pega a população que tem condição de fazer a vacinação privada, e isso ajuda a aumentar a imunização coletiva. Beneficia também as pessoas sem condição financeira”, afirma.

 O que falta, diz ele, é uma estratégia de comunicação eficiente para deixar claras as vantagens de se conjugar vacinação pelos setores público e privado.

 “Tem que haver um marketing republicano, legítimo. E não o marketing populista, de não permitir a vacinação privada. É preciso levar em conta quem mais está sofrendo com essa situação. É o pobre que pega o ônibus que vai sofrer. Discursos pouco pragmáticos não ajudam”, afirma.

 Um exemplo do que ele chama de discurso pouco pragmático, e muito ideológico, veio na reação que se seguiu à menção, no ano passado, de possíveis parcerias entre os setores público e privado na gestão de postos de saúde. “A reação foi desmedida. Era apenas um estudo de viabilidade”, afirma.

 Mas isso é revelador, diz ele, sobre a dificuldade de se aceitar a presença do setor privado em alguns setores. “Qual a diferença entra a concessão de uma rodovia e de um hospital? No caso da rodovia, a conta é paga apenas por quem a utiliza, com pedágios. Numa UBS [Unidade Básica de Saúde], é paga por todo mundo. O setor privado equipa, constrói e presta serviço”, afirma.

 Ele afirma que aos poucos tem diminuído a resistência à presença do setor privado em áreas da chamada “bata cinza”, ou seja, serviços como administração, limpeza e segurança de unidades de saúde. O próximo passo, diz, é que isso se estenda para a “bata branca”, as atividades de saúde propriamente ditas.

 Outro problema, afirma, é uma certa autossuficiência de órgãos regulatórios como a Anvisa (Agência Nacional de Vigilância Sanitária), responsável pela aprovação de medicamentos e vacinas. Não há, diz Guidi, uma abertura a visões de mercado e do setor privado.

 “A Anvisa não pode ser tão fechada que você não consiga capturar as melhores opiniões de especialistas, da sociedade, do mercado privado, das farmacêuticas”, diz.

 Em resumo, diz ele, o Brasil tem muito medo do setor privado, e não apenas no caso da Anvisa.

 “Quando é nomeado um diretor do mercado para uma agência, sempre se fala que essa pessoa está indo atender um interesse de mercado ou de empresas. Não é uma questão de atender aos interesses do mercado, mas sim de ter uma visão do mercado”, afirma.";https://saidapeladireita.blogfolha.uol.com.br/2021/02/09/brasil-nao-pode-rejeitar-o-setor-privado-na-vacinacao-contra-a-covid-diz-especialista-em-gestao-de-saude/;POS;NEG;0.06044433265924454;0.43238186836242676;0.5071737170219421
114;114;sluuc1;Tenta confirmar para ver se o sistema aceita a marcação. Se aceitar, aparece no centro de vacinação. Quando fui tomar a 3a dose so me perguntaram se tinha marcação… nem verificaram se era verdade, nem as horas da mesma..;https://www.reddit.com/r/portugal/comments/sluuc1/sms_vacinação_covid/;NEU;NEU;0.4149051904678345;0.5519883036613464;0.03310646116733551
115;115;qziig3;Esta discussão em Portugal é completamente desnecessária. Melhor, é prejudicial. Não se deve mexer no que está excelente. Não vamos correr o risco de aumentar a taxa de vacinação em 1/2% para depois criar uma resistência às vacinas no geral. Aliás, todo o espetáculo que temos vindo a assistir no país nas últimas semanas (imensa discussão de medidas, as novas regras na Madeira, etc) faz mais pelos anti-vaxxers do que eles alguma vez fizeram por eles.;https://sicnoticias.pt/especiais/vacinar-portugal/2021-11-22-Ana-Gomes-defende-vacinacao-obrigatoria-contra-a-covid-19-4606a477;NEG;NEU;0.915035605430603;0.0545516163110733;0.03041285090148449
116;116;jecuxh;"Eu também fico com o pé atrás. Apesar de falarem que é segura não sabemos os possíveis efeitos colaterais que podem existir visto que cada organismo age de uma maneira diferente.

Uma vacina leva muito tempo para ser desenvolvida apesar do sars e a mers estar rodando a asia e o oriente médio há um bom tempo.

Enfim só na prática iremos saber o que vai de fato ocorrer.";https://www.reddit.com/r/desabafos/comments/jecuxh/não_sou_antivax_por_duvidar_da_vacina_da_covid19/;NEU;NEU;0.38940805196762085;0.4968072175979614;0.11378473788499832
117;117;s8k3au;"Não existe discussão, nem polêmica. É unânime entre os órgãos sanitários e/ou de saúde que as crianças devem ser vacinadas contra covid19, só maluco é contra vacinação infantil.

O primeiro link atesta que as crianças geram imunidade após a infecção por covid, é interessante a informação porém não é ideal, já que não faz sentido alguém ter que pegar a doença pra ficar protegido da doença.

Segundo link é de um artigo submetido no meio do ano de 2021 antes da chegada da Omicron (talvez até da Delta), então além dos dados estarem defasados, os autores assumem que quem pega covid ou morre, ou recupera 100%, sendo que não é bem assim dada a quantidade de gente sequelada que vemos por aí, com efeitos de longo prazo ainda desconhecidos já que é uma doença nova. [CDC observou que nas crianças que tiveram covid o risco de desenvolver diabetes é 2,6 vezes maior.](https://www.healthline.com/health-news/experts-criticize-cdc-report-on-covid-19-and-diabetes-risk-in-kids)

Todos os ""riscos"" da vacinação são dezenas de vezes maior ao se pegar a doença, não tem como alguém, com mínimo de bom-senso, chegar à uma conclusão diferente da de ser favorável a vacinação infantil.

Como que alguém acha normal uma criança, inocente da vida, ficar doente, sofrer, ser hospitalizada ou até morrer de algo que é, em grande parte, evitável com vacinação?";https://www.reddit.com/r/coronabr/comments/s8k3au/gente_essa_discussão_que_as_crianças_não_precisa/;NEU;NEU;0.2737307846546173;0.6291083097457886;0.0971609428524971
118;118;mbccbf;"Equiparar os EUA ao neoliberalismo ou capitalismo de livre mercado é um corolário do Macarthismo, o qual você parece forte defensor. A união americana é a sociedade e sistema político mais diverso do mundo, querer colocarmos como os promotores do neoliberalismo é tosco.

Pros próximos 4 anos a economia americana vai dar um forte rebote, graças a campanha de vacinação mais bem sucedida do mundo e aos estímulos econômicos dados aos trabalhadores, enquanto lugares como a UE e o Japão vão manter política monetária conservadora, vacinação travada por burocracias e população envelhecendo, porque veja só: os jovens mais qualificados do mundo inteiro não querem ir pra Alemanha ou para a Dinamarca, mas para os Estados Unidos, o país que lidera o mundo em ciência e tecnologia, e um país cada dia mais culturalmente e etnicamente diverso.

\> É preciso saber usar dos dois modos, assim como alguns dos países com maior índice de felicidade nos mostram (Finlândia)

Esse mesmo índice coloca os EUA como 18o país mais feliz, você considera isso um ""péssimo lugar para se viver""?";https://www.reddit.com/r/brasil/comments/mbccbf/late_stage_capitalism_transformou_os_eua_num/;NEG;NEU;0.7702898979187012;0.17103873193264008;0.05867144092917442
119;119;r2zia7;"> Grupo de trabalho quer vacinas só para casos de risco, mas diz que será ignorado. **Governo já anunciou as vacinas**

A ser verdade, é um escândalo total.";https://expresso.pt/sociedade/2021-11-26-Covid-19.-Peritos-da-DGS-contra-vacinacao-das-criancas-a865f65f;NEG;NEU;0.5208645462989807;0.4555448591709137;0.023590655997395515
120;120;ip63zy;Começar em Janeiro não quer dizer todo mundo em Janeiro... Acho que a faixa etária media vai ser vacinada lá pra junho/junho;https://www.reddit.com/r/coronabr/comments/ip63zy/eduardo_pazuello_afirmou_que_a_vacinação_da/;NEU;NEU;0.15110285580158234;0.8346365094184875;0.014260595664381981
121;121;r6eilv;"Vai acontecer. O povo não questiona nada, ""em nome da ciência"" aqueles com más intenções fazem o que querem, o rebanho segue o pastor!

Estou vacinado contra o covid. Não sou anti-vacinas, sou contra as ditaduras que querem implementar!";https://24.sapo.pt/atualidade/artigos/covid-19-von-der-leyen-admite-discussao-sobre-vacinacao-obrigatoria-na-ue;NEU;NEG;0.46327143907546997;0.4831066131591797;0.05362194776535034
122;122;1d75kgd;"Nunca percebi porque foram vacinadas as crianças quando a vacina tinha pouco ou nenhum efeito positivo nas mesmas, pois não impedia nem evitava o contágio de COVID. 


Os meus filhos, saudáveis, não foram vacinados e nem conheço casos de pessoas que os tenham vacinados.";https://paginaum.pt/2024/05/31/covid-19-ordem-dos-medicos-impediu-pais-de-conhecerem-parecer-que-nao-recomendava-vacinacao-a-menores-saudaveis/;NEU;NEU;0.23985150456428528;0.5765424370765686;0.18360604345798492
123;123;pj58t9;Aqui onde moro implementaram essa bizarrice. Fui impedido de fazer o teste prático de direção por conta dessa porra! Meses e meses de espera (por conta dos lockdowns) e quando chega o dia da prova me pedem a porra do cartão de vacina. Isso que é um país livre!;https://www.otempo.com.br/politica/bolsonaro-diz-que-pretende-revogar-lei-que-obriga-vacinacao-contra-a-covid-19-1.2537861;NEG;NEG;0.9825906157493591;0.009817587211728096;0.007591789122670889
124;124;169ultf;Culpa do Bozo e sua manada de anti-vacina.;https://oglobo.globo.com/saude/noticia/2023/09/03/cao-e-diagnosticado-com-raiva-em-sao-paulo-doenca-e-letal-em-quase-100percent-dos-casos-e-pode-afetar-humanos.ghtml;NEG;NEG;0.9445228576660156;0.04532404989004135;0.0101531483232975
125;125;xxcfve;"Certeza que Boulos está mentindo.

A vacina é vírus atenuado e foi isso que provavelmente positivou.";https://i.redd.it/jamqp8wqa8s91.jpg;NEG;NEU;0.7372557520866394;0.2514098286628723;0.011334419250488281
126;126;jg33z5;"#[Não consegue abrir a notícia? Leia aqui.](https://outline.com/https://veja.abril.com.br/politica/se-eleito-franca-nao-exigira-vacinacao-obrigatoria-contra-covid-19-em-sp/amp/)

Apoie o jornalismo brasileiro, [assine o jornal](https://caiowzy.github.io/pulaCerca/assine?origem=https://veja.abril.com.br/politica/se-eleito-franca-nao-exigira-vacinacao-obrigatoria-contra-covid-19-em-sp/amp/).  
[^(Código-fonte)](https://github.com/CaioWzy/pulaCerca/)


*I am a bot, and this action was performed automatically. Please [contact the moderators of this subreddit](/message/compose/?to=/r/brasil) if you have any questions or concerns.*";https://veja.abril.com.br/politica/se-eleito-franca-nao-exigira-vacinacao-obrigatoria-contra-covid-19-em-sp/amp/;NEU;NEU;0.0725831687450409;0.8721592426300049;0.055257584899663925
127;127;r6eilv;"Vamos colocar de parte a discussão sobre o benefício/custo da vacinação e pensar única e exclusivamente sobre as questões sociais.

Se já existe um sentimento anti-EU cada vez mais forte, os negacionistas/antivacinas estão a manifestar-se cada vez mais e de forma mais violente, que puta de lógica é que tem fazer uma afirmação destas?

Ah, claro, é a burra da von der Leyen.";https://24.sapo.pt/atualidade/artigos/covid-19-von-der-leyen-admite-discussao-sobre-vacinacao-obrigatoria-na-ue;NEG;NEU;0.958836019039154;0.027098240330815315;0.01406583096832037
128;128;niwc2z;"Não temos nem pessoas vacinadas o suficiente pra ter uma pressão seletiva que favoreça um possível escape imune. Não se sabe nem a quantidade de anticorpos neutralizantes necessários para se prevenir uma infecção, talvez qualquer redução de neutralização mostrada em testes não se traduza em nada na prática. Além do mais, vacina não é antibiótico nem anticorpos monoclonais.

É até meio perigoso ele falar isso, dá a impressão pros leigos de que as vacinas nao adiantarão muita coisa. Isso acaba dando razão pros minions que dizem que ele é “torcedor do vírus”.";https://www.reddit.com/r/coronabr/comments/niwc2z/live_do_atila_vacinas/;NEG;NEU;0.6785748600959778;0.28965502977371216;0.03177010267972946
129;129;1kqo3en;"Despacho (19/05/2025)

Apresentação do PL n. 2358/2025 (Projeto de Lei), pelo Deputado Geraldo Resende (PSDB/MS -Fdr PSDB-CIDADANIA), que ""Incluem as Vacinas de Alta Dose contra a Influenza e o Vírus Sincicial Respiratório no Calendário Nacional de Vacinação do Idoso e amplia a sua cobertura por planos de saúde"".";https://www.camara.leg.br/proposicoesWeb/fichadetramitacao?idProposicao=2510560;NEU;NEU;0.05445225164294243;0.8955441117286682;0.05000364035367966
130;130;m4y3hx;Mesmo com todo esse desgoverno, o Brasil não está tão atrás assim.  Imagina se não tivéssemos um governo que trabalhasse para sabotar vacina.;https://i.redd.it/gzviky1xq0n61.jpg;NEU;NEU;0.25743159651756287;0.6949223279953003;0.04764614626765251
131;131;13zlj8w;A extrema direita sempre foi a maior detratora da vacinação…agora dá jeito para justificar o racismo;https://www.reddit.com/r/portugueses/comments/13zlj8w/quantos_indostanicos_brasileiros_e_cplps_estão/;NEG;NEG;0.8655974864959717;0.12636522948741913;0.00803731381893158
132;132;nu3dea;Bem, ligaram-me à bocado para agendar a vacinação, já está marcado, mas fiquei sem perceber onde era, algum sítio onde eu possa saber?;https://www.reddit.com/r/portugal/comments/nu3dea/megathread_covid19_semanário_de_sobrevivência/;NEU;NEU;0.08332443982362747;0.8951907753944397;0.021484874188899994
133;133;qzihk4;Vacinados, recuperados ou mortos (como diz o alemão). Quem não concordar é um perigoso fascista, obviamente.;https://sicnoticias.pt/especiais/vacinar-portugal/2021-11-22-Ana-Gomes-defende-vacinacao-obrigatoria-contra-a-covid-19-4606a477;NEU;NEU;0.3131427764892578;0.6517429947853088;0.03511424735188484
134;134;i0xqs3;A vacina foi administrada intra-muscularmente nos macacos. Talvez a vacinação via spray nasal aumente sua eficiência no trato respiratório. Ao menos vi essa recomendação/possibilidade ser cogitada, talvez por outro motivo, praticidade.;https://www.reddit.com/r/coronabr/comments/i0xqs3/macacos_vacinados_com_chadox1_ncov19_são/;NEU;NEU;0.054367586970329285;0.8588991761207581;0.08673316985368729
135;135;ooe9sh;"Mano a vacinação tá nos 30 já, pra que isso?  
  
Quer dizer tá 30 em sp né, não sei o resto do Brasil...";https://www1.folha.uol.com.br/equilibrioesaude/2021/07/governo-bolsonaro-incluiu-todo-militar-da-ativa-em-brasilia-como-prioridade-na-vacinacao-contra-covid.shtml;NEG;NEU;0.9403776526451111;0.047462720423936844;0.012159598991274834
136;136;l9qguw;"Ainda é 0,1% por dia. Nesse ritmo vamos terminar de vacinar em 2026.

Temos que subir para pelo menos 0,5% por dia para terminarmos no começo de 2022.";https://veja.abril.com.br/saude/brasil-e-um-dos-paises-que-mais-vacinam-contra-a-covid-por-dia/;NEU;NEU;0.04365428909659386;0.9272857308387756;0.029059914872050285
137;137;nb2n2a;"Ué, se tivesse aceito a oferta da Pfizer, o Brasil teria sido o primeiro. A Inglaterra é muito mais rigorosa do que o Brasil, o Bolsonaro que cagou e andou pra vacina, apostando que cloroquina ia segurar a pandemia.

""O Reino Unido será o primeiro país do mundo a começar a usar a vacina Pfizer/BioNTech depois que os reguladores aprovaram seu uso na semana passada."" https://www.bbc.com/portuguese/internacional-55228291";https://youtu.be/g5yz6rf7qT4?t=90;NEG;NEG;0.6305510401725769;0.3204636573791504;0.048985328525304794
138;138;lhv0ke;Nesses casos alguns lugares dos EUA eles simplesmente pegam os primeiros que aparecem na frente e dão a vacina, exatamente para não jogar fora. Já vi relatos aqui no reddit se pessoas que foram abordadas simplesmente pq estavam passando na frente do posto de saúde na hora certa e tiveram sorte. Li tb que algumas pessoas já estão se organizando para ficar na porta esperando o final do dia para ver se conseguem alguma assim. Aqui no Brasil, além da lei ser engessada provavelmente haveria abuso ou tentativa de burlar a regra. THIS IS WHY WE CAN'T HAVE NICE THINGS.;https://www.band.uol.com.br/noticias/exclusivo-funcionarios-de-ubss-de-sao-paulo-revelam-que-doses-de-vacinas-contra-o-coronavirus-sao-jogadas-no-lixo-16324006;NEU;NEU;0.4591791331768036;0.4723551571369171;0.06846573948860168
139;139;kp9kxu;" A Índia fez simulações de vacinas em todo o país neste sábado, antes de lançar uma campanha de imunização em massa contra o coronavírus para a população de 1,3 bilhão de habitantes.

O uso emergencial da vacina desenvolvida pela AstraZeneca e pela Universidade de Oxford foi aprovado na última sexta-feira pelo país. As primeiras doses podem chegar nesta semana, depois do sinal verde final dado pela autoridade indiana do setor de medicamentos.

 **Consulte:** [Veja a situação do coronavírus em seu estado](https://infograficos.oglobo.globo.com/sociedade/painel-do-coronavirus-nos-estados.html)

No treinamento deste sábado, cerca de 96 mil profissionais de saúde praticaram a aplicação do imunizante em manequins, em centros especialmente habilitados para a campanha de vacinação que será lançada em breve em todo país.

O órgão indiano também avalia os pedidos de autorização de uso emergencial para vacinas desenvolvidas pela Pfizer Inc com a BioNTech e pela Bharat Biotech, da Índia.

2º país com mais casos
----------------------

A Índia é o segundo país do mundo com mais casos de infecções pelo coronavírus, atrás apenas dos Estados Unidos.

De acordo com balanço feito pela agência France Presse nesta sexta, com base em fontes oficiais, o país acumula 148.994 mortes e 10.286.709 casos de contágio. A meta do governo é vacinar até 300 milhões de pessoas até meados de 2021.

**Em poucos casos:**[Reino Unido poderá misturar vacinas contra Covid-19](https://oglobo.globo.com/sociedade/vacina/1017180-reino-unido-podera-em-alguns-casos-misturar-vacinas-contra-covid-19-24820591)

Segundo a Reuters, mais de 50 milhões de doses da vacina de Oxford e da AstraZeneca já foram armazenadas pelo fabricante local, o Serum Institute of India (SII).

Reino Unido e Argentina foram os primeiros países a autorizarem o uso do mesmo imunizante.

A vacina de Oxford também está sendo testada no Brasil, junto com a da Pfizer, com a CoronaVac, desenvolvida pelo Instituto Butantan em parceria com o laboratório chinês Sinovac, e com a da Janssen.

 O imunizante também a aposta do governo federal, que fechou contrato de compra e de transferência de tecnologia do imunizante, para produção no país pela Fundação Oswaldo Cruz (Fiocruz).";https://oglobo.globo.com/sociedade/india-faz-simulacao-de-vacinacao-contra-covid-19-antes-de-lancar-campanha-em-massa-24821252;NEU;NEU;0.04683465138077736;0.8841137290000916;0.06905169039964676
140;140;lnumhk;O meu padrasto já levou ambas as doses. Teve queixas no braço que levou a vacina, em que na 2ª vez a dor era maior. De resto, all good;https://www.reddit.com/r/portugal/comments/lnumhk/efeitos_secundários_vacinação_covid19/;NEU;NEU;0.097231425344944;0.8606674671173096;0.04210108891129494
141;141;oz4bg3;"> obviamente que isto também é muito graças a sermos um país de velhos e portanto mais população elegível para a vacina

Não creio que tenha muito a ver com isto. Noutros sítios da UE abriram mais rapidamente as faixas etárias mais baixas quando os mais velhos não se quiseram vacinar. A UE não nos deu mais vacinas que aos outros. O que fez realmente diferença foi a nossa população querer realmente a vacina. A partir do início de julho descolamos da média da UE por causa disto. Houvessem mais vacinas e já tínhamos 80%+ da população 100% vacinada.";https://www.reddit.com/r/portugal/comments/oz4bg3/portugal_atinge_os_70_de_população_total_com_pelo/;NEU;NEU;0.13923534750938416;0.7943257093429565;0.0664389431476593
142;142;k9e5k0;Os caras negam a doença por meses, aí até ontem não tinha plano nenhum de vacinação. Agora falam em alguns milhões de doses que não dá para quase nada.;https://www1.folha.uol.com.br/equilibrioesaude/2020/12/sem-citar-doria-pazuello-diz-que-cabe-ao-ministerio-planejar-vacinacao-contra-covid-no-pais.shtml;NEG;NEG;0.7294312715530396;0.2570933997631073;0.013475350104272366
143;143;ytzx0x;É aquela, se mesmo depois da vacina estar amplamente disponível, mortes serem altas, e mesmo assim o Bolsonarista médio se recusa a se vacinar, isso já é seleção natural, e com todo respeito , não vão fazer falta alguma.;https://g1.globo.com/politica/noticia/2022/11/12/covid-19-queiroga-faz-apelo-para-vacinacao-e-diz-que-69-milhoes-de-brasileiros-nao-tomaram-1a-dose-de-reforco.ghtml;NEG;NEG;0.7055186033248901;0.2332691103219986;0.06121228262782097
144;144;oxv674;"Creio que quando atingirmos a vacinação completa de toda a população adulta e avançarmos sobre os adolescentes, chegando por volta de 70-80% da população total completamente imunizada, não há muito mais o que se fazer para limitar mortes. Creio que deverão ser mantidas ao menos até o final do ano medidas básicas como máscaras em transporte público, mas tirando isso quase todas as atividades deverão ser liberadas até novembro. Nos EUA, mesmo com toda a euforia que viveram, a média diária de mortes nunca abaixou de 200. Creio que aqui, quando atingirmos uma media estável na casa dos 100 óbitos/dia será impossivel segurar restrições contra um risco tão diminuto de mortes. Erradicar o vírus é utópico, especialmente considerando a nova variante delta, então deveremos ter uma certa tolerância com mortes causadas pelo ""novo coronavírus"" endêmico, como tolerávamos as mortes por gripe comum antes da pandemia. Sei que o que escrevi pode ser chocante para alguns, mas é o cenário realista daqui pra frente: ainda teremos algumas milhares de mortes por ano de covid e será impossível evitar isso. Cabe a todos buscarem a imunização completa.";https://www.reddit.com/r/coronabr/comments/oxv674/precisamos_conversar_qual_vai_ser_o_endpoint_da/;NEU;NEU;0.14805984497070312;0.7351430654525757;0.1167970821261406
145;145;ox8tb9;Eu também acho essa discrepância preocupante e cruel, e não sei de quem é a culpa, se é do ministério da saúde, governador ou prefeito. A cidade que eu moro em Minas é uma das únicas com ocupação de leito de UTI de 100%, vacinação abaixo da média estadual e nenhuma ação é feita pra atenuar esses efeitos.;https://www.reddit.com/r/coronabr/comments/ox8tb9/distribuição_das_vacinas_35_dos_municípios_ainda/;NEG;NEG;0.9386406540870667;0.04718341305851936;0.014175916090607643
