,id Post,Subreddit,Autor,Link,Upvotes,Comentarios,Data,Contexto,Classe Sentimento
133,1i7pj76,BrasildoB,dr_srtanger2love,https://i.redd.it/d7z4ra3ksmee1.jpeg,28,9,2025-01-22 20:38:39,"O bolsa família dos EUA o Food Stamp Program In the United States, the Supplemental Nutrition Assistance Program (SNAP),[1] formerly known as the Food Stamp Program, is a federal government program that provides food-purchasing assistance for low- and no-income persons to help them maintain adequate nutrition and health. It is a federal aid program administered by the U.S. Department of Agriculture (USDA) under the Food and Nutrition Service (FNS), though benefits are distributed by specific departments of U.S. states (e.g., the Division of Social Services, the Department of Health and Human Services, etc.).

https://en.m.wikipedia.org/wiki/Supplemental_Nutrition_Assistance_Program",NEU
134,1eyegr7,BrasildoB,kirby__000,https://oglobo.globo.com/economia/noticia/2024/08/21/pesquisa-mostra-que-21-milhoes-de-meis-estao-no-bolsa-familia.ghtml?utm_source=Facebook&utm_medium=Social&utm_campaign=OGlobo,49,24,2024-08-22 05:53:22,"Pesquisa mostra que 2,1 milhões de MEIs estão no Bolsa Família ",NEU
135,1jalem7,brasilivre,markk26,https://www.poder360.com.br/poder-economia/governo-pede-corte-de-r-77-bi-no-bolsa-familia-no-orcamento-de-2025/,16,4,2025-03-13 17:08:57,"Aumenta para artistas e mídia, mas diminui dos pobres! Governo pede corte de R$ 7,7 bi no Bolsa Família no Orçamento ",NEU
136,14uyijp,brasil,_Maragato_,https://gauchazh.clicrbs.com.br/economia/noticia/2023/07/vinte-anos-depois-mais-da-metade-dos-filhos-gauchos-do-bolsa-familia-chegaram-ao-mercado-formal-de-trabalho-cljsz60lo00cc01505ecfutf8.html,210,37,2023-07-09 10:24:39,"Vinte anos depois, mais da metade dos “filhos gaúchos do Bolsa Família” chegaram ao mercado formal de trabalho | GZH ",NEU
137,1ddmzvp,futebol,cremasterchef,https://www.uol.com.br/esporte/futebol/ultimas-noticias/2024/06/11/corinthians-delegado-cre-em-fraude-via-bolsa-familia-no-caso-da-vai-de-bet.htm,58,29,2024-06-11 16:37:36,Corinthians: delegado crê em fraude via Bolsa Família no caso da Vai de Bet ,NEU
138,1jy93qd,BrasildoB,dr_srtanger2love,"https://www.metro1.com.br/noticias/brasil/163485,governo-estuda-encurtar-regra-de-protecao-do-bolsa-familia-para-reduzir-gastos-em-2025?fbclid=IwY2xjawJoq2JleHRuA2FlbQIxMQABHodUjMw2rR-4oZELl-vIXaK3PDzOqXS_jKOuEMF3OXuKKZu4hrI8dTZ8-uZz_aem_gH1-JHnJcd5616Y03w3o3A",8,0,2025-04-13 11:37:39,Governo estuda encurtar regra de proteção do Bolsa Família para reduzir gastos em 2025   - Metro 1 ,NEU
139,1jvgud5,BoletimDaCamara,luism6n,https://www.camara.leg.br/proposicoesWeb/fichadetramitacao?idProposicao=2496168,1,1,2025-04-09 18:07:59,"[Felipe Carreras] PL 1599/2025 (1): Dispõe sobre a criação do Programa de Desenvolvimento Econômico e Social ""Emprega Turismo"", institui incentivos especiais para contratação de empregados nos setores vinculados ao turismo, garante a manutenção do benefício do Bolsa Família e altera a Lei nº 8.0... ",NEU
140,1k18vx8,PeTistas,EverardoAraujo,https://www.reddit.com/r/PeTistas/comments/1k18vx8/o_bolsa_família_é_culpado_pela_dificuldade_das/,1,0,2025-04-17 06:48:03,"O Bolsa Família é culpado pela dificuldade das empresas em contratar? WWW
Da BBC News Brasil em São Paulo
Thais Carrança
15 abril 2025
https://www.bbc.com/portuguese/articles/cj45n2qzrkqo",NEU
141,143c4ku,brasil,Bananey,https://www.gov.br/planalto/pt-br/acompanhe-o-planalto/noticias/2023/06/beneficiarios-do-bolsa-familia-terao-acesso-gratuito-a-todos-os-medicamentos-do-farmacia-popular,332,23,2023-06-07 09:38:28,Beneficiários do Bolsa Família terão acesso gratuito a todos os medicamentos do Farmácia Popular ,NEU
142,1ew8g0y,brasilivre,rdfporcazzo,https://www.reddit.com/gallery/1ew8g0y,32,23,2024-08-19 14:57:44,"Corrigindo um gráfico que tem espalhado desinformação sobre a quantidade de trabalhadores, Bolsa Família e outras informações ",NEU
143,1jtttty,encontreiai,caricaturaedesenho,https://www.reddit.com/r/encontreiai/comments/1jtttty/reflexões_sobre_o_bolsa_família_e_a_importância/,1,0,2025-04-07 16:24:01,"Reflexões sobre o Bolsa Família e a Importância da Educação Financeira **Reflexões sobre o Bolsa Família e a Importância da Educação Financeira**

https://preview.redd.it/5n7gr73hrgte1.jpg?width=1024&format=pjpg&auto=webp&s=c84bc832b303d18e92b6004b67dea87147b27177

Em declaração recente, o presidente Luiz Inácio Lula da Silva enfatizou que ""nenhum brasileiro quer viver apenas recebendo o Bolsa Família"". Essa afirmação destaca a necessidade de promover a autonomia financeira e o desenvolvimento econômico, através da geração de oportunidades e do fortalecimento da capacidade de cada cidadão de prosperar por conta própria.

O Bolsa Família foi criado como uma rede de proteção social, mas Lula ressaltou que a verdadeira questão vai além da assistência. Ele argumenta que o foco deve estar em oferecer meios para que as pessoas possam se desenvolver, encontrar trabalho e, consequentemente, melhorar suas condições de vida. Segundo o presidente, a distribuição de renda é crucial, mas a verdadeira transformação ocorre quando as pessoas têm acesso a oportunidades de geração de emprego e um ambiente que promova o crescimento econômico sustentável.

Nesse contexto, a educação financeira se torna fundamental. Muitos brasileiros ainda não possuem o conhecimento necessário para gerenciar suas finanças pessoais de maneira eficaz. Aprender a lidar com o dinheiro de forma sábia pode ser a chave para a liberdade financeira. Recorrer a cursos e guias que ensinam sobre planejamento financeiro, investimentos e economias pode fazer uma grande diferença na vida de quem deseja sair da dependência de programas sociais e conquistar sua autonomia.

Um exemplo de recurso que pode ajudar nesse processo é o ""Educação Financeira: Um Guia Completo para Gerenciar Seu Dinheiro com Sabedoria"". Este guia oferece uma abordagem abrangente para a compreensão da gestão do dinheiro, proporcionando ferramentas e conhecimento para que as pessoas possam tomar decisões financeiras mais informadas e livres.

Se você quer começar a fazer a diferença na sua vida financeira e aprender a gerenciar seus recursos com eficiência, não deixe de conferir o guia [aqui](https://mon.net.br/3fupmd?src=rd).

Ao promover a educação financeira e capacitar os cidadãos, o Brasil pode dar passos significativos rumo a um futuro onde cada vez mais pessoas possam desfrutar de uma vida digna, não dependendo exclusivamente de programas assistencialistas. O objetivo é claro: criar uma sociedade mais justa, onde todos possam sonhar e alcançar seus objetivos com trabalho e planejamento.",NEU
144,1jg1o4f,brasilivre,Working_Audience_964,https://blog.pirataspelomundo.com.br/2025/03/governo-suspende-41-milhoes-de.html,11,1,2025-03-20 19:31:45,"Governo suspende 4,1 milhões de benefícios do Bolsa Família e BPC devido a fraudes - (piratas pelo mundo). ",NEU
145,1gru8x8,brasilivre,Silver_7777,https://revistaoeste.com/politica/stf-confirma-liminar-que-proibe-uso-do-bolsa-familia-em-bets/,32,10,2024-11-15 08:26:44,STF confirma liminar que proíbe uso do Bolsa Família em bets ,NEU
146,1jeezch,BoletimDaCamara,luism6n,https://www.camara.leg.br/proposicoesWeb/fichadetramitacao?idProposicao=2487312,1,1,2025-03-18 17:26:51,"[Beto Richa] PL 1055/2025 (1): Altera a Lei nº 14.790, de 29 de dezembro de 2023, a fim de impedir beneficiários do Programa Bolsa Família de apostar. ",NEU
147,1ip0rr0,farialimabets,BreakfastSecure6504,https://i.redd.it/ks3575q7r0je1.jpeg,15,2,2025-02-13 23:52:36,"Usar bolsa família pra pagar do job, é gain ou loss? ",NEU
148,10vhmmo,brasilivre,strachey,https://noticias.uol.com.br/politica/ultimas-noticias/2023/02/06/lula-ministerio-da-saude-nisia-trindade-cirurgias-sus.htm,54,69,2023-02-06 17:44:48,"Bolsa Família exigirá atestado de vacinação de crianças, diz Lula ",NEU
149,1j94tpk,BoletimDaCamara,luism6n,https://www.camara.leg.br/proposicoesWeb/fichadetramitacao?idProposicao=2486383,1,1,2025-03-11 20:22:46,"[Jeferson Rodrigues] PL 857/2025 (1): Altera a Lei Nº 14.601, de 19 de junho de 2023 dispondo sobre o aumento de benefícios de transição do Programa Bolsa Família caso a, ou as referências familiares tenham renda formal. ",NEU
150,1foocn0,farialimabets,chavesDelOcho,https://i.redd.it/3jrotkz8vtqd1.jpeg,71,11,2024-09-24 18:46:59,Bolsa Família é gain? [Valores representam 20% do total pago no mês passado.](https://www1.folha.uol.com.br/mercado/2024/09/beneficiarios-do-bolsa-familia-gastam-r-3-bilhoes-em-bets-so-em-agosto.shtml),NEU
151,1fohyke,brasilivre,potatishplantonomist,https://www.poder360.com.br/poder-sportsmkt/bets-receberam-r-105-bi-de-beneficiarios-do-bolsa-familia-em-2024/,50,13,2024-09-24 14:20:32,"Bets receberam R$ 10,5 bi de beneficiários do Bolsa Família Já jogaram no tigrinho hoje família",NEU
152,1jal3vc,u_galaxy8gyf,galaxy8gyf,https://youtube.com/watch?v=ZD1q0tUCw_4&si=7DagN-UW3e_cAV8K,1,0,2025-03-13 16:56:51,LULA corta BILHÕES do BOLSA FAMÍLIA e COLOCA em PROPAGANDA: FAZER não DE... ,NEG
153,1ijcxea,enem,Far_Exercise7769,https://www.reddit.com/r/enem/comments/1ijcxea/o_prouni_tem_poder_de_tirar_o_bolsa_família_de/,0,4,2025-02-06 17:45:43,"O ProUni tem poder de tirar o Bolsa Família de alguém? Gente, minha mãe e meu padastro são casados, mas minha mãe ainda está recebendo Bolsa Família (e não, ela não deveria estar recebendo de acordo com os critérios do programa, porque mesmo sendo apenas dona de casa, ela casou e consequentemente a renda da família aumentou porque ele trabalha. Mas ela não incluiu meu pai no cadastro do Bolsa Família). E como vou confirmar com a faculdade minhas informações no ProUni, claramente vão saber que ela é casada e pelo CPF dá pra verem que ela recebe o Bolsa Família. Corremos risco de ficar sem o Bolsa Família?",NEU
154,1ikz9tb,brasil,HaddadTaxaPouco,https://oglobo.globo.com/politica/noticia/2025/02/08/lula-ligou-para-wellington-dias-e-cobrou-explicacoes-apos-anuncio-de-discussao-interna-sobre-aumento-no-bolsa-familia.ghtml?utm_source=aplicativoOGlobo&utm_medium=aplicativo&utm_campaign=compartilhar,23,1,2025-02-08 19:17:11,Lula ligou para Wellington Dias e cobrou explicações após anúncio de discussão interna sobre aumento no Bolsa Família ,NEU
155,1akph83,brasil,AcceptableCampaign77,https://www.reddit.com/r/brasil/comments/1akph83/minha_família_possui_direito_ao_bolsa_familia_mas/,9,41,2024-02-06 21:25:48,"Minha família possui direito ao bolsa familia, mas o cras da cidade diz que não? Família de 5, recebo bpc o qual segundo inss não conta como renda. Meu avô é aposentado, eu e ele precisamos de medicamento caro, 720 reais o meu, dele não sei. renda familiar de menos de 1/4 do salário mínimo por pessoa. Vieram a mim dizendo que possuímos direito ao bolsa familia, mas o cras local nega isso. Como prosseguir?",NEG
156,1iy1m8s,BoletimDaCamara,luism6n,https://www.camara.leg.br/proposicoesWeb/fichadetramitacao?idProposicao=2485313,1,1,2025-02-25 15:12:51,"[Benes Leocádio] PL 665/2025 (1): Altera o art. 6º da Lei nº 14.601, de 19 de junho de 2023, que institui o Programa Bolsa Família, para aumentar de 24 para 36 meses o tempo de manutenção dos benefícios financeiros do programa e estabelecer o pagamento integral, quando a família beneficiária tive... ",NEU
157,1iua5fx,BoletimDaCamara,luism6n,https://www.camara.leg.br/proposicoesWeb/fichadetramitacao?idProposicao=2485055,1,1,2025-02-20 18:38:13,"[Silas Câmara] PL 591/2025 (1): Altera a Lei nº 14.601, de 19 de junho de 2023 (Lei do Bolsa Família), e dá outras providências. ",NEU
158,1httvh2,brasilivre,Serious-Wishbone1992,https://i.redd.it/hg88c7sht2be1.png,31,3,2025-01-04 22:16:05,Irmãs de senadora suplente de Wellington Dias recebem Bolsa Família ,NEU
159,1ithakq,BoletimDaCamara,luism6n,https://www.camara.leg.br/proposicoesWeb/fichadetramitacao?idProposicao=2484580,1,1,2025-02-19 18:34:07,"[Pauderney Avelino] PL 564/2025 (1): Altera a Lei nº 14.601, de 19 de junho de 2023, para estabelecer nova regra de proteção no Programa Bolsa Família em caso de obtenção de emprego formal por beneficiário. ",NEU
160,1ik65s6,brasil,YamTop1928,https://www.dw.com/pt-br/governo-estuda-reajustar-bolsa-fam%C3%ADlia-em-meio-a-alta-de-alimentos-diz-ministro/a-71542436,13,1,2025-02-07 18:25:13,"Reajuste do Bolsa Família ""está na mesa"", diz ministro ",NEU
161,1h65t4t,BrasildoB,slowlyst,https://i.redd.it/h2bbvwqrwq4e1.png,20,7,2024-12-03 23:48:33,Bolsa Família também corre risco com os cortes do governo ,NEU
162,1hps2fw,brasilivre,SugarActive7943,https://v.redd.it/jw0jcx6tq0ae1,45,2,2024-12-30 14:14:26,"Indígenas paraguaios, que invadem terras em Guaíra - PR, agora tem Bolsa Família e aposentadoria pelo INSS ",NEU
163,1h14u5d,brasilivre,DoktorSigma,https://g1.globo.com/economia/noticia/2024/11/27/financas-publicas-2023-necessidade-de-financiamento.ghtml,20,7,2024-11-27 10:55:11,"Gasto com Bolsa Família aumenta 47% em 2023, diz IBGE; necessidade de financiamento do governo cresce 111% ",NEU
164,1iueuh0,Empreendedores,Lilowen-empresas,https://www.reddit.com/r/Empreendedores/comments/1iueuh0/mei_e_bolsa_família_será_que_empreender_pode/,2,0,2025-02-20 22:23:49,"MEI e Bolsa Família: Será que Empreender Pode Afetar seu Benefício? Se essa é uma preocupação sua, fique tranquilo! Vamos esclarecer tudo direitinho para que você possa tomar a melhor decisão para o seu futuro financeiro.

https://www.lilowen.com/post/mei-e-bolsa-familia-empreender-afeta-beneficio",NEU
165,1iunqo7,PortalRbn,portalrbn,https://portalrbn.com.br/caixa-paga-bolsa-familia-a-beneficiarios-com-nis-de-final-5-4/?feed_id=20049&_unique_id=67b8537519da9,1,0,2025-02-21 07:20:37,Caixa paga Bolsa Família a beneficiários com NIS de final 5 ,NEU
166,1imxw6s,BoletimDaCamara,luism6n,https://www.camara.leg.br/proposicoesWeb/fichadetramitacao?idProposicao=2483486,1,1,2025-02-11 09:53:46,"[Helio Lopes] PL 360/2025 (1): Acrescenta o parágrafo 5º ao artigo 5º da Lei nº 14.601, de 19 de junho de 2023, para manter o pagamento dos benefícios do Programa Bolsa Família e do Auxílio Gás ao núcleo familiar cujo responsável passe a auferir renda ou ter vínculo de emprego com remuneração máx... ",NEU
167,1hzkhwi,brasilivre,fps3000,https://www1.folha.uol.com.br/mercado/2025/01/trabalho-ainda-que-formal-nao-garante-porta-de-saida-a-beneficiario-do-bolsa-familia.shtml,3,4,2025-01-12 08:09:14,"Trabalho, ainda que formal, não garante porta de saída a beneficiário do Bolsa Família ",NEU
168,1itvips,PortalRbn,portalrbn,https://portalrbn.com.br/caixa-paga-bolsa-familia-a-beneficiarios-com-nis-de-final-4-4/?feed_id=19814&_unique_id=67b70444883ca,1,0,2025-02-20 07:30:28,Caixa paga Bolsa Família a beneficiários com NIS de final 4 ,NEU
169,1it2l7m,PortalRbn,portalrbn,https://portalrbn.com.br/caixa-paga-bolsa-familia-a-beneficiarios-com-nis-de-final-3-5/?feed_id=19537&_unique_id=67b5b52507421,1,0,2025-02-19 07:40:37,Caixa paga Bolsa Família a beneficiários com NIS de final 3 ,NEU
170,11d1wk7,brasilivre,uziel7,https://v.redd.it/aa6iu0nclnka1,75,53,2023-02-27 00:49:35,Pobre no Brasil é quem ganha Bolsa família... ,NEG
171,1isbrlb,PortalRbn,portalrbn,https://portalrbn.com.br/caixa-paga-bolsa-familia-a-beneficiarios-com-nis-de-final-2-4/?feed_id=19257&_unique_id=67b47fc21479c,1,0,2025-02-18 09:40:34,Caixa paga Bolsa Família a beneficiários com NIS de final 2 ,NEU
172,1irhd9f,PortalRbn,portalrbn,https://portalrbn.com.br/caixa-comeca-a-pagar-bolsa-familia-de-fevereiro/?feed_id=19005&_unique_id=67b316fc1e7fe,1,0,2025-02-17 08:01:16,Caixa começa a pagar Bolsa Família de fevereiro ,NEU
173,1iiec5j,BoletimDaCamara,luism6n,https://www.camara.leg.br/proposicoesWeb/fichadetramitacao?idProposicao=2482950,1,1,2025-02-05 13:41:47,"[Max Lemos] PL 273/2025 (1): Dispõe sobre a inclusão de um microsseguro no Programa Bolsa Família para beneficiários, abrangendo as modalidades de seguro de vida, saúde, propriedade, agrícola e funeral.”. ",NEU
174,1ihlvhd,BoletimDaCamara,luism6n,https://www.camara.leg.br/proposicoesWeb/fichadetramitacao?idProposicao=2482700,1,1,2025-02-04 13:37:56,"[Capitão Alberto Neto] PL 229/2025 (1): Altera a Lei nº 14.601, de 19 de junho de 2023, que institui o Programa Bolsa Família, e a Consolidação das Leis do Trabalho – CLT, aprovada pelo Decreto-Lei nº 5.452, de 1o de maio de 1943, para criar mecanismos de incentivo à integração dos beneficiários ... ",NEU
175,1ijxy0w,PortalRbn,portalrbn,https://portalrbn.com.br/caixa-paga-bolsa-familia-a-beneficiarios-com-nis-de-final-9-3/?feed_id=16269&_unique_id=67a62a76512d8,1,0,2025-02-07 12:44:54,Caixa paga Bolsa Família a beneficiários com NIS de final 9 ,NEU
176,1ijxsog,PortalRbn,portalrbn,https://portalrbn.com.br/caixa-paga-bolsa-familia-a-beneficiarios-com-nis-de-final-8-2/?feed_id=16156&_unique_id=67a628f64a2aa,1,0,2025-02-07 12:38:30,Caixa paga Bolsa Família a beneficiários com NIS de final 8 ,NEU
177,1ijxk82,PortalRbn,portalrbn,https://portalrbn.com.br/caixa-paga-bolsa-familia-a-beneficiarios-com-nis-de-final-7-2/?feed_id=15973&_unique_id=67a6269d45864,1,0,2025-02-07 12:28:29,Caixa paga Bolsa Família a beneficiários com NIS de final 7 ,NEU
178,16w3lf0,BrasildoB,logatwork,https://g1.globo.com/politica/noticia/2023/09/29/minha-casa-minha-vida-quem-recebe-bolsa-familia-ou-bpc-nao-precisara-mais-pagar-parcelas.ghtml,79,34,2023-09-30 07:39:04,"Minha Casa, Minha Vida: quem recebe Bolsa Família ou BPC não precisará mais pagar parcelas ",NEU
179,1ije1r0,PortalRbn,portalrbn,https://portalrbn.com.br/caixa-paga-bolsa-familia-a-beneficiarios-com-nis-de-final-6-2/?feed_id=15806&_unique_id=67a529f331c8e,1,0,2025-02-06 18:30:27,Caixa paga Bolsa Família a beneficiários com NIS de final 6 ,NEU
180,1ih1ilh,PortalRbn,portalrbn,https://portalrbn.com.br/caixa-paga-bolsa-familia-a-beneficiarios-com-nis-de-final-5-3/?feed_id=15426&_unique_id=67a13e09b920b,1,0,2025-02-03 19:07:06,Caixa paga Bolsa Família a beneficiários com NIS de final 5 ,NEU
181,1icuy7k,PortalRbn,portalrbn,https://portalrbn.com.br/caixa-paga-bolsa-familia-a-beneficiarios-com-nis-de-final-4-3/?feed_id=15232&_unique_id=679a3ab30222f,1,0,2025-01-29 11:26:59,Caixa paga Bolsa Família a beneficiários com NIS de final 4 ,NEU
182,1bqu34y,brasil,Coronel_Fazuelli,https://www.poder360.com.br/economia/13-estados-ainda-tem-mais-gente-com-bolsa-familia-do-que-empregados/,0,30,2024-03-29 13:52:31,13 Estados ainda têm mais Bolsa Família do que empregados ..,NEU
183,1dko31e,farialimabets,Internal_Gain_8986,https://www.reddit.com/r/farialimabets/comments/1dko31e/bolsa_família_no_exterior/,0,22,2024-06-20 19:14:27,"Bolsa família no exterior  Vivo no exterior e recebo bolsa família dei entrada para um visto temporário pra morar aqui no exterior, meu bolsa família ta bloqueado queria ir pro brasil tentar desbloquear mas meu medo é descer no aeroporto do brasil e ter uma coco me esperando. 
Qual o risco de eu me foder tendo bolsa família e morando no exterior? Não vi ninguém se foder até agora


Antes que venham com moralismo pro meu lado veja bem que sub vc está aqui so tem golpista bicheiro e traficante so gente ruim.",NEG
184,1ibiv1c,PortalRbn,portalrbn,https://portalrbn.com.br/caixa-paga-bolsa-familia-a-beneficiarios-com-nis-de-final-3-4/?feed_id=15032&_unique_id=6797e987c3a5b,1,0,2025-01-27 17:16:08,Caixa paga Bolsa Família a beneficiários com NIS de final 3 ,NEU
185,1i8y4x6,PortalRbn,portalrbn,https://portalrbn.com.br/caixa-paga-bolsa-familia-a-beneficiarios-com-nis-de-final-2-3/?feed_id=14855&_unique_id=6793b35829e96,1,0,2025-01-24 12:35:52,Caixa paga Bolsa Família a beneficiários com NIS de final 2 ,NEU
186,1foofqc,BrasildoB,notimano,https://economia.uol.com.br/noticias/redacao/2024/09/24/beneficiarias-do-bolsa-familia-enviaram-r-3-bi-para-bets-em-um-mes-diz-bc.htm,36,8,2024-09-24 18:50:40,"Beneficiários do Bolsa Família enviaram R$ 3 bi para bets em um mês, diz BC ",NEU
187,1i7qzrt,PortalRbn,portalrbn,https://portalrbn.com.br/caixa-comeca-a-pagar-bolsa-familia-de-janeiro/?feed_id=14774&_unique_id=6791911972227,1,0,2025-01-22 21:45:13,Caixa começa a pagar Bolsa Família de janeiro ,NEU
188,1i7fqq6,PortalRbn,portalrbn,https://portalrbn.com.br/bolsa-familia-reduz-morte-de-pessoa-com-transtorno-mental-diz-estudo/?feed_id=14733&_unique_id=67912302251c7,1,0,2025-01-22 13:55:30,"Bolsa Família reduz morte de pessoa com transtorno mental, diz estudo ",NEU
189,1i3r7er,MinasGerais,doutorx999,https://www.otempo.com.br/politica/governo/2025/1/17/governo-cancela-bolsa-familia-e-auxilio-gas-de-1-199-candidatos-eleitos-229-deles-em-minas-gerais,6,0,2025-01-17 18:26:43,Governo cancela Bolsa Família e Auxílio Gás de 1.199 candidatos eleitos; 229 deles em Minas Gerais Famílias que têm integrantes eleitos para cargos públicos perderam os benefícios e estão proibidas de voltar aos programas durante o mandato.,NEU
190,1f69dto,brasil,bsidefromgui,https://g1.globo.com/economia/noticia/2024/08/30/orcamento-2025-governo-federal-propoe-bolsa-familia-sem-reajuste-pelo-2o-ano-seguido.ghtml,29,10,2024-09-01 05:08:16,"Orçamento 2025: governo reduz previsão de recursos para Bolsa Família em R$ 1,4 bilhão ",NEU
191,1hxeol5,GrupoMundoMS,MundoMS,https://multimidiaecommerce.multimidiainfo.com/2025/01/cadastro-unico-itinerante-atualizacao.html,1,0,2025-01-09 12:01:55,Cadastro Único Itinerante: Atualização de Dados do Bolsa Família Direto nas Residências ,NEU
192,1hwz8hq,ItsPauloLeeg,SlowReason6974,https://www.reddit.com/r/ItsPauloLeeg/comments/1hwz8hq/nem_o_bolsa_família_tem_tanta_gente/,1,0,2025-01-08 21:03:40,Nem o bolsa família tem tanta gente. https://youtu.be/5WcyFbaCyTc?si=XBRGizppqWHwvsF7,NEU
193,1b3qu0f,brasil,Novapolo,https://noticias.uol.com.br/colunas/leticia-casado/2024/03/01/governo-credito-bolsa-familia.htm,70,19,2024-03-01 07:09:20,"Letícia Casado: Governo quer R$ 1,5 bi em crédito para quem tem Bolsa Família abrir negócio ",NEU
194,1htn0gk,PortalRbn,portalrbn,https://portalrbn.com.br/pagamento-do-bolsa-familia-comeca-no-proximo-dia-20/?feed_id=13271&_unique_id=6779945330092,1,0,2025-01-04 17:04:35,Pagamento do Bolsa Família começa no próximo dia 20 ,NEU
195,1htk6v1,PortalRbn,portalrbn,https://portalrbn.com.br/estudo-mostra-que-bolsa-familia-reduziu-mortes-por-tuberculose/?feed_id=13231&_unique_id=677977aca5405,1,0,2025-01-04 15:02:20,Estudo mostra que Bolsa Família reduziu mortes por tuberculose ,NEU
196,1ga7enq,MinasGerais,bsidefromgui,https://www1.folha.uol.com.br/poder/2024/10/zema-associa-bolsa-familia-a-dificuldade-de-empresarios-contratarem-no-pais.shtml,9,6,2024-10-23 07:40:19, Zema associa Bolsa Família a dificuldade de empresários contratarem no país  ,NEU
197,1fsiqmd,brasilivre,daisyka,https://revistaoeste.com/politica/beneficiarios-do-bolsa-familia-doaram-mais-de-r-652-mil-para-candidatos-em-2024/,39,5,2024-09-29 21:15:55,Beneficiários do Bolsa Família doaram R$ 652 mil para candidatos ,NEU
198,1hh3fg4,BoletimDaCamara,luism6n,https://www.camara.leg.br/proposicoesWeb/fichadetramitacao?idProposicao=2480894,1,1,2024-12-18 12:01:33,"[Roberta Roma] PL 4943/2024 (1): Institui o Auxílio Inclusão Social como medida complementar ao Benefício de Prestação Continuada (BPC) previsto na Lei Orgânica da Assistência Social (LOAS) e ao Programa Bolsa Família, com o objetivo de incentivar a inclusão produtiva dos seus beneficiários no me... ",NEU
199,1fp725k,brasilivre,Fit_Cress_2250,https://ibovespahoje.com/3-bi-do-bolsa-familia-destinados-a-casa-de-apostas-em-agosto/,20,6,2024-09-25 12:20:30,Beneficiários Do Bolsa Família Destinam R$ 3 Bilhões A Empresas De Apostas Em Agosto ,NEU
200,1grgo7t,farialimabets,doutorx999,https://www1.folha.uol.com.br/mercado/2024/11/stf-confirma-decisao-para-que-governo-impeca-beneficiarios-do-bolsa-familia-de-usar-recursos-em-bets.shtml?utm_source=whatsapp&utm_medium=social&utm_campaign=wppcfolha,13,2,2024-11-14 19:07:04,STF confirma decisão para que governo impeça beneficiários do Bolsa Família de usar recursos em bets Plenário analisa tema em sessão virtual e tem unanimidade para manter validade da decisão de Fux.,NEU
201,1hg8wwk,TaBombando,Real-Tip5765,https://www.reddit.com/r/TaBombando/comments/1hg8wwk/calendário_bolsa_família_2025/,1,0,2024-12-17 08:48:01,"Calendário Bolsa Família 2025 ﻿**Bolsa Família: Pagamento de Dezembro**

* Data do pagamento: Terça-feira, 16/12/2024
* Beneficiários afetados: Familias com Número de Inscrição Social (NIS) terminado em 6

**Valores**

* Valor mínimo: R$ 600
* Valor médio: R$ 678,36

**Informações adicionais**

* Pagamento de três adicionais:
   * Benefício Variável Familiar Nutriz: seis parcelas de R$ 50 para mães de bebês até 6 meses
   * Acréscimo de R$ 50 para famílias com gestantes e filhos de 7 a 18 anos
   * Acréscimo de R$ 150 para famílias com crianças de até 6 anos",NEU
202,1hfrw3u,PortalRbn,portalrbn,https://portalrbn.com.br/caixa-paga-bolsa-familia-a-beneficiarios-com-nis-de-final-5-2/?feed_id=12983&_unique_id=676085becae24,1,0,2024-12-16 16:55:43,Caixa paga Bolsa Família a beneficiários com NIS de final 5 ,NEU
203,1dkpio3,brasilivre,markk26,https://i.redd.it/a2zpa0cb8t7d1.png,23,13,2024-06-20 20:20:05,"Bolsa Família: como uma ideia da direita se tornou a principal bandeira da esquerda brasileira 

https://leiaisso.net/11km/ ",NEU
204,1hdbus3,PortalRbn,portalrbn,https://portalrbn.com.br/caixa-paga-bolsa-familia-a-beneficiarios-com-nis-de-final-4-2/?feed_id=12670&_unique_id=675c3238a55a0,1,0,2024-12-13 10:10:16,Caixa paga Bolsa Família a beneficiários com NIS de final 4 ,NEU
