,id Post,Subreddit,Autor,Link,Upvotes,Comentarios,Data,Contexto,Classe Sentimento
0,13uyoy1,brasil,Illustrious-Music-61,https://i.redd.it/u8lv6i1h3u2b1.jpg,1809,211,2023-05-29 12:56:12,"A caixa despejou quase 500 Milhões de reais POR DIA em consignado do Auxílio Brasil ente 10 e 30 de outubro. Reduzindo a ZERO no dia 1 de novembro logo após o 2 turno. https://www.em.com.br/app/noticia/politica/2023/05/29/interna_politica,1499967/bolsonaro-causou-rombo-na-caixa-ao-tentar-vencer-lula-nas-eleicoes-de-2022.shtml",NEU
1,1ipk0at,opiniaoimpopular,xxdxzlk,https://www.reddit.com/r/opiniaoimpopular/comments/1ipk0at/o_bolsa_famíliaauxílio_brasil_não_faz_ninguém/,166,142,2025-02-14 17:22:49,"O Bolsa Família/Auxílio Brasil não faz ninguém querer parar de trabalhar. Apesar de este benefício trazer uma certa sensação de comodismo ao brasileiro contemporâneo, diversas pessoas consideradas “chefes do lar” que o recebem mencionam a busca por emprego como algo corriqueiro no Brasil pois realmente não há o que se faça com esta quantia.
Não dependo do Bolsa Família/Auxílio Brasil, mas sei que este benefício não sustenta os luxos de ninguém e mal cobre as necessidades básicas por justamente ter um valor considerado pífio em famílias cujos pais possiem muitos filhos.

",NEU
2,1gv8q6q,BoletimDaCamara,luism6n,https://www.camara.leg.br/proposicoesWeb/fichadetramitacao?idProposicao=2335094,1,1,2024-11-19 18:38:12,[Célio Studart] PL 2479/2022 (39): Inclui os motoristas de transporte individual e entregadores por aplicativos no Programa Auxílio Brasil. ,NEU
3,10396q5,brasil,violinha,https://www.estadao.com.br/economia/governo-perdoar-divida-auxilio-brasil-emprestimo-consignado/,114,25,2023-01-04 14:21:11,Governo estuda perdoar dívida de quem pegou empréstimo consignado do Auxílio Brasil - Estadão ,NEU
4,10vbvfh,PergunteReddit,Puzzleheaded-Team315,https://www.reddit.com/r/PergunteReddit/comments/10vbvfh/na_sua_cidade_os_600_reais_do_auxílio_brasil/,5,35,2023-02-06 14:06:54,"Na sua cidade os 600 reais do auxílio Brasil garante a sua subexistência? Se sim teria como trabalhar por fora em algo sem correr risco de vida? Ou a cidade não tem nada?
1 quarto com banheiro e comida",NEU
5,1deqymb,mistermoney,mistermoneycred,https://www.reddit.com/r/mistermoney/comments/1deqymb/app_play_store_empréstimo_auxílio_brasil/,1,1,2024-06-13 01:58:31,"APP PLAY STORE Empréstimo Auxílio Brasil APP PLAY STORE Empréstimo Auxílio Brasil

[https://play.google.com/store/apps/details?id=br.com.emprestimodoauxiliobrasil.twa](https://play.google.com/store/apps/details?id=br.com.emprestimodoauxiliobrasil.twa)",NEU
6,106782p,brasil,jumalinverni,https://veja.abril.com.br/coluna/radar/tcu-descobre-mar-de-irregularidades-no-auxilio-brasil-de-bolsonaro/amp/,95,9,2023-01-07 23:30:23,TCU descobre mar de irregularidades no Auxílio Brasil de Bolsonaro ,NEU
7,16pnzte,brasil,strachey,https://oglobo.globo.com/economia/noticia/2023/09/22/cgu-diz-que-93percent-dos-emprestimos-consignados-do-auxilio-brasil-ocorreram-entre-o-1o-e-o-2o-turno-das-eleicoes.ghtml?utm_source=aplicativoOGlobo&utm_medium=aplicativo&utm_campaign=compartilhar,34,5,2023-09-22 19:50:03,CGU diz que 93% dos empréstimos consignados do Auxílio Brasil ocorreram entre o 1º e o 2º turno das eleições ,NEU
8,104ddax,brasil,NerdDino,https://www.metropoles.com/negocios/governo-estuda-anistia-a-endividados-no-consignado-do-auxilio-brasil,19,17,2023-01-05 20:08:27,Governo estuda anistia a endividados no consignado do Auxílio Brasil | Metrópoles ,NEU
9,140oxix,brasil,Bananey,https://g1.globo.com/politica/noticia/2023/06/04/auditorias-da-cgu-apontam-bilhoes-em-pagamentos-indevidos-de-programas-como-auxilio-brasil-e-auxilio-gas-em-2022.ghtml,64,0,2023-06-04 17:16:48,Auditorias da CGU apontam bilhões em pagamentos indevidos de programas como Auxílio Brasil e Auxílio Gás em 2022 ,NEU
10,17cd8z8,infomoney,infomoney_bot,https://www.infomoney.com.br/minhas-financas/instituto-sigilo-veja-se-voce-tem-direito-a-indenizacao-de-r-15-mil-por-dados-vazados-no-auxilio-brasil/,1,0,2023-10-20 11:58:04,Instituto Sigilo: veja se você tem direito a indenização de R$ 15 mil por dados vazados no Auxílio Brasil ,NEU
11,17cd59g,infomoney,infomoney_bot,https://www.infomoney.com.br/minhas-financas/instituto-sigilo-veja-se-voce-tem-direito-a-indenizacao-de-r-15-mil-por-dados-vazados-no-auxilio-brasil/,1,0,2023-10-20 11:53:21,Instituto Sigilo: veja se você tem direito a indenização de R$ 15 mil por dados vazados no Auxílio Brasil ,NEU
12,177a8bc,u_willamsnet,willamsnet,https://womaisceara.blogspot.com/2023/10/instituto-lanca-consulta-para-37.html,1,0,2023-10-13 19:12:05,"Instituto lança consulta para 3,7 milhões de beneficiários do Auxílio Brasil que tiveram os dados vazados ",NEU
13,11tzp0k,ConselhosLegais,buthigorr,https://www.reddit.com/r/ConselhosLegais/comments/11tzp0k/auxílio_brasilbolsa_família_é_possível_processar/,4,7,2023-03-17 15:38:48,"Auxílio Brasil/Bolsa Família: é possível processar o governo federal? Estou a anos tentando conseguir este benefício social a minha mãe, já que a mesma mora sozinha, com renda R$ 0,00. Meu pai (ex marido dela) ajuda quando pode, e eu também ajudo, mas ganho muito pouco, moro de aluguel, tenho uma filha pequena, enfim, não sobra muito e não quero ver ela com necessidade. Nas milhares de tentativas, eles sempre falam a mesma coisa: que o governo federal identificou por cruzamento de dados com renda superior ao permitido pelo programa porque segundo eles ""moro com ela"", sendo que eu não moro a ANOS e não adianta mostrar comprovante de endereço, ir ao CRAS de nada não acreditam. Queria verificar a possibilidade de processo pela defensoria pública quem sabe.",NEU
14,16pf43c,infomoney,infomoney_bot,https://www.infomoney.com.br/minhas-financas/justica-manda-caixa-e-uniao-indenizar-4-milhoes-de-beneficiarios-do-auxilio-brasil/,1,0,2023-09-22 13:44:27,Justiça manda Caixa e União indenizar 4 milhões de beneficiários do Auxílio Brasil ,NEU
15,16pefi3,infomoney,infomoney_bot,https://www.infomoney.com.br/minhas-financas/justica-manda-caixa-e-uniao-indenizar-4-milhoes-de-beneficiarios-do-auxilio-brasil/,1,0,2023-09-22 13:16:04,Justiça manda Caixa e União indenizar 4 milhões de beneficiários do Auxílio Brasil ,NEU
16,16p00el,u_willamsnet,willamsnet,https://womaisceara.blogspot.com/2023/09/auxilio-brasil-recebedores-com-dados.html,1,0,2023-09-22 00:37:45,Auxílio Brasil: recebedores com dados vazados têm direito a R$ 15 mil ,NEU
17,16lstq1,infomoney,infomoney_bot,https://www.infomoney.com.br/minhas-financas/proposta-de-consignado-do-auxilio-brasil-na-caixa-estimou-concessao-6-vezes-menor-que-demanda-real/,1,0,2023-09-18 08:22:39,Proposta de consignado do Auxílio Brasil na Caixa estimou concessão 6 vezes menor que demanda real ,NEU
18,16lsmam,infomoney,infomoney_bot,https://www.infomoney.com.br/minhas-financas/proposta-de-consignado-do-auxilio-brasil-na-caixa-estimou-concessao-6-vezes-menor-que-demanda-real/,1,0,2023-09-18 08:11:56,Proposta de consignado do Auxílio Brasil na Caixa estimou concessão 6 vezes menor que demanda real ,NEU
19,13fkx1b,ConselhosLegais,lpereirao,https://www.reddit.com/r/ConselhosLegais/comments/13fkx1b/estudante_que_não_mora_com_os_pais_pode_receber/,3,4,2023-05-12 10:16:10,"Estudante que não mora com os pais pode receber auxílio Brasil/Bolsa família Sei que tem o auxílio permanência mas não dá nem pro cheiro, principalmente pra quem morar em cidade diferente dos pais",NEU
20,15ibv8o,BoletimDaCamara,luism6n,https://www.camara.leg.br/proposicoesWeb/fichadetramitacao?idProposicao=2345494,1,1,2023-08-04 18:05:22,[Poder Executivo] MPV 1155/2023 (9): Institui o Adicional Complementar do Programa Auxílio Brasil e do Programa Auxílio Gás dos Brasileiros ,NEU
21,113406t,brasil,notimano,https://g1.globo.com/politica/noticia/2023/02/15/grupo-na-mira-do-governo-por-irregularidade-no-auxilio-brasil-mais-que-dobrou-em-2022.ghtml,29,1,2023-02-15 14:50:49,"Na mira do governo por irregularidade no Auxílio Brasil, grupo de famílias com um único membro mais que dobrou em 2022 ",NEU
22,10gc8x8,ConselhosLegais,REDEY3S,https://www.reddit.com/r/ConselhosLegais/comments/10gc8x8/auxílio_brasil/,5,4,2023-01-19 17:27:15,"Auxílio Brasil Boa tarde, pessoal

Alguém solicitou o auxílio, e apareceu essa mensagem?

“não foi encontrado beneficio auxilio brasil para seu cpf”

Solicitei dia 11 de dezembro, e vi que o prazo é até 45 dias, no CRAS me disseram que era até 90 dias.

Essa mensagem aparece pelo app auxílio Brasil.

Tem algum meio de agilizar/consultar o processo?

Liguei no 121 porém só gravação.
No áudio pediram para  retornar após dia 18.",NEU
23,13v48ka,worldGlance,trueworldnews,https://www.reddit.com/r/brasil/comments/13uyoy1/a_caixa_despejou_quase_500_milhões_de_reais_por/,1,0,2023-05-29 16:34:50,A caixa despejou quase 500 Milhões de reais POR DIA em consignado do Auxílio Brasil ente 10 e 30 de outubro. Reduzindo a ZERO no dia 1 de novembro logo após o 2 turno. [/u/Illustrious-Music-61] ,NEU
24,13j57jr,infomoney,infomoney_bot,https://www.infomoney.com.br/politica/cgu-identifica-r-38-bilhoes-de-pagamento-indevido-do-auxilio-brasil/,1,0,2023-05-16 10:26:28,"CGU identifica R$ 3,8 bilhões de pagamento indevido do Auxílio Brasil ",NEU
25,10ek2te,farialimabets,huelicbr,https://i.redd.it/96q8c3vzgnca1.png,15,2,2023-01-17 15:52:47,Usou auxílio Brasil para investir em Loteria ,NEU
26,11l9uz2,BoletimDaCamara,luism6n,https://www.camara.leg.br/proposicoesWeb/fichadetramitacao?idProposicao=2350322,1,1,2023-03-07 17:11:04,"[Ricardo Ayres - REPUBLICANOS] PL 928/2023 (1): Dispõe sobre a anistia total e irrestrita aos juros, multas e demais encargos financeiros, aos beneficiários do Bolsa-Família (o antigo Auxílio Brasil) que contrataram empréstimo consignado. ",NEU
27,11awa8c,infomoney,infomoney_bot,https://www.infomoney.com.br/minhas-financas/apos-governo-mudar-regras-caixa-encerra-oferta-do-consignado-do-auxilio-brasil/,1,0,2023-02-24 14:04:09,"Após governo mudar regras, Caixa encerra oferta do consignado do Auxílio Brasil ",NEU
28,10ativv,infomoney,infomoney_bot,https://www.infomoney.com.br/minhas-financas/estamos-suspendendo-consignado-do-auxilio-brasil-diz-rita-serrano-presidente-da-caixa/,1,0,2023-01-13 09:37:14,"“Estamos suspendendo consignado do Auxílio Brasil’, diz Rita Serrano, presidente da Caixa ",NEU
29,104ddnh,BrasildoB,NerdDino,https://www.metropoles.com/negocios/governo-estuda-anistia-a-endividados-no-consignado-do-auxilio-brasil,3,0,2023-01-05 20:08:49,Governo estuda anistia a endividados no consignado do Auxílio Brasil | Metrópoles ,NEU
30,106gxmb,u_galaxy8gyf,galaxy8gyf,https://youtube.com/watch?v=VrHlD0QtHnA&feature=share,1,0,2023-01-08 08:21:45,ADIADO o AUMENTO no SALÁRIO MÍNIMO e R$ 150 por FILHO no AUXÍLIO BRASIL ... ,NEU
31,104x51t,infomoney,infomoney_bot,https://www.infomoney.com.br/minhas-financas/idec-pede-ao-ministerio-da-justica-suspensao-de-credito-consignado-atrelado-ao-auxilio-brasil/,1,0,2023-01-06 12:35:48,Idec pede ao Ministério da Justiça suspensão de crédito consignado atrelado ao Auxílio Brasil ,NEU
32,1eecaus,mistermoney,mistermoneycred,https://www.reddit.com/r/mistermoney/comments/1eecaus/empréstimo_auxilio_brasil/,1,0,2024-07-28 14:08:45,"Empréstimo Auxilio Brasil Empréstimo Auxilio Brasil

[https://mistermoneycred.com.br/lp/emprestimo-auxilio-brasil/](https://mistermoneycred.com.br/lp/emprestimo-auxilio-brasil/)",NEU
33,16fxl7s,antitrampo,Repulsive_Bug4768,https://www.reddit.com/r/antitrampo/comments/16fxl7s/bolsa_familia_auxilio_brasil_é_melhor_que_clt/,0,15,2023-09-11 12:02:50,"Bolsa Familia / Auxilio Brasil é melhor que CLT    Algumas semanas atrás, ouvi relatos de pessoas que viajaram para RECIFE, me disseram que foram em lugares que tinham placas dizendo que precisavam de funcionários, essas mesmas pessoas questionaram os donos dos estabelecimentos e os próprios falaram que estava muito dificil achar pessoas para trabalhar de carteira assinada.  


   Eu fiquei bem pensativo sobre isso, porém cheguei a conclusões que realmente não vale a pena ter uma CLT se você recebe o bolsa familia e vou te explicar o porque, se você ganha 600 reais do auxilio, e consegue fazer algumas diárias que pagem \~80 reais, trabalhando por 15 dias (\~R$1200), no final do mês você teria simplesmente 1800 reais, o que muitos não chegam nem aos pés de receber.  


Se sua diária for maior é melhor ainda, ou seja, você estaria ganhando mais, trabalhando menos, talvez seja por isso o maior impacto no número de pessoas que não trabalham com carteira assinada.  


Discutam sobre isso e me falem o que acham  
",NEU
34,10syyzn,Brazildetodos,Forward-Guest4804,https://www.reddit.com/r/Brazildetodos/comments/10syyzn/dívida_perdoada_auxilio_brasil/,1,1,2023-02-03 20:37:15,Dívida perdoada auxilio Brasil Perdão da dívida auxílio Brasil,NEU
35,13wa4eb,brasil,strachey,https://www1.folha.uol.com.br/mercado/2023/05/camara-aprova-texto-base-da-mp-do-bolsa-familia-e-que-garante-adicional-ao-auxilio-gas.shtml,17,1,2023-05-30 23:46:46,Câmara aprova texto da MP do Bolsa Família e que garante adicional ao Auxílio Gás ,NEU
36,1ki94bi,brasilivre,Conscious-Peak-2140,https://v.redd.it/uvh7n2eqfoze1,194,88,2025-05-09 00:37:13,25 anos recebendo Bolsa Família ,NEU
37,1jjldwi,farialimabets,Churrasqueadas,https://v.redd.it/517w1ldmouqe1,115,18,2025-03-25 12:00:29,Brasileiro médio fingindo de mendigo pra pegar bolsa família ,NEU
38,1k04iqc,brasil,YamTop1928,https://www.metropoles.com/brasil/lula-pais-nao-pode-ser-eternamente-pobre-vivendo-de-bolsa-familia,427,127,2025-04-15 19:07:59,"Lula: ""País não pode ser eternamente pobre, vivendo de Bolsa Família""   
O presidente Luiz Inácio Lula da Silva (PT) defendeu, nesta terça-feira (15/4), o investimento em educação como forma de impulsionar o crescimento econômico do país. Durante visita ao complexo industrial da Nissan, no Rio de Janeiro, o petista afirmou que o “país não pode ser eternamente pobre” e depender de programas sociais, como o Bolsa Família.  
  
“Eu voltei à presidência da República para provar que esse país não pode ser eternamente pobre, eternamente vivendo de Bolsa Família. Não, nós precisamos fazer as pessoas se formarem adequadamente, aprenderem uma profissão, para as pessoas poderem constituir família, terem prosperidade, e viverem bem, num padrão de classe média”, disse o chefe do Executivo.",NEU
39,1jotp5k,brasil,AndersonL01,https://www.maisgoias.com.br/brasil/meu-sonho-um-projeto-onde-quem-recebe-bolsa-familia-nao-pode-votar-diz-senador-marcos-do-val/,760,166,2025-04-01 08:53:46,"“Meu sonho um projeto onde quem recebe Bolsa Família não pode votar”, diz senador Marcos do Val ",NEU
40,1giypwe,ShitpostBR,Most-Year-7326,https://v.redd.it/9u4gjs0tfryd1,734,195,2024-11-03 19:09:58,e lá se vai o dinheiro do bolsa família  ,NEG
41,1fom17e,brasil,AlyssonFromBrazil,https://economia.uol.com.br/noticias/redacao/2024/09/24/beneficiarias-do-bolsa-familia-enviaram-r-3-bi-para-bets-em-um-mes-diz-bc.htm,779,165,2024-09-24 17:08:13,"Beneficiários do Bolsa Família enviaram R$ 3 bi para bets em um mês, diz BC ",NEU
42,1fqkjx3,brasil,rossmark,https://eassim.com.br/lula-cobra-proibicao-do-uso-do-cartao-do-bolsa-familia-para-bets/,847,123,2024-09-27 07:27:43,Lula cobra proibição do uso do cartão do Bolsa Família para bets ,NEU
43,1jkinpu,botecodoreddit,constrito,https://v.redd.it/bjlwt6vxs2re1,739,61,2025-03-26 15:19:31,Efeito Bolsa Família ,NEU
44,1jumtuq,investimentos,Alone-Forsaken,https://g1.globo.com/economia/noticia/2025/04/08/cpi-das-bets-presidente-do-bc-diz-que-nao-sera-possivel-identificar-apostadores-que-usam-o-pix.ghtml,263,134,2025-04-08 16:53:03,BC diz que brasileiros gastam até R$ 30 bilhões por mês com bets e que não tem poderes para impedir uso do Bolsa Família em apostas ,NEU
45,11e4jsp,brasil,3x35r22m4u,https://www.reddit.com/gallery/11e4jsp,1065,192,2023-02-28 09:13:09,"Para surpresa de 0 pessoas, o Centro da Indústria e Comércio de Bento Gonçalves, RS diz que trabalhadores em condição de escravidão é um problema causado pela Bolsa Família ",NEU
46,1kdky2m,opiniaoimpopular,Limp_Grapefruit4710,https://www.reddit.com/r/opiniaoimpopular/comments/1kdky2m/todo_mundo_deveria_ter_direito_ao_bolsa_família/,41,147,2025-05-03 01:51:14,"Todo mundo deveria ter direito ao bolsa família como forma de melhorar os salários É isso.

Dessa forma exigiria que os empregadores melhorassem os salários e as condições dos empregos de modo a atrair os trabalhadores.

Se o empresário não o faz, o trabalhador irá preferir o bolsa família + bicos para se sustentar ao contrário de trabalhar em vagas horríveis.

Isso melhoraria muito a situação dos empregos e a economia do país.",NEG
47,1gai7bc,brasil,asvezesmeesqueco,https://www.otempo.com.br/politica/governo/2024/10/22/zema-culpa-bolsa-familia-e-trabalho-aos-domingos-por-falta-de-ma,394,106,2024-10-23 15:47:18,"Zema culpa Bolsa Família e trabalho aos domingos por falta de mão de obra no comércio > “Eu já estive do lado de vocês e muitas vezes na hora de contratar alguém, na entrevista, a pessoa já vem com aquela pergunta: eu preciso trabalhar sábado ou domingo? Se você fala que sim, ele ja desiste da vaga, porque a pessoa quer um trabalho cheio de pré-requisitos que nem sempre empresas e setor produtivo conseguem atender”",NEG
48,1jfwigc,brasil,verissimoallan,https://noticias.uol.com.br/cotidiano/ultimas-noticias/2025/03/20/freshouse-diz-faltar-funcionarios-porque-do-bolsa-familia-empresa-nega.htm,456,39,2025-03-20 15:57:14,Restaurante deixa aviso culpando 'pessoal do Bolsa Família' por faltas ,NEU
49,1kionp0,brasilivre,obreiroavental,https://v.redd.it/yligeyzbnsze1,123,69,2025-05-09 14:46:54,É o investimento do Bolsa Família ,NEU
50,1h9udxs,opiniaoimpopular,Agreeable_Might_535,https://www.reddit.com/r/opiniaoimpopular/comments/1h9udxs/quem_crítica_o_bolsa_família_é_quem_nunca_passou/,153,117,2024-12-08 19:16:24,"Quem crítica o bolsa família é quem nunca passou dificuldades na vida e nunca sofreu por falta de oportunidades na vida Vejo muitas pessoas que criticam bolsa família, dizendo que isso gera mais pobreza e etc. Eu defendo o bolsa família pois, pois sei o que é passar por dificuldades e por não conseguir emprego. Sem o bolsa família,eu assim como outras pessoas de baixa renda,morre riam de fome e viveriam nas ruas. E muitas pessoas dependem do bolsa pra sobreviverem pois quem é realmente pobre/feio(a) não tem muitas oportunidades pra crescer na vida.",NEU
51,1f1o9b0,brasil,Malba_Taran,https://www.cnnbrasil.com.br/blogs/fernando-nakagawa/economia/macroeconomia/cresce-o-debate-sobre-o-aumento-do-bolsa-familia-e-a-perda-do-interesse-em-procurar-emprego/,118,181,2024-08-26 10:30:29,Cresce o debate sobre o aumento do Bolsa Família e a perda do interesse em procurar emprego | Blogs | CNN Brasil ,NEU
52,1ewryhy,brasil,EduMelo,https://valor.globo.com/brasil/noticia/2024/08/20/maioria-dos-filhos-do-bolsa-familia-deixa-de-depender-de-programa-mostra-estudo.ghtml,497,63,2024-08-20 07:19:20,"Maioria dos ‘filhos’ do Bolsa Família deixa de depender de programa, mostra estudo ",NEU
53,1ig59g5,brasil,trifas,https://g1.globo.com/politica/noticia/2025/02/02/fake-news-sobre-pix-bolsa-familia-e-vacinas-sao-as-mais-desmentidas-pelo-governo-lula.ghtml,188,68,2025-02-02 16:25:38,"Fake news sobre PIX, Bolsa Família e vacinas são as mais desmentidas pelo governo Lula ",NEU
54,16visha,brasil,strachey,https://cultura.uol.com.br/noticias/61613_beneficiarios-do-bolsa-familia-nao-precisam-mais-pagar-parcelas-do-minha-casa-minha-vida.html,254,210,2023-09-29 15:08:25,"Beneficiários do Bolsa Família não precisam mais pagar parcelas do Minha Casa, Minha Vida ",NEU
55,1faj54g,brasil,StopOk3254,https://noticias.uol.com.br/eleicoes/2024/09/06/pablo-marcal-bolsa-familia-desempregados-profissionais.htm,173,113,2024-09-06 13:15:39,Marçal sugere que Bolsa Família produz 'desempregados profissionais' O que você acha a respeito dessa afirmação do Marçal?,NEU
56,1iyxi04,investimentos,Trusted-Pine,https://www.reddit.com/r/investimentos/comments/1iyxi04/bolsa_família_está_grande_e_precisa_diminuir_diz/,104,73,2025-02-26 17:33:20,"Bolsa Família está grande e precisa diminuir, diz Rubens Menin https://preview.redd.it/95ww5vx4njle1.png?width=1024&format=png&auto=webp&s=858860f34094e784fb6824d6835cb65f07485dcb

[https://www1.folha.uol.com.br/mercado/2025/02/bolsa-familia-esta-grande-e-precisa-diminuir-diz-rubens-menin.shtml](https://www1.folha.uol.com.br/mercado/2025/02/bolsa-familia-esta-grande-e-precisa-diminuir-diz-rubens-menin.shtml)",NEU
57,1kp3r4v,opiniaoimpopular,DepartmentNaive9002,https://www.reddit.com/r/opiniaoimpopular/comments/1kp3r4v/enquanto_existir_bolsa_família_e_outras_formas_de/,0,64,2025-05-17 18:25:24,"Enquanto existir bolsa família e outras formas de assistencialismo o Brasil jamais sairá da pobreza em que se encontra. Tenho uma vizinha que não trabalha. Vive da pensão alimentícia dos pais dos filhos dela e do bolsa família. Ela não produz nada para a sociedade, e recebe dinheiro dos pagadores de impostos. 


Enquanto o estado repassar o dinheiro de quem produz tomando através de impostos para quem nada produz através do bolsa família.  Nosso país jamais irá para frente. 


Muitas pessoas que recebem o bolsa família tem plenas condições de trabalhar mas preferem ser um peso para o estado. E o próprio estado incentiva isso. Políticos se beneficiam desse sistema de gente que não trabalha. 


É só acompanhar as estatísticas, vejam quem não trabalha está votando e quem trabalha está votando. ",NEU
58,1ft9tuj,brasil,OptimalSurprise9437,https://www.cnnbrasil.com.br/politica/em-votacao-na-camara-governo-e-pt-derrubaram-freio-a-apostas-por-beneficiario-do-bolsa-familia/,234,72,2024-09-30 20:25:57,"Em votação na Câmara, governo e PT derrubaram freio a apostas por beneficiário do Bolsa Família ",NEU
59,1ccroqb,brasil,PickleSpirited,https://www.reddit.com/r/brasil/comments/1ccroqb/como_as_pessoas_mentem_sobre_o_bolsa_família/,284,92,2024-04-25 10:16:12,"Como as pessoas mentem sobre o bolsa família Vi um post no X (twitter) que já está rodando de uma deputada de SC falando que Santa Catarina seria melhor porque tem mais pessoas trabalhando do que recebendo bolsa família diferente do Maranhão (o outro extremo). 

Eu não vou entrar no mérito do que ela falou mas falar de um assunto correlato, porque as pessoas estão ficando cada vez mais burras a respeito do bolsa família? 

Pessoas que recebem bolsa família também trabalham seja informalmente ou formalmente mas também recebem o auxílio porque sua renda mensal não é suficiente para ter o mínimo de dignidade, a tese de que a pessoa ou trabalha ou recebe o bolsa família NÃO EXISTE. É impossível você viver com 600 reais ou até mesmo criar filhos com 600 reais, em que planeta essas pessoas estão vivendo? As taxas de fecundidade estão caindo em todo o país.  

Esses gráficos do poder360 estão sendo muito divulgados para espalhar desinformação ou meias verdades e as pessoas simplesmente não são capazes de pesquisar por conta própria por pelo menos 10 minutinhos e ver as mentiras que estão sendo ditas. 

Não vou me alongar mais do que isso mas está na hora das pessoas se unirem mais para combater essas mentiras, está ficando insuportável a quantidade de preconceito e xenofobia ainda mais se tratando de uma mentira descarada. ",NEG
60,1htg3c7,brasil,jaum22,https://www1.folha.uol.com.br/equilibrioesaude/2025/01/bolsa-familia-reduziu-casos-de-tuberculose-em-60-e-mortalidade-em-70-em-11-anos.shtml,309,37,2025-01-04 11:58:52,Bolsa Família reduziu casos de tuberculose em 41% e mortalidade em 31% em 11 anos ,NEU
61,1icx3ox,OpiniaoBurra,Wccia,https://i.redd.it/ftwtt7t7hyfe1.png,108,62,2025-01-29 13:00:36,"""Estratégia de quem usa bolsa família é meter mais filhos e ser vagabundo"" mais uma do nosso morcego ",NEU
62,1cu5mhu,brasilivre,Timely-Estimate-1346,https://v.redd.it/v0fmibw4rz0d1,241,85,2024-05-17 10:47:14,Bora trabalhar para pagar auxílio e bolsa família pra essas aí.  ,NEU
63,1jvfu2z,brasil,Aermanesett,https://g1.globo.com/economia/noticia/2025/04/08/cpi-das-bets-presidente-do-bc-diz-que-nao-sera-possivel-identificar-apostadores-que-usam-o-pix.ghtml,89,40,2025-04-09 17:25:04,BC diz que brasileiros gastam até R$ 30 bilhões por mês com bets e que não tem poderes para impedir uso do Bolsa Família em apostas ,NEU
64,1ew8cp7,brasil,rdfporcazzo,https://www.reddit.com/gallery/1ew8cp7,411,39,2024-08-19 14:53:56,"Corrigindo um gráfico que tem espalhado desinformação sobre a quantidade de trabalhadores, Bolsa Família e outras informações ",NEU
65,1fp14ea,investimentos,letowormii,https://istoedinheiro.com.br/beneficiarios-do-bolsa-familia-apostaram-r-3-bi-em-bets-durante-agosto/,122,76,2024-09-25 07:25:30,"Beneficiários do Bolsa Família gastaram em Agosto o equivalente a 21,2% dos recursos recebidos no mês com apostas, segundo Bacen ",NEU
66,1hdd3ka,brasil,guihmds,https://www1.folha.uol.com.br/mercado/2024/12/governo-deve-regular-bets-nao-tutelar-os-mais-pobres-diz-um-dos-pais-do-bolsa-familia.shtml,204,43,2024-12-13 11:14:24,"Governo deve regular bets, não tutelar os mais pobres, diz um dos pais do Bolsa Família ",NEU
