,id Post,Subreddit,Autor,Link,Upvotes,Comentarios,Data,Contexto,Classe Sentimento
74,xy3swc,brasilivre,LucasSodre,https://v.redd.it/lcv07zv9wes91,13,1,2022-10-07 13:39:00,"5 de out. 2022 Governo anuncia que zerou fila do programa Auxílio Brasil Ao programa de rádio A Voz do Brasil, o ministro da Cidadania, Ronaldo Bento, confirmo que a fila do programa Auxílio Brasil está zerada e que, neste mês, 500 mil novas famílias foram incluídas para receber o benefício.",NEU
75,zj582e,brasilnoticias,williambotter,https://www1.folha.uol.com.br/mercado/2022/12/fila-do-auxilio-brasil-ressurge-apos-eleicao-e-ja-tem-128-mil-familias.shtml,7,1,2022-12-11 16:32:12,Fila do Auxílio Brasil ressurge após eleição e já tem 128 mil famílias ,NEU
76,vgmkjf,brasil,Jack_125,https://economia.uol.com.br/noticias/estadao-conteudo/2022/06/20/demanda-pelo-auxilio-brasil-explode-e-fila-ja-tem-278-milhoes-de-familias.htm,31,3,2022-06-20 11:18:43,"Demanda pelo Auxílio Brasil explode e fila já tem 2,78 milhões de famílias ",NEU
77,qbd79o,u_Manada_2,Manada_2,https://www.reddit.com/r/u_Manada_2/comments/qbd79o/meus_amigos_com_crise_hídrica_eleições_e_agora/,9,11,2021-10-19 11:55:47,"Meus amigos, com crise hídrica, eleições e agora uma possível pro-prorrogração do auxílio emergencial, 2022 pode ser uma grande oportunidade para ganhar dinheiro. Vou manter o portfolio inalterado (com 70% em moeda forte) e vou adquir mais exposição ao Brasil na medida que a crise se intensifique ",NEU
78,yyurx7,ComunismodoB,pfelipens29,https://i.redd.it/xzjnteszgt0a1.jpg,20,0,2022-11-18 18:13:16,"A presidenta do PT, Gleisi Hoffmann, deixou claro que o governo Lula não será controlado pelo ""mercado"", ou seja, pelos bancos. Ela ataca o teto de gastos e deixa claro que haverá o retorno do Bolsa Família, subsitituindo o Auxílio Brasil. https://t.co/MRu3kOsWnr ",NEU
79,x6gbv2,farialimabets,Embassed_Wave_1977,https://radiojornal.ne10.uol.com.br/noticia/2022/09/amp/15074339-emprestimo-consignado-auxilio-brasil-liberado-hoje-05-09-veja-calendario-emprestimo-auxilio-brasil-setembro.html,0,4,2022-09-05 10:32:52,EMPRÉSTIMO CONSIGNADO AUXÍLIO BRASIL liberado HOJE (05/09)? Veja CALENDÁRIO EMPRÉSTIMO AUXÍLIO BRASIL SETEMBRO ,NEU
80,wrwljo,BrasildoB,um--no,"https://www.em.com.br/app/noticia/politica/2022/08/17/interna_politica,1387115/pesquisa-lula-abre-vantagem-entre-eleitores-que-recebem-auxilio-brasil.shtml",24,2,2022-08-18 19:17:50,Pesquisa: Lula abre vantagem entre eleitores que recebem Auxílio Brasil ,NEU
81,qbqjxa,brasilivre,cambeiu,https://g1.globo.com/economia/noticia/2021/10/19/auxilio-brasil-derruba-a-bolsa-e-faz-dolar-subir-entenda-por-que-mercados-reagem-mal-ao-plano-do-governo.ghtml,14,10,2021-10-19 23:06:01,Auxílio Brasil derruba a bolsa e faz dólar subir; entenda por que mercados reagem mal ao plano do governo ,NEU
82,xzhc11,brasil,Ckrownz,https://oglobo.globo.com/blogs/pulso/post/2022/10/eleicoes-2022-bolsonaro-avancou-mais-em-cidades-que-dependem-do-auxilio-brasil.ghtml?utm_source=globo.com&utm_medium=oglobo,0,3,2022-10-09 06:28:03,Bolsonaro avançou mais em cidades que dependem do Auxílio Brasil ,NEU
83,yd9nnm,brasil,Bananey,https://valor.globo.com/politica/eleicoes-2022/noticia/2022/10/25/consignado-e-usado-para-fake-news.ghtml,15,1,2022-10-25 13:52:57,Consignado para beneficiário do Auxílio Brasil é usado para 'fake news' ,NEU
84,zkg39u,BoletimDaCamara,luism6n,https://www.camara.leg.br/proposicoesWeb/fichadetramitacao?idProposicao=2341925,1,1,2022-12-12 20:56:09,"[Carlos Henrique Gaguim - UNIÃO] PL 2956/2022 (1): Altera a Lei nº 14.342, de 18 de maio de 2022, para garantir a concessão de um salário mínimo a título de benefício extraordinário destinado às famílias indígenas beneficiárias do Programa Auxílio Brasil. ",NEU
85,um686y,brasilivre,Allaban,https://www.istoedinheiro.com.br/petrobras-rende-r-447-bi-ao-governo-cinco-vezes-o-orcamento-do-auxilio-brasil/,7,6,2022-05-09 21:59:59,"Petrobrás rende R$ 447 bi, 5 vezes orçamento do Auxílio Brasil ",NEU
86,ylcziw,brasilivre,pobretano,https://www.otempo.com.br/politica/governo/equipe-de-transicao-propoe-pec-que-tira-auxilio-brasil-do-teto-de-gastos-1.2760818,12,1,2022-11-03 16:57:38,Equipe de transição propõe PEC que tira Auxílio Brasil do teto de gastos | O TEMPO ,NEU
87,zf1i3r,brasilnoticias,williambotter,https://www.bbc.com/portuguese/brasil-63886712,1,1,2022-12-07 10:45:38,PEC da Transição: como medida para garantir Auxílio Brasil poderá custear saúde e também abastecer orçamento secreto ,NEU
88,zaa20u,brasilnoticias,williambotter,https://www1.folha.uol.com.br/mercado/2022/12/transicao-ve-abuso-de-poder-economico-no-auxilio-brasil-e-vai-representar-contra-bolsonaro.shtml,2,1,2022-12-02 00:32:29,Transição vê abuso de poder econômico no Auxílio Brasil e vai acionar Bolsonaro legalmente ,NEU
89,y6sx1v,brasilivre,gremio_1903,https://veja.abril.com.br/coluna/radar-economico/o-surpreendente-destino-das-parcelas-do-auxilio-brasil-na-economia/amp/,4,2,2022-10-17 22:28:45,O surpreendente destino das parcelas do Auxílio Brasil na economia ,NEU
90,xut52o,brasil,Fye336,https://g1.globo.com/politica/blog/andreia-sadi/post/2022/10/03/aliados-lula-conservadores-bolsonaro-guerra-ideologica.ghtml,18,1,2022-10-03 16:36:29,QG de Lula quer 'carta aos brasileiros' para conservadores; Bolsonaro vai reforçar guerra ideológica e prometer 13º do Auxílio Brasil para mulheres ,NEU
91,zzbpi9,infomoney,infomoney_bot,https://www.infomoney.com.br/minhas-financas/futura-presidente-da-caixa-diz-que-vai-rever-consignado-do-auxilio-brasil/,1,0,2022-12-30 18:13:41,Futura presidente da Caixa diz que vai rever consignado do Auxílio Brasil ,NEU
92,x3ioak,brasil,strachey,https://www1.folha.uol.com.br/mercado/2022/09/governo-deve-incluir-mais-804-mil-familias-no-auxilio-brasil-as-vesperas-da-eleicao.shtml?utm_source=twitter&utm_medium=social&utm_campaign=comptw,22,1,2022-09-01 18:09:02,Governo deve incluir mais 804 mil famílias no Auxílio Brasil às vésperas da eleição ,NEU
93,q9w0zk,brasil,Jack_125,https://www1.folha.uol.com.br/mercado/2021/10/mesmo-com-auxilio-brasil-classe-de-deve-perder-renda-em-ano-eleitoral.shtml,53,5,2021-10-17 07:16:15,Classe D/E deve perder renda em ano eleitoral mesmo com Auxílio Brasil ,NEU
94,tyk4ss,brasilivre,fps3000,https://twitter.com/apyus/status/1512126957663756295?s=20&t=8Jj4zOoMs1xMo8FArJyTmQ,0,6,2022-04-07 16:00:57,"Marlos Ápyus 🇺🇦 on Twitter: ""Cruzei rapidinho dados do TSE com da Quaest. Não fosse pelo Nordeste, a disputa estaria 'empatada' entre Lula (38%) e Bolsonaro (36%). O Nordeste está evitando o golpe. Mas Bolsonaro não para de despejar Auxílio Brasil e Orçamento Secreto por lá."" ",NEU
95,yybvga,BoletimDaCamara,luism6n,https://www.camara.leg.br/proposicoesWeb/fichadetramitacao?idProposicao=2338697,1,1,2022-11-18 02:15:26,[Raimundo Costa - PODE] PL 2805/2022: Dispõe sobre o recebimento cumulativo do Auxílio Brasil e o Seguro Defeso da Pesca Artesanal. ,NEU
96,xurvvt,brasilivre,Kaze_Senshi,https://g1.globo.com/economia/noticia/2022/10/03/auxilio-brasil-caixa-antecipa-parcelas-de-outubro.ghtml,13,1,2022-10-03 15:49:04,"Auxílio Brasil: um dia após confirmação do 2º turno, governo antecipa parcelas de outubro ",NEU
97,ztg179,u_portalrbn,portalrbn,https://portalrbn.com.br/caixa-conclui-pagamento-da-parcela-de-dezembro-do-auxilio-brasil/?feed_id=87&_unique_id=63a5b29046986,1,0,2022-12-23 10:52:16,Caixa conclui pagamento da parcela de dezembro do Auxílio Brasil ,NEU
98,zso8ww,PortalRbn,portalrbn,https://www.reddit.com/r/PortalRbn/comments/zso8ww/caixa_paga_auxílio_brasil_a_beneficiários_com_nis/,1,0,2022-12-22 12:08:58,"Caixa paga Auxílio Brasil a beneficiários com NIS de final 9 A Caixa Econômica Federal paga hoje (22) a parcela de dezembro do Auxílio Brasil aos beneficiários com Número de Inscrição Social (NIS) com final 9. Essa é a quinta parcela com o valor mínimo de R$ 600, estabelecido por emenda constitucional promulgada em julho pelo Congresso Nacional.

Ontem (21),

https://portalrbn.com.br/caixa-paga-auxilio-brasil-a-beneficiarios-com-nis-de-final-9/",NEU
99,yx0htz,brasilnoticias,williambotter,https://www.bbc.com/portuguese/brasil-63631085,1,1,2022-11-16 14:45:47,PEC da Transição: 4 pontos para entender plano de Lula para manter Auxílio Brasil em R$ 600 ,NEU
100,zqrgib,PortalRbn,portalrbn,https://www.reddit.com/r/PortalRbn/comments/zqrgib/caixa_paga_auxílio_brasil_a_beneficiários_de_nis/,1,0,2022-12-20 12:34:47,"Caixa paga Auxílio Brasil a beneficiários de NIS de final 7 A Caixa Econômica Federal paga hoje (20) a parcela de dezembro do Auxílio Brasil aos beneficiários com Número de Inscrição Social (NIS) com final 7. Essa é a quinta parcela com o valor mínimo de R$ 600, que vigorará até dezembro, conforme emenda constitucional promulgada em julho pelo Congresso

https://portalrbn.com.br/caixa-paga-auxilio-brasil-a-beneficiarios-de-nis-de-final-7/",NEU
101,yru5ei,brasilnoticias,williambotter,https://www.bbc.com/portuguese/brasil-63591966,2,1,2022-11-10 19:45:37,Auxílio Brasil de R$ 240? Tire todas as dúvidas sobre o desconto no benefício ,NEU
102,zqoclk,PortalRbn,portalrbn,https://www.reddit.com/r/PortalRbn/comments/zqoclk/caixa_paga_auxílio_brasil_a_beneficiários_de_nis/,1,0,2022-12-20 10:21:04,"Caixa paga Auxílio Brasil a beneficiários de NIS de final 7 A Caixa Econômica Federal paga hoje (20) a parcela de dezembro do Auxílio Brasil aos beneficiários com Número de Inscrição Social (NIS) com final 7. Essa é a quinta parcela com o valor mínimo de R$ 600, que vigorará até dezembro, conforme emenda constitucional promulgada em julho pelo Congresso

https://portalrbn.com.br/caixa-paga-auxilio-brasil-a-beneficiarios-de-nis-de-final-7/",NEU
103,yr66h3,BoletimDaCamara,luism6n,https://www.camara.leg.br/proposicoesWeb/fichadetramitacao?idProposicao=2320766,1,1,2022-11-10 02:19:16,"[Lucas Gonzalez - NOVO] PL 1072/2022: Altera a lei nº 14.284, de 29 de dezembro de 2021para dispor sobre a avaliação qualitativa do programa Auxílio Brasil. ",NEU
104,yibq9u,brasilnoticias,williambotter,https://www.cartacapital.com.br/opiniao/carta-aberta-as-vitimas-do-golpe-do-consignado-do-auxilio-brasil/,3,1,2022-10-31 10:10:51,Carta aberta às vítimas do golpe do consignado do Auxílio Brasil ,NEU
105,ze8red,infomoney,infomoney_bot,https://www.infomoney.com.br/politica/pec-da-transicao-relator-amplia-teto-de-gastos-em-r-175-bilhoes-por-dois-anos-para-bancar-auxilio-brasil/,1,0,2022-12-06 11:53:45,PEC da Transição: relator amplia teto de gastos em R$ 175 bilhões por dois anos para bancar Auxílio Brasil ,NEU
106,tctn0v,brasilivre,MaxVonHabsburg,https://i.redd.it/gzxjeb26e1n81.jpg,2,38,2022-03-12 20:24:50,Estaria bolsoguedes seguindo o conselho dos liberais Friedman e Hayek ao criar o auxilio Brasil? Opinem. ,NEU
107,yyn86k,brasil,Prefeitura,https://i.redd.it/gwv609oadq0a1.png,22,7,2022-11-18 12:48:30,"Tenho 448 anos e nunca precisei de auxilio nenhum da burguesia, da população, juízes, exército, nem de ninguém desse Brasil. Já passei guerras, conflitos e revoltas. Já cheguei a funcionar precariamente! Mas fui lá e cedi as margens do Ipiranga pra o Brasil ficar independente de Portugal. ",NEU
108,y8jsmd,brasilivre,mitomitoso,https://www.reddit.com/r/brasilivre/comments/y8jsmd/não_sei_se_perceberam_mas_ta_tendo_uma_corrida_as/,4,3,2022-10-19 21:58:47,"Não sei se perceberam, mas ta tendo uma corrida as lotericas pro consignado do auxilio brasil consignado do auxilio brasil é bom ou ruim?",NEU
109,y6v5h9,BoletimDaCamara,luism6n,https://www.camara.leg.br/proposicoesWeb/fichadetramitacao?idProposicao=2335646,2,1,2022-10-18 00:11:33,[Alexandre Frota - PSDB] PL 2612/2022: O programa Auxilio Brasil fica prorrogado por tempo indeterminado os benefícios financeiros decorrentes deste programa para as pessoas que já o recebem desde que não haja alteração na condição sócio econômica da mesma. ,NEU
110,wlgtks,BoletimDaCamara,luism6n,https://www.camara.leg.br/proposicoesWeb/fichadetramitacao?idProposicao=2333914,1,1,2022-08-11 00:11:20,"[Christino Aureo - PP] PLP 109/2022: Dispõe sobre a permanência dos programas Auxilio Brasil, Auxílio Gás dos Brasileiros e Alimenta Brasil. ",NEU
111,qmz9io,u_euamoagronomia,euamoagronomia,https://euamoagronomia.com/por-que-a-pec-dos-precatorios-e-fundamental-para-o-auxilio-brasil/?feed_id=10972&_unique_id=61847ecac9801,1,0,2021-11-04 21:46:02,Por que a PEC dos Precatórios é fundamental para o Auxilio Brasil? ,NEU
112,nnm7cs,brasil,slimpedroca,https://brasil.elpais.com/brasil/2021-05-24/nao-e-doenca-e-fome.html,966,62,2021-05-29 09:12:31,"“Não é doença, é fome”: unidades de saúde de Brasília identificam aumento de busca por pessoas com sintomas que acreditam ser de doença, mas que, na verdade, estão famintas. É mais um dramático impacto da pandemia ",NEU
113,w8z8kx,investimentos,matheusaugomes,https://www.reddit.com/r/investimentos/comments/w8z8kx/governo_pede_a_petrobras_caixa_bb_e_bndes/,89,142,2022-07-26 20:58:51,"Governo pede a Petrobras, Caixa, BB e BNDES antecipação de dividendos para bancar auxílios esse tipo de coisa me deixa tentado a abandonar o investimento em estatais. Atualmente só tenho o BB em carteira, mas a vontade nessas horas é de não ter nem ele. O uso dessas empresas pra compensarem cagadas governamentais é nojento. Inclusive o que estão fazendo dessa vez é, até onde eu saiba, inédito

""O governo solicitou às principais estatais federais –Petrobras, BNDES, Banco do Brasil e Caixa Econômica Federal – que antecipem parte dos dividendos que seriam pagos apenas em 2023, retirando receitas que seriam recebidas pelo próximo mandato.

O pedido faz parte de uma tentativa de neutralizar neste ano os efeitos da emenda constitucional que liberou R$ 41,25 bilhões às vésperas da eleição e das renúncias fiscais decorrentes da desoneração de combustíveis.""  


[https://www1.folha.uol.com.br/mercado/2022/07/governo-pede-a-petrobras-caixa-bb-e-bndes-antecipacao-de-dividendos-para-bancar-auxilios.shtml?utm\_source=twitter&utm\_medium=social&utm\_campaign=comptw](https://www1.folha.uol.com.br/mercado/2022/07/governo-pede-a-petrobras-caixa-bb-e-bndes-antecipacao-de-dividendos-para-bancar-auxilios.shtml?utm_source=twitter&utm_medium=social&utm_campaign=comptw)  


aqui o link sem paywall: [https://12ft.io/proxy?q=https%3A%2F%2Fwww1.folha.uol.com.br%2Fmercado%2F2022%2F07%2Fgoverno-pede-a-petrobras-caixa-bb-e-bndes-antecipacao-de-dividendos-para-bancar-auxilios.shtml%3Futm\_source%3Dtwitter%26utm\_medium%3Dsocial%26utm\_campaign%3Dcomptw](https://12ft.io/proxy?q=https%3A%2F%2Fwww1.folha.uol.com.br%2Fmercado%2F2022%2F07%2Fgoverno-pede-a-petrobras-caixa-bb-e-bndes-antecipacao-de-dividendos-para-bancar-auxilios.shtml%3Futm_source%3Dtwitter%26utm_medium%3Dsocial%26utm_campaign%3Dcomptw)",NEG
114,yrtmap,brasil,Low_Yard_7777,https://www.reddit.com/r/brasil/comments/yrtmap/nesses_ultimos_2_dias_estou_tendo_total_certeza/,199,88,2022-11-10 19:22:34,"Nesses ultimos 2 dias estou tendo total certeza de que liberal odeia pobre. Eu vi liberal reclamar do auxilio brasil na era bolsonaro e agora estou vendo reclamarem do Bolsa familia do Lula, que é quase o mesmo fucking valor.

Eu sinceramente não entendo, não é possível que a fome das pessoas seja tão irrelevante assim para essa galera, e eu ressalto que eles reclamaram no governo bolsonaro também para destacar o fato de que eles odeiam auxilio não importa o governo, mas mais do que isso, eles odeiam pobre de um jeito radical. Eu não vejo eles falando pra diminuir o salario dos militares, do funcionalismo público, das verbas para empresas, ele só querem diminuir o gasto com quem passa fome, INCRÍVEL.

&#x200B;

https://preview.redd.it/plmc1kyg87z91.png?width=597&format=png&auto=webp&s=daf95f4b503a993529a6bc46a40a40cc906d554f",NEG
115,mafi7w,brasilivre,cambeiu,https://www.reddit.com/r/brasilivre/comments/mafi7w/perspectivas_de_um_brasileiro_em_singapura/,116,89,2021-03-22 02:05:27,"Perspectivas de um brasileiro em Singapura Como diz o titulo, eu moro em Singapura, um pequeno pais Asiatico com a mesma area fisica que o municipio de Mogi das Cruzes, mas com uma populacao de 5,7 milhoes de habitantes.

Hoje a nossa media mensal e' de 10 novos casos de COVID por dia. Praticamente todos importados (Singaporeanos voltando do exterior e trazendo a doenca). Transmissao de COVID dentro do pais praticamente nao existe. Hoje a vida em Singapura e' praticamente normal.[O comercio esta 100% aberto](https://www.youtube.com/watch?v=GW1UlCzqpGU), assim como restaurantes, bares, piscinas publicas, praias, parques, cinemas, etc...So' que todo mundo usa mascara e  tem o aplicativo ""[Trace together](https://www.tracetogether.gov.sg/)"" instalado no celular. Hoje absolutamente ninguem aqui fica preocupado de morrer ou perder alguem por COVID. Eu pessoalmente nao conheco uma unica pessoa aqui em Singapura que tenha contraido COVID.

Mas nem sempre foi assim. A um ano atras a media de novos casos de COVID em Singapura era de 1,000 por dia. Temendo a sobrecarga e eventual colapso do sistema de saude em um pais com grande densidade populacional e com muitos idosos, o governo agiu rapido e de forma decisiva.

No dia 9 de April de 2020 o primeiro ministro Lee Hsien Loong (formado em matematica e mestrado em ciencia da computacao) [veio em rede nacional anunciar um lockdown de 30 dias](https://youtu.be/IzLWFY8wivA).  Esse lockdown seria seguido por uma re-abertura gradual dividida em 3 fases. Durante esse lockdown, as pessoas so' podiam sair de casa para fazer compras essenciais. So' isso e nada mais. Voce nao podia sair para ir visitar parentes, amigos, namorada, nada. E a punicao por desobediencia era cadeia [e muita gente foi presa](https://www.todayonline.com/singapore/robertson-quay-incident-2-more-charged-gathering-drink-chat-during-circuit-breaker). Um auxilio emergencia foi colocado em pratica para cobrir as pessoas que nao podiam trabalhar e as aulas eram conduzidas via video conferencia.

Resultado dessa politica: Desde o inicio da crise ate agora, [30 pessoas em Singapura morreram de COVID](https://www.worldometers.info/coronavirus/country/singapore/) (Mais de 800 mortos em Mogi das Cruzes, que tem 500 mil habitantes). Todos os casos novos sao importados, transmissao interna praticamente nao existe, o comercio esta completamente aberto e funcionando e as escolas estao abertas e conduzindo classes dentro das salas de aula. Nao houve superlotacao de UTIs, nao faltou oxigenio e nao faltou remedio para entubacao. Hidroxocloroquina e vermicida NUNCA sequer foram cogitados por aqui. Acho que o medico que levantar esse topico por aqui perde a licenca e pode ate ser mandado para o hospicio. A vacinacao esta ocorrendo, mas sem urgencia ou panico, ja' que a taxa de contaminacao e' baixissima.

A expectativa e que todos nos estaremos vacinados ate Julho ou Agosto e quando isso acontecer, as ultimas restricoes sobre COVID (uso obrigatorio de mascaras e apps no celular) devem ser suspensas.

Eu aceito argumentos criticos sobre a etica e legalidade de lockdowns, sobre o aspecto da liberdade, etc... Acho que sao argumentos validos e que devem ser discutidos honestamente.

Mas se voce vier com o argumento de que lockdowns nao funcionam, eu vou apontar para a minha experiencia em Singapura e para os resultados em todos os outros paises asiaticos que nao fizeram lockdowns meia-boca.",NEU
116,k7c7rp,brasil,oldyellowcar,https://www.reddit.com/r/brasil/comments/k7c7rp/tjsp_aprova_criação_de_auxíliosaúde_de_r_400000/,266,54,2020-12-05 15:00:43,"TJ-SP aprova criação de auxílio-saúde de R$ 4.000,00 aos magistrados do estado Como um mero serventuário desta corte essa notícia me inoja de uma maneira que vocês não tem ideia. No começo de 2020 (antes da pandemia) os servidores sequer tiveram a reposição inflacionária de seus salários, e já falaram que em 2021 também não terá. Sempre a mesma desculpa: falta dinheiro. Eu aceitei de boa, entendo a crise que estamos passando, mas agora ver esse auxilio que eles se deram no meio de uma FUCKING pandemia é um tapa na cara da sociedade. Enfim, so queria falar aqui que eu to puto pra cacete com isso.",NEG
117,jvr3mf,brasilivre,dokkan_throwaway,https://www.reddit.com/r/brasilivre/comments/jvr3mf/voto_pela_internet_ou_pelo_celular_é_a_maior/,95,57,2020-11-17 07:58:45,"Voto pela internet ou pelo celular é a maior idiotice que existe e quem defende isso não tem cérebro Deixa eu começar falando que eu sempre gostei do Barroso, mas ultimamente o cara tem dado umas cagadas feias.

Já boto o TLDR no começo: Voto pela internet só vai piorar os currais eleitorais

Não vou falar de fraude, hacking, ou seja o que for. Segundo os nossos donos, o sistema é seguro. Teve que mudar tudo pra ser contado em Brasília, mas é porque o sistema é muito seguro. Inclusive tem um rant bom do Oinegue sobre isso aqui (https://www.youtube.com/watch?v=_TSBV9HKGOU) pra quem tiver interesse.

Mas esquece a segurança do processo. Vamos falar de fatos, coisas que estão acontecendo agora, nesse ano.

Fato: As milícias controlam 57% do território carioca. (https://g1.globo.com/rj/rio-de-janeiro/noticia/2020/10/19/rio-tem-37-milhoes-de-habitantes-em-areas-dominadas-pelo-crime-organizado-milicia-controla-57percent-da-area-da-cidade-diz-estudo.ghtml) Nas áreas controladas pela milícia, o cidadão tem que comprar gás mais caro com eles, pagar as taxas deles, fazer o que eles mandam ou então é vala. Com o auxílio emergencial que foi liberado esse ano, as milícias estavam **fazendo o cadastro dos moradores e ficando com o auxílio pra elas**. (https://jornalpovo.com.br/2020/04/19/milicia-mira-no-auxilio-emergencial/) 

Imagina agora com a eleição por celular. Ao invés de ter fila na seção eleitoral, vai ter fila na loja do gás da milícia, pra você votar na frente deles, e se não votar vai pra vala. Você quer mais milicianos no poder? Porque é assim que você tem mais milicianos no poder.

Isso só considerando as áreas dominadas por milícia. O mesmo vale pra áreas dominadas pelo tráfico. As filas vão ser na boca de fumo. Você quer mais pastores no poder?

Isso pensando só no Rio de Janeiro. Agora expande isso pro interior do Brasil. To falando aquela cidadezinha no meio do nada com 30k habitantes, onde quem manda é o dono da fazenda ou o delegado. Sabe quem vai sempre ganhar as eleições? Pois é. Se antigamente eles recolhiam os títulos dos trabalhadores e votavam por todo mundo, agora vai ser com os celulares. Ou então vão colocar um único computador com acesso à internet e obrigar todo mundo a votar em quem quiserem.

E quanto ao crime hediondo absurdo de se tirar uma foto da urna quando se vota? Pois é, as eleições vão passar a ser shows de prints, com candidatos pedindo ativamente por prints do voto pra poder te colocar naquela fila da operação pelo SUS. Não votou nele? Que pena, tenta novamente em 4 anos.

É tanta merda nessa idéia que não dá pra entender como que os grandes meios de comunicação estão comprando essa porra sem nem pensar um segundo.

A santidade do segredo do voto vai pro caralho. A segurança que se tem de se votar anonimamente, sem ninguém estar vendo, vai pro caralho. 

A idéia é ruim, e quem defende isso deveria ter vergonha.",NEG
118,pq3yng,brasilivre,Legitimate-Mud-60,https://www.reddit.com/r/brasilivre/comments/pq3yng/a_culpa_é_do_bolsonaro/,44,50,2021-09-17 13:52:34,"A culpa é do Bolsonaro? Vejamos a Argentina, o governo de lá que é de um perfil semelhante ao do Haddad, simplesmente fez tudo aquilo que a esquerda defendia para o Bolsonaro fazer: Quarentena mais estrita e duradoura, Controle de preços, proibiu demissões, maior auxilio emergência e no final das contas a Argentina está hoje bem pior economicamente do que o Brasil e ainda possui uma taxa de mortalidade do Covid próxima a do Brasil.

Inflação anual (julho/21): 50% (Brasil 9%)
PIB 2020 : -10% (Brasil -4%)
Mortalidade Covid (mortes por milhão) : 2.416 (Brasil 2.693)",NEG
119,v1tvpu,brasil,eltopoquegira,https://www.reddit.com/r/brasil/comments/v1tvpu/vocês_conse4guem_viver_relativamente_bem_no/,32,36,2022-05-31 13:14:50,"Vocês conse4guem viver relativamente bem no Brasil atual? Eu fico pensando nisso as vezes. Eu sou um estagiário que ganha só 550 pra ficar 6:30 na porra da empresa. Ainda ganho uma bolsa auxilio de 350 da faculdade, coisa que eu não deveria receber já que faço estagio, mas estou nisso pela necessidade e não por ser aproveitador.  Estou devendo bancos por causa de empréstimos que fiz pra ajudar minha mãe, e estou devendo cartões que deixei de pagar as parcelas porque tive de escolher pagar aluguel e compra comida. Falando em aluguel, o senhorio corno decidiu aumentar o valor, sendo que ele nem compra uma corda de varal... 

&#x200B;

Enfim, queria saber se vocês vivem bem ou se estão na merda que nem eu. As vezes sinto que não tenho como sair dessa situação. Desculpe se esse tipo de post esta fora dos padrões da comunidade. Agradeço desde já.",NEG
