,id Post,Subreddit,Autor,Link,Upvotes,Comentarios,Data,Contexto,Classe Sentimento
142,zw1wo6,EuSouOBabaca,LumiyLunatic,https://www.reddit.com/r/EuSouOBabaca/comments/zw1wo6/confusão_na_véspera_de_natal_estou_errada/,5,5,2022-12-26 21:43:13,"Confusão na Véspera de Natal. Estou errada? Olá, tenho 19 anos, estou preste a começar a faculdade ano que vem, trabalhei por um ano em um escritório de contabilidade, quando finalmente sai do trabalho fiquei um tempo procurando por outro afinal no Brasil, infelizmente sustentar uma vida universitária é algo difícil de se fazer sem apoio então tenho tentado manter todas as minhas economias para o avançar da minha vida acadêmica.
  
Acabei pegando um ""trabalho temporário"" para um final de ano, graças a uma indicação de familiar, em um supermercado e vou ficar nesse supermercado trabalhando 8h nos dias de semana e 6h nos finais de semana com uma hora de almoço.  

Resolveram oferecer esse trabalho pois sabiam que o final de ano era muito pesado para as operadoras de caixa fazerem tudo sozinhas, a começo de tudo, eu tinha sido contratada apenas para embalar os produtos no caixa. Porém ao chegar lá percebi que a situação era completamente diferente, não ajudavamos só na embalagem como também na devolução de produtos e auxilio com as operadoras, sem contar que de vez em quando o gerente pedia para que nós buscassemos alguns carrinhos e cestas pelo supermercado e estacionamento quando estavam em falta.  

Quando cheguei no primeiro dia, descobri que trabalharia com outras seis pessoas, a princípio acabei me dando bem com três garotas (Vamos chamar as mesmas de Eduarda, Júlia e Maria), Eduarda desistiu no primeiro dia porque o movimento era muito pesado, então tínhamos uma pessoa a menos. Tentei fazer amizade com os outros três, duas garotas e uma menino (E esses vão ser Manuel, Rebeca e Ana), mas toda vez que eu se quer falava com eles, simplesmente não me respondiam. Deixei pra lá e mais tarde na hora do almoço, descobri que Manuel, Rebeca e Ana, eram família de uma das conferentes do mercado, sendo Manuel o filho e Ana a namorada, tentei de novo falar com eles mas os três me ignoraram novamente.   
Um dia depois do ocorrido, Júlia começou a se queixar comigo sobre o comportamento de Ana e não busquei a reparar nisso pois sinceramente não estava muito interessada.  

Até que um dia antes da véspera de natal, com o movimento muito alto, acabei passando mal por uma queda de pressão, não estava me aguentando em pé direito e não importa para onde eu olhasse tudo estava branco, não tinha percebido meu estado até realmente parar para tomar água e notar a fraqueza ao me levantar quando peguei a garrafa no chão. Maria notou meu estado e me disse para ir no banheiro, ficar por lá alguns minutos, nesse momento eu aproveitei pra dizer que estava passando mal e ela falou com o gerente por mim. Quando fui ao banheiro, Rebeca foi também e viu como eu estava então perguntou e depois de eu dar uma curta explicação, ela puxou o celular e sentou-se. Maria apareceu para me trazer alguma bebida, viu a Rebeca e depois saiu.  

Fiquei exatamente meia hora no refeitório pois era o tempo que faltava para a gente sair do trabalho, quando me senti melhor para descer, fui até Júlia para ir junto com ela até a parada por precaução de algo e ela me informou que o gerente tinha dado mais meia hora pra elas por conta do movimento, sem escolha do que fazer quis voltar ao trabalho, mas uma das operadoras não permitiu e nesse momento Maria reclamou sobre o fato de os outros (o filho e uma das sobrinhas da conferente, ela não especificou qual, apenas deu uma característica) já terem ido embora mesmo com o movimento alto e o gerente não ter pedido para eles ficarem e do fato que ambas meninas muitas vezes ""escapuliam"" do trabalho, eles chegavam duas horas mais cedo que nós e saiam duas horas mais cedo, disse a ela que não tinha muito o que fazer e a moça do caixa nesse momento também concordou com Maria e falou que tudo bem ela ficar indignada pois elas (as sobrinhas) falaram horrores da gente. Nesse momento meu sangue subiu, já estava mal e ter que lidar com isso me fez ainda mais mal por conta da ansiedade (sou diagnosticada com TAG).  
 Na parada, acabei vendo Rebeca e incrivelmente ela acabou conversando comigo para saber se eu estava bem e eu comentei com ela que a garota tinha dito.   

Na véspera de Natal, tinha saído de casa mal pois ainda estava cansada do dia anterior e acabei não recebendo os melhores comentários da minha mãe pela manhã. Por coincidência, encontrei com Manuel, Ana e Rebeca na parada de ônibus moramos no mesmo bairro e eles estavam com mais um garoto (Esse vai ser chamado de Guilherme), dei bom dia a todos, novamente nenhum deles me respondeu, embora tive a impressão que conhecia o rapaz junto a eles, depois descobri que Guilherme veio substituir Eduarda. Me sentei junto de Rebeca com quem conversei no dia anterior e ela manteve uma conversa comigo por mínimos minutos até se afastar e começar conversar com o grupo. Eles começaram a falar de pegar um Uber e quando chamaram Rebeca até me ofereceu uma carona mas recusei pois senti e percebi que estava nítido que não me queriam por perto.  

Acabei iniciando o trabalho mais cedo para compensar o dia anterior já que fiquei sem fazer o serviço afinal não estava em condições e fiz meu trabalho normalmente. Contudo na hora do almoço as coisas começaram a dar errado, não tinha comido nada, Maria ao meu lado também não havia comido e ironicamente o Manuel, Rebeca e Ana atrasaram para voltar e não tinhamos como fazer a rotação então tivemos que seguir trabalhando, até que nos dez minutos de atraso Júlia falou com uma das conferentes e ela disse que podíamos subir para o refeitório e pediu-me para chamar os outros.  

No meio do caminho acabei encontrando eles e dando a informação, Ana me olhou com uma cara não tão amigável, já os outros nem me responderam. Guilherme também iria subir com a gente e ele acabou me pedindo para mostrar onde ficava o refeitório, pra não deixar o garoto sem saber de nada, mostrei a ele onde ficava tudo (desde o refeitório até a gerência) antes de ir realmente comer algo. Quando fomos pro refeitório encontrei Maria lá e ela me perguntou porque demoramos e eu contei a ela o ocorrido e nesse momento ela também deu uma revirada de olhos como se já imaginasse, acabamos descobrindo também que tinham comido o almoço dela e ela só estava sobrevivendo com algumas coxinhas que a padaria deu, então comprei alguns bolinhos para ela.  

Como ela estava em um canto separado presumi que ela nem tivesse conversado com os outros. Guilherme perguntou se já me conhecia e nesse momento nós dois nos demos conta que estudávamos na mesma escola, ao contrário do que imaginei ele foi simpático em todos os momentos e mesmo Maria falando sobre Ana e Rebeca de todas as formas, ele se manteu compreensível.  

Depois disso o dia correu normal, até a hora da saída, como eu era a única que tinha o costume de levar pouca coisa fui a primeira a chegar na parada de ônibus e logo após o grupo chegou, eram 7h da noite, já estava tudo escuro e a parada ficava em um local sem iluminação. Como fiquei encostada em uma parte do muro, o grupinho ficou ao lado, sentados na calçada de uma loja fechada. Até que Ana se levantou, tocou meu ombro pedindo licença, antes mesmo de eu tirar meu fone ela já tinha começado a falar sobre ""Que não sabia o que tinha feito mas que eu devia fazer meu trabalho e não olhar para o dos outros"", nesse momento eu dei um suspiro e expliquei a ela que se fosse pelo que aconteceu no almoço só tinham me pedido para chamar e ela falou que não era por isso e sim pelo que comentei com a Rebeca e respondi a ela que o que eu havia comentado era o que tinha acontecido no trabalho e que se quisesse podiamos resolver no trabalho. Ela retrucou dizendo que havia acontecido na rua e que queria resolver na rua e nesse momento foi onde eu já sabia que ela não queria conversa, pedi desculpas dizendo que podia tentar fazer não voltar acontecar e  nesse momento ela falou que ""eu não deveria fazer fofoca"" e aí eu perdi a cabeça, disse a ela que para início da conversa o que eu tinha comentado com a irmã dela era algo que me falaram e que só tinha dito uma característica (que a irmã dela também tem) e que se realmente fosse o problema isso eu sentia muito e podíamos resolver no trabalho, ela voltou a dizer que tinha ouvido as coisas na rua e eu lhe respondi que então atinhamos um problema pois as coisas que eu ouvi foi no trabalho e que nem o nome dela eu se quer sabia pois todas as vezes que eu falava com ela, ela me ignorava. Nesse momento, ela colocou a mão no peito dizendo que nunca havia escutado uma vez se quer me ouvir falar com ela, apenas respondi ""Sério? Poxa, é uma pena, eu sinto muito que você se sentiu ofendida mas infelizmente essas coisas acontecem no trabalho do mesmo jeito que me disseram que vocês também falavam horrores da gente, que nem havia sido uma das meninas mas a própria caixa do mercado e que se quisesse podiamos resolver no trabalho"" e nessa hora ela ficou irritada, começou a mexer as mãos e falar coisas que eu sinceramente não quis ouvir pois minha ansiedade estava atacando.

No final apenas me levantei dei uma boa noite, falei que não iria ficar ali discutindo no natal. Saí andando, mas antes dei meia volta e gritei ""Um bom Natal!"" e obviamente resmunguei o mais alto possível que ""Nunca vi alguém querer discutir com desconhecidos no Natal"", não sei se escutaram mas sei que não foi a melhor situação, que não agi no bom-senso e que quando sai de lá estava com o peito doendo e com uma tremenda falta de ar.  

Vou voltar a trabalhar novamente nessa quinta e sinceramente estou me perguntando se deveria tentar apaziguar as coisas, mas ao mesmo tempo ainda sinto aquela dor no peito quando lembro e isso me deixa ainda mais chateada.",NEG
143,jpbcte,brasilivre,peanut_the_scp,https://www.reddit.com/r/brasilivre/comments/jpbcte/na_minha_opnião_as_chances_do_bolsonaro_se/,18,22,2020-11-06 16:14:37,"Na Minha Opnião as Chances do Bolsonaro se re-eleger em 2022 é alta, leia antes de criticar Todo mundo sabe que o Trump Perdeu, e a Lacração LGBTexto, Army KPOP BTS, foi a loucura falando que o Bonoro vai perder 2022, na minha opnião não, por alguns motivos

1-Eu chamo isso de Efeito Boulos ou Efeito Napoleão:

É bem Simples de Explicar, basicamente o canditado mais provavel é de esquerda provavelmente o PT, O negocio é que diferente dos EUA, o Brasil tem um Odio gigante do PT ou da esquerda em geral, Por Isso Efeito Napoleão, pq basicamente varias pessoas se votariam no bolso só pro pt n ganhar, meu pai votou no NOVO em 2018 no Primeiro Turno mas ele votou no Bonoro no segundo, eu tmb chamo de efeito boulos, pq se ele chegar ao segundo turno grande parte das pessoas que votam em outros partidos votariam pro oponente dele no segundo turno

2-PT

o PT é provavelmente o partido mais odiado desse país, se eles chegarem no segundo turno ele vão perder, se tentaram botar o lula na presidencia, vão perder mais feio, Diferente dos Democratas nos eua o PT é cheio de acusações e provas de corrução, isso causaria o Efeito Napoleão e o efeito do mal menor no segundo turno, o mal menor sendo o Bonoro, até eu que não vou votar em 2022, votaria no Bolso se o PT chegar no segundo turno só pro PT n chegar pq o Bonoro é ""Menos Corrupto"", isso prova como esse país é fudido

3-O Distanciamento da Esquerda e do Trabalhador:

Desde o Inicio a Esquerda defendia o trabalhador, hoje é o contrario, em vez de querer ajudar o trabalhador ou os pobres a esquerda se importa mais com problemas de ""Primeiro Mundo"" ( Racismo e Homofobia), Eu **NÃO** estou falando que racismo não é um problema, mas o trabalhador ve a esquerda falando de Racismo e Transfobia e a Caralha quatro e olha pro bonoro falando em Lei e Ordem e Pobreza e as outras caralha quatro que é mais importante é pensa

""Esse Cara parece q se importa mais com os problemas atuais, e vou votar nele""

E vamos falar a verdade, no final do dia acabar com a pobreza pq a pobreza leva a falta de educação que leva a, a Ignorancia, que leva a discriminação

O unico partido de esquerda que realmente defende o Trabalhador é o PCO, a Base de apoio da esquerda é o nordesta, q é ironico pq o Povo Nordestino tende a ser conservador,Religioso e Patriarcal, (alguns até Homofobicos) bem contrario ao Feminismo e LGBTismo PSOLista de hoje em dia, e foi só o Governo da Auxilio  que a aprovação do governo subiu

Ironicamente a Esquerda que falava pra pegar em armas e trazer a revolução do trabalhador, hoje fala em Des-armamento e seria massacrada se tentassem fazer sua ""Revolução""",NEG
144,i0bdbi,brasil,le_demarco,https://www.reddit.com/r/brasil/comments/i0bdbi/ok_eu_não_sou_um_economista_mas_eu_tenho_algumas/,14,23,2020-07-29 20:38:44,"Ok eu não sou um economista, mas eu tenho algumas coisas que me fazem contra a nova cédula, se alguém tiver algo para comentar por favor escrevam. Ok, eu sou contra a nova cédula por vários motivos, eles são:

\*A intenção dela deve ser para circular mais dinheiro na economia estagnada do Brasil, tipo, digamos que eu saquei o auxilio emergencial em três notas de 200 e fui ao mercado e paguei com uma nota de 200 eu vou receber 58 reais de troco (por exemplo) eu vou tá carregando mais dinheiro e se eu for pegar um taxi o cara provavelmente não vai ter troco pra mim portanto ele vai ficar com uma nota alta  e assim vai. Iria circular mais notas de cunho alto mas isso literalmente não resolve nada, só porque pessoas estão carregando cedulas de alto cunho não significa que elas estão ""mais ricas"" ou com maior facilidade quando for comprar algo, oque quero dizer aqui resumindo é que notas de menor valor iriam ser menos circular menos.

\*Ela não desvalorizaria o real? Tipo, já que ninguem tem dinheiro nas contas agora quase ninguem conseguiria sacar ela portanto teria dinheiro parado que teria um impacto desvalorizando o real portanto aumentando a inflação que não poderia ser corrigida já que ninguem tem dinheiro para acertar os salários.

\*Não tem o cão caramelo nela, bah isso é só vacilo mesmo hahahaha.

Avisando novamente eu não sou um economista e meus conhecimentos de economia não passam de uma aula de educação financeira na sexta série. Se alguém souber o motivo do por qual ela deveria ou não ser criadas por favôr contribua deixando um comentário :)",NEU
145,ypsqac,brasilivre,v0dueprajacu,https://i.redd.it/swjzsgrphry91.jpg,14,4,2022-11-08 14:25:20,Essa é para aqueles que acreditam em artista que vive de arte ruim. ,NEU
146,r2braj,brasilivre,EqualAssociate,https://www.reddit.com/r/brasilivre/comments/r2braj/na_monarquia_pagávamos_15_do_ouro_hoje/,6,14,2021-11-25 22:39:14,"Na monarquia pagávamos 1/5 do ouro, hoje trabalhamos 4 meses e 29 dias só pra pagar imposto. Que bela ""democracia liberal"". Só pra deixar claro, não sou a favor da monarquia, foi só um insight que eu tive vendo um vídeo no yt que infelizmente fez até um sentido. Ignorando todos os benefícios que o estado democrático brasileiro trazem ( que são poucos ) a monarquia te roubava menos  :/",NEG
147,r55tql,brasil,Fornicatron,https://www.reddit.com/r/brasil/comments/r55tql/recomendação_de_notebook_entre_2_e_3_mil_reais/,7,13,2021-11-29 18:13:14,"Recomendação de notebook entre 2 e 3 mil reais para trabalho/lazer leve Boa tarde, r/brasil. Minha querida mamãezinha me pediu auxilio para comprar um notebook, já que ela está há um bom tempo sem e está querendo adquirir um novo.

Ela não precisa de nada muito potente, vai ser para utilização da internet e pacote office.

Minha duvida é que eu realmente não entendo bulhufas de notebook, não faz muito tempo até estava vendo um para mim, para tudo em comparação com desktop high end, que acaba fugindo muito do propósito atual.

Eu pensei nesse valor porque seria provável conseguir com um processador um pouco mais recente, o que certamente daria mais vida útil ao aparelho, entretanto, pesquisando aqui existem mais opções do que eu consigo julgar adequadamente.

Alguém aqui do sub possui alguma sugestão? Não tenho nenhuma preferência por marca nem nada, só gostaria que fosse um hardware que dure sem começar a travar daqui seis meses.

&#x200B;

Edit: Quem tá dando Downvote aqui não deve ter mãe não, né?",NEU
148,si2fic,brasilivre,Uncle_Sam_Sung,https://www.reddit.com/r/brasilivre/comments/si2fic/o_que_acham_do_novo_benefício_empresarial_auxílio/,7,11,2022-02-01 15:53:15,"O que acham do novo benefício empresarial: ""Auxílio Transição de Gênero"" Bom pessoal, pra quem não sabe, o iFood oferece há alguns meses o Auxílio Transição de Gênero, que oferece ajuda monetária com custos de hormônios, passando por custeio de cirurgias até auxílio jurídico.

Alguém trabalha lá poderia nos contar um pouco mais? Achei bem estranho esse benefício, mais por ele ser específico assim, tipo nuns moldes de ""auxílio cabelo crespo"" ou ""auxílio havaianas, pra quem gosta de usar chinelo""... mas pelo que vi tem até auxilio pra pet lá, então nunca se sabe.

No caso, iFood é no estilo Governo do Brasil que o salário já é alto e ainda tem milhares de penduricalhos ou é meio no estilo iFode, aquele do entregador que não direito nenhum",NEU
149,wg6ls9,farialimabets,Firmao_Olinda_PE,https://www1.folha.uol.com.br/mercado/2022/08/bolsonaro-sanciona-autorizacao-para-consignado-no-auxilio-brasil.shtml,5,5,2022-08-04 14:09:48,Bolsonaro sanciona autorizaÃ§Ã£o para consignado no AuxÃ­lio Brasil ,NEU
150,xmxhqt,farialimabets,Smooth-Disk-3656,https://www.reddit.com/r/farialimabets/comments/xmxhqt/compilado_bet_xyz_eleições_br/,9,3,2022-09-24 13:37:38,"Compilado Bet xyz: eleições BR Fala confrades, dado que existem diversas oportunidades de ganhar muita grana ~~na verdade ter aquele loss monstro~~com as eleições, por que não lançarem as sugestões de casas de apostas que estão rolando todas por aqui? Vale também falar quais são mais e menos confiáveis, termos de pagamento ~~e também dicas de agiota quem emprestem para aposta~~",NEU
151,uilo3j,circojeca,HomemSegredo666,https://www.reddit.com/r/circojeca/comments/uilo3j/sim_estou_tentando_fugir_do_brasil/,16,4,2022-05-04 22:13:24,Sim Estou tentando fugir do Brasil Sim Estou tentando fugir do Brasil desde que os politicos comecaram a praticar as perseguiçoes os crimes que eu (escrevi nas postagens anteriores a esta )contra mim ainda nao fui porque nao tenho dinheiro ja solicitei as medidas protetivas contra os politicos e ainda nao me deram .Os funcionarios (as) publicos os medico INSS e os medicos (as) psiquiatra os politicos roubaram meu dinheiro.O Bolzonaro mandou o medico INSs os medicos psiquiatras roubar meus auxilio doença para dar para os benefiarios do auxilio Brasil eles tinham que dar os salarios deles para o auxilio Brasil e nao roubar o meu dinheiro.tive que usar meu titulo eleitor de  papel higiénico no banheiro e estou precisando de mais papel para usar no banheiro se quiseresm me dar mais titulo de eleitor vou usar no banheiro faz quase um ano que nao estao pagando meus salarios e o ministerio publico ainda nao mandou prender os criminosos porque nao e o salario  do presidente do prefeito dos politicos dos deputados senadores vereadores do exercito etc que nao estao pagando que estao roubando. Roubar salario de mulher doente e sozinha é facil Quero ver os corajosos que estao roubando meus salarios parar de pagar os salarios dos vereadores deputados senadores STF ministerio publico policia federal juizes militares exercito e mandar eles contratrar um advogado e colocar o salario deles para receber  em precatorio.Estou aceitando refugio de guerr. A ONU precisa perguntar se algum pais quer me oferecer refugio de guerra e acolhimento e declarar o Brasil Zona de tortura e crime de guerra .,NEG
152,h7bgp1,brasil,R0botics,https://www.reddit.com/r/brasil/comments/h7bgp1/não_a_culpa_não_é_do_brasileiro/,45,15,2020-06-11 22:40:23,"Não, a culpa NÃO é do brasileiro. Bom dia/tarde/noite, recentemente eu estava visitando meus pais depois de um longo tempo sem vê-los. Até então está tudo bem, até que entra no papo de política. Não, meus pais não são bolsominions ou algo do tipo, eu classificaria eles como ""eu não gosto do que o governo está fazendo, mas não quero fazer nada e só implorar para que algo aconteça"".

Ok, mas o que isso tem a ver com política? O que aconteceu é que apareceu uma notícia na TV mostrando o furdúncio de pessoas no centro de uma cidade, logo depois começou os comentários dos meus pais:

>Olha essa gente na rua, só o brasileiro mesmo!  
>  
>O brasileiro não tem jeito mesmo...

E coisas do tipo.

Resolvi colocar minha posição a fora, basicamente falando que as pessoas ali só estão fazendo isso por 3 motivos (que eu imagino): 

\- A grande maioria não possui um grau de educação muito elevado e se tem provavelmente é de má qualidade;

\- Muitas pessoas ali não recebe nenhum tipo de suporte financeiro (exemplos: não recebeu auxilio do governo, não tem nenhum tipo de dinheiro guardado) ou alimentício (pessoas faltando comida ou algo assim);

\- O nosso presidente literalmente implora para as pessoas saírem de casa, pode parecer bobo para alguns, mas o presidente pedindo para as pessoas saírem para alguns é o mesmo que mandar sair (só lembrar do [caso Trump com desinfetante](https://www.uol.com.br/vivabem/noticias/redacao/2020/04/25/ny-tem-30-chamados-por-ingestao-de-desinfetante-melhor-prevencao-e-higiene.htm).

Com isso eu sintetizei que **a culpa não é do brasileiro**, ser brasileiro não quer dizer absolutamente nada, ser brasileiro não faz ninguém diferente ou inferior a qualquer outro ser humano, nosso país se encontra aonde está pois a **elite quer assim**. Com isso eu inicio uma discussão gigante comigo defendendo a educação e dizendo que é essencial lutar por ela.

Nunca parei para pensar o quão danoso é a ideia de que a ""culpa é do brasileiro"" ou que o ""Brasil é um caso separado"", vejo que em todo lugar isso se fala verbal ou não verbalmente, as pessoas falam isso (de várias formas, como o próprio brasileiro não presta, ou o Brasil não consegue fazer isso, ou o ""jeitinho brasileiro""), programas de TV dão a entender isso (novelas muitas vezes ridicularizam o povo, como exemplo), o governo tenta mostrar que somos dependentes dele e assim vai.

Até se olharmos para a história, grande parte dos eventos históricos no Brasil tratam o povo como incapaz, esses momentos históricos eu divido assim:

\- Os que ""venceram"" (entenda vencer como o grupo que consegue algo que quer): vide Getúlio Vargas e a CLT, vide a primeira república com os militares, vide a ditadura militar, assim vai, quase nada de participação popular;

\- Os que perderam: os farroupilhos (teve bastante participação da elite, mas teve grande participação do povo também), conjuração baiana, guerra de canudos, balaiada, revolta da chibata e muitos outros (muitos MESMO).

Dá para ver que o brasileiro perde sua autoestima, não só como nação, mas como humanos.

Disso é fácil ver o porquê desse papo de ""salvador"" ou ""messias"" no governo, a repressão na história é tão grande que o brasileiro começa a se sentir inferior diante o governo (necessitando dessa ""ajuda sagrada"") e diante o mundo (desqualifica a própria cultura, gerando esse complexo de vira-lata).

Vou colocar aqui minha opinião final sobre o Brasil e o brasileiro: o Brasil NUNCA vai melhorar (para o povo) enquanto o próprio povo não se erguer sobre isso\*, povo eu quero dizer TODO ele (ou pelo menos uma parte gigante), o Brasil é um país lindo com uma cultura linda, a cultura DO POVO é linda, a elite NÃO representa o Brasil, nem NUNCA vai, eles querem colocar a ideia de que o brasileiro é ruim, mas isso é só uma forma de expressar os próprios defeitos nojentos.

Não me confunda com um nacionalismo cego, o brasileiro não é superior a outros seres humanos, **ele é igual a todos eles**, eu acredito que o potencial humano é infinito, por isso **o potencial brasileiro também é infinito**.

Obrigado pela leitura.

\* Como vai ser erguer? Não sei.",NEG
153,vvgyd7,brasil,REDEY3S,https://www.reddit.com/r/brasil/comments/vvgyd7/trabalho_ti_intercâmbio_inglês/,0,3,2022-07-09 23:04:20,"Trabalho TI / Intercâmbio inglês Sou Brasileiro Nato, Português Naturalizado.

Já tirei o cartão cidadão portugues.

&#x200B;

Moro no brasil ainda não visitei nenhum local da união europeia, tenho algumas dúvidas.

&#x200B;

Sou bacharelado, o certificado é valido em portugal?

&#x200B;

Tenho algum auxilio de moradia pelo governo?

&#x200B;

Qual local da UE, é valido fazer intercambio para aprender inglês? com idioma inglês nativo.

&#x200B;

Qual site além do netempregos e linkedin consigo ver as vagas?

&#x200B;

Desde já agradeço.",NEU
